game,chapter,speaker,text,tag
FE11,00-Prologue4,Soldier,"Er...a trap, sir?",neutral
FE11,00-Prologue4,Captain,"The prince of Altea will be ours. Just do as I tell you, and we'll pluck this royal plum long before the main force can show up to steal all the glory. Heh...",joy
FE11,00-Prologue4,Ruffian,You! Inside!,anger
FE11,00-Prologue4,Gordin,Grrrmph...,neutral
FE11,00-Prologue4,Ruffian,"Heh. I thought Altea was the great ‘ero Anri's kingdom! Didn't take more'n a couple of days to break you, now did it, Gaggles?",fear
FE11,00-Prologue4,Gordin,Mmph! Arrumph!,anger
FE11,00-Prologue4,Ruffian,"What's the matter, Gaggles? Can't talk cause you're gagged, Gaggles? Ba ha ha! I'll letcha in on a little secret. Altea's little princeling is on ‘is way ‘ere right this moment.",anger
FE11,00-Prologue4,Gordin,.....!,neutral
FE11,00-Prologue4,Ruffian,"Ooh, but sad for you, you look awful dangerous in the uniform... MISTER GRA SOLDIER! Ha! Soon as the prince sees you, ‘e'll say, Yow! It's an enemy ambush!-And that'll be the end of you.",fear
FE11,00-Prologue4,Gordin,Gugrrrmph!,neutral
FE11,00-Prologue4,Ruffian,"Once the prince sticks you like a pig, we get to call him Marth the Tyrant, coz ‘e kills ‘is own countrymen.",anger
FE11,00-Prologue4,Ruffian,Won't that be an ‘oot!,anger
FE11,00-Prologue4,Gordin,Rrrmph.,neutral
FE11,00-Prologue4,Ruffian,"So long, Gaggles! Better start praying to your ‘igher deity of choice!",anger
FE11,00-Prologue4,Jiol,"Listen, men. Your target is the prince. Find the prince of Altea and bring me his head served on a shield!",neutral
FE11,00-Prologue4,Marth,Look there!,neutral
FE11,00-Prologue4,Malledus,"No...Anri save us...Of all the places to be beset! Sire, that is Gra's main force- and they are accompanied by the knights of Grust's Sable Order. Our chances of routing them are slim, I'm afraid, and those of slipping away undetected afterward, all but nil...",fear
FE11,00-Prologue4,Marth,Then we've no hope?,neutral
FE11,00-Prologue4,Malledus,I...I can think of one strategy. We could leave a decoy behind for when the enemy catches up.,neutral
FE11,00-Prologue4,Marth,A decoy?,neutral
FE11,00-Prologue4,Malledus,"It's you they're after, sire. Were one of your men to stay behind disguised as you...Well, the enemy ought to take the bait. That would give you, and the others time to escape.",neutral
FE11,00-Prologue4,Malledus,One of your men must make for that fortress on the south highroad. He will act as a decoy by dressing as you and luring the enemy force away.,neutral
FE11,00-Prologue4,Marth,"But Malledus, how will he find his way back to us?",surprise
FE11,00-Prologue4,Malledus,Sire...He may not. You must part with one of your comrades. There is no other way.,neutral
FE11,00-Prologue4,Marth,"...Well, I will find a way! You cannot expect me to agree to...to abandon one of our own to a death at the hands of the enemy. Surely there must be another way...",anger
FE11,00-Prologue4,Malledus,"Forgive me, sire...But this is our only chance. You know as well as I do that you must not die here today.",sadness
FE11,00-Prologue4,Malledus,"No, sire! Get back here! One of your other men must take that position!",neutral
FE11,00-Prologue4,Enemy Soldier 1,Look! It's...it's Prince Marth!,surprise
FE11,00-Prologue4,Enemy Soldier 2,"Oh yeah? Who's that, then? That bloke over there is dressed in the same clothes. Could be either of 'em.",surprise
FE11,00-Prologue4,Jiol,Simpletons! Use your heads! One of them ran; the other didn't. What does that tell you? Easy! The one who stayed behind is trying to buy time for the one who fled.,neutral
FE11,00-Prologue4,Enemy Solider,"So, er...the one who took off is-",neutral
FE11,00-Prologue4,Jiol,"The real prince, you idiot, yes! Hie, troops, after him! Put that craven whip to the sword!",anger
FE11,00-Prologue4,Marth,"Wait! Quickly, Malledus, we must head south and rescue him!",neutral
FE11,00-Prologue4,Malledus,"No, sire. We have to press on.",neutral
FE11,00-Prologue4,Marth,Press on? (Insert name) might be dying back there!,anger
FE11,00-Prologue4,Malledus,"If he were, then why would you be so selfish as to let him die in vain? Honor him, by allowing his life and his choice to mean something!",anger
FE11,00-Prologue4,Marth,......,neutral
FE11,00-Prologue4,Marth,...All right.,neutral
FE11,00-Prologue4,Marth,I will honor him. ...I will go.,neutral
FE11,00-Prologue4,Captain,The prince fled south? Bah! Seems the plum's fallen too far from our tree... No matter. Open the north door! We can still crush the Altean rabble he left behind...,fear
FE11,00-Prologue4,Marth,Blast! That archer was on our side!,anger
FE11,00-Prologue4,Captain,"They killed the captive? Heh heh... What fools! Hie, let's give them the punishment fools deserve! Open the north door! Lure them out and strike them down!",anger
FE11,00-Prologue4,Captain,All but the prince have been slain? Good. Open the north door! The little whelp is ours now!,anger
FE11,00-Prologue4,Malledus,"Sire, there is a village over yonder. Its residents may be willing to help. Why don't you try paying them a visit?",neutral
FE11,00-Prologue4,Draug,"Prince Marth! Make haste, sire!",neutral
FE11,00-Prologue4,Marth,"Draug, is that you? What are you doing here?",surprise
FE11,00-Prologue4,Norne,"Draug, sir! The enemy has crossed the border from the west! They’ll be upon us soon!",fear
FE11,00-Prologue4,Draug,"Right, we’re on our way. Sire, this is Norne. She heard wind of our struggles and wishes to fight for Altea.",neutral
FE11,00-Prologue4,Norne,"Prince Marth, ’tis an honor. By your leave, though, I’ll be savin' the curtsy-bobbin' for later. Quickly, sire!",joy
FE11,00-Prologue4,Jiol,This is...the wrong prince? No! You dare make a fool of me? Kill him! Make this faux prince SUFFER!,anger
FE11,00-Prologue4,Gordin,May I suffer for my sins...,sadness
FE11,00-Prologue4,Marth,Yow! It's an enemy ambush!,fear
FE11,00-Prologue4,Gordin,Rrrgmph mrph!,anger
FE11,00-Prologue4,Marth,"Huh? You've been gagged? Here, I'll get that... Wait, I know you! You're one of our archers, er...",surprise
FE11,00-Prologue4,Gordin,"Gordin, sire! My name is Gordin. The enemy captured me and left me in this mortifying state.",anger
FE11,00-Prologue4,Marth,"I see. Well, I'm glad you're unharmed. But I'm afraid we cannot stay here a moment longer. Stay behind me and-",joy
FE11,00-Prologue4,Gordin,"I can fight, sire! If you have a bow I could use, I would be honored to fight at your side.",joy
FE11,00-Prologue4,Jagen,"Heh, these old bones are still good for something. Farewell, my prince. Live, and grow strong...",neutral
FE11,00-Prologue4,Cain,"Glory to Altea, land of my birth! Farewell, sire! Fortune protect you...",joy
FE11,00-Prologue4,Abel,Good... Altea's hope is restored. Farewell sire. Fortune protect you...,sadness
FE11,00-Prologue4,Frey,"Count this knight honored to die in the service of his prince. Live, sire, and grow strong...",joy
FE11,00-Prologue4,Gordin,"I was dead anyway till you came, sir... If I'm to die again, at least let me die for you. Fortune protect you sire...",sadness
FE11,00-Prologue4,Jagen,"Look, sire. See how Altea shrinks on the horizon...",neutral
FE11,00-Prologue4,Marth,..aven...,neutral
FE11,00-Prologue4,Jagen,I beg your pardon?,neutral
FE11,00-Prologue4,Marth,"I am a craven. Powerless to save my sister, to staunch my kingdom's wounds; to ease my people's fears...",fear
FE11,00-Prologue4,Jagen,"This...was your only recourse, sire. But surely, one day, you will be able to set things right...",neutral
FE11,00-Prologue4,Jagen,Sire...,neutral
FE11,00-Prologue4,Marth,"I will return, Altea! Your prince will return to you one day!",anger
FE11,00-Prologue,Soldier,"Prince Marth... Are you awake? Beggin' your pardon, sire, but the princess has asked to see you.",joy
FE11,00-Prologue,Marth,"Elice? Is she all right?""",neutral
FE11,00-Prologue,Soldier,"She seemed to be, sire, but her words implied a certain urgency. She bade you dress quickly and wait by the throne.",neutral
FE11,00-Prologue,Marth,...Has something happened?,neutral
FE11,00-Prologue,Soldier,"It's our forces off in Gra, sire. There seems to 'ave been some sort of incident, but... Well, I'm not privy to the specifics.",neutral
FE11,00-Prologue,Marth,I see... Thank you. I'll be there shortly.,joy
FE11,00-Prologue,Marth,My sister said she would meet me by the throne.,neutral
FE11,00-Prologue,Marth,"An incident in Gra... If Elice had news of our father, I pray it's good news...",sadness
FE11,00-Prologue,Enemy Soldier,"O'er there, that's him! Prince Marth!",neutral
FE11,00-Prologue,Marth,Wha- Who are you?!,surprise
FE11,00-Prologue,Enemy Soldier,"We're soldiers of Gra, li'l prince. And if you know what's good for you, you'll surrender to us without makin' any trouble.",sadness
FE11,00-Prologue,Marth,Surrender? But that's ridiculous... Why would I surrender to the army of an allied kingdom?,anger
FE11,00-Prologue,Marth,"I will not. I am the prince of Altea. I will not yield to you or any other nation, here on my own land, under my own castle roof!",anger
FE11,00-Prologue,Enemy Soldier,"Heh, you talk big, brat. Have it your way. If you won't lay down your sword, then we'll just have to take your life instead!",anger
FE11,00-Prologue,Enemy Soldier,What? He is fighting back? I'll show him!,surprise
FE11,00-Prologue,Marth,No! The throne... I have to get rid of him before my sister arrives!,anger
FE11,00-Prologue,Elice,"Marth, are you all right?",neutral
FE11,00-Prologue,Marth,"Sister, what is happening?",surprise
FE11,00-Prologue,Elice,"Steady yourself, Marth. I have grave news. Our father was defeated by the Dolhr-Grust allied forces.",sadness
FE11,00-Prologue,Marth,What? No...,surprise
FE11,00-Prologue,Elice,It was Gra. Our own ally betrayed us and struck Father's army from the rear. I am... I am not sure if he is safe. The scouts who returned gave conflicting reports...,fear
FE11,00-Prologue,Marth,Father...It can't be...,neutral
FE11,00-Prologue,Elice,"As we speak, soldiers sent by Gra are trying to take the castle. Mother and I were separated during the escape. I do not know where she is.",sadness
FE11,00-Prologue,Marth,.....,neutral
FE11,00-Prologue,Elice,"Marth, I need you to listen to me. You must flee the castle. Go on without me.",neutral
FE11,00-Prologue,Marth,What?,surprise
FE11,00-Prologue,Elice,"We've not many soldiers left...This is hard to bear, I know, but the castle is lost. We must face that. I will look for Mother and join you as soon as I can. You find Jagen and get away from here- far away. Understand?",sadness
FE11,00-Prologue,Marth,...All right. But promise you won't be long.,neutral
FE11,10-PrincessMinerva,Maria,"Oh! You must be Prince Marth! (My, he's so dashing!) ...Thank you for rescuing me. Please be sure to tell my sister I am free. She'll be grateful for the news. Now then. Shall we be off? I'm coming with you, of course.; ...No protesting! I wish to help!",joy
FE11,10-PrincessMinerva,Minerva,"Greetings, Prince Marth. I am Minerva of Macedon. Thank you for saving my sister. Maria's plight forced me to treat you as an enemy when I knew you were not; suffice to say, I am deeply sorry for that. ...The whole world has gone mad. Most of Macedon fights for Dolhr now. My own brother Michalis leads them. And on their hands is the blood of their king, my father. They must be stopped; I must stop them. Still, I fear for my soldiers whom I can no longer protect, especially the three Whitewing sisters: Palla, Catria, and Est. Dolhr worried we would rebel, and forced us to separate. If they knew I was safe, they would join your ranks in a heartbeat. We are yours to command, sire. Let us help you defeat Dolhr, and repay them for sullying Macedon's honor.",sadness
FE11,10-PrincessMinerva,Maria,Sister!,neutral
FE11,10-PrincessMinerva,Minerva,Maria... Are you all right?,neutral
FE11,10-PrincessMinerva,Maria,Fine. Have you heard? Marth made me one of his soldiers! Well...I made him make me one.,joy
FE11,10-PrincessMinerva,Minerva,"...What am I going to do with you? Listen to me, Maria... you cannot stay here. It's too dangerous. Real war is nothing like your stories of princes and damsels.",fear
FE11,10-PrincessMinerva,Maria,I'm not going anywhere! I want to stay with you!,anger
FE11,10-PrincessMinerva,Minerva,"Maria, you're being selfish–",anger
FE11,10-PrincessMinerva,Maria,I am not! I'm just...sick of being helpless. I've burdened you long enough. How can I ever help you if you don't give me a chance to be strong? I'm staying here and fighting! No protesting!,fear
FE11,10-PrincessMinerva,Minerva,"...Ha ha. Somehow I knew you would say that. All right, Maria. If you feel that strongly about it, who am I to stop you? All I ask is that you be careful. If you need help, you come find me. Understood?",neutral
FE11,10-PrincessMinerva,Maria,"Of course! Thank you, Sister!",joy
FE11,10-PrincessMinerva,Zharov,"Grrr... Must I do everything myself? Bah! You'll not get past me, rebel!",anger
FE11,10-PrincessMinerva,Zharov,They're a force... to be reckoned... with... Rrgh...,sadness
FE11,10-PrincessMinerva,Nyna,"Marth, have you ever heard of Pontifex Miloah?",neutral
FE11,10-PrincessMinerva,Marth,"The one who defended Archanea with the power of Aura? Of course; he and his magic are famous! But...I read Miloah died in a battle with Gharnef, soon after the fiend sold his soul to Dolhr...",anger
FE11,10-PrincessMinerva,Nyna,"Alas, Miloah did die... But his daughter, Linde, yet lives. I am told she inherited her father's skill with Aura magic- but since the battle with Gharnef none have seen her. Wherever she is, it cannot be pleasant. ...Marth, please. Find Linde. With her father gone, we are the only family the girl has left.",sadness
FE11,06-FireEmblem,Emereus,"What?! The rebels are inside the castle? Grrr…Very well! Armored units: intercept the intruders! Archers: defend the throne! Thieves, you go gather up the treasure while I make preparations to withdraw. You have your orders! Don’t let those rebels anywhere near this chamber!",anger
FE11,06-FireEmblem,Julian,What the- Rickard? What are you doin’ in here?,surprise
FE11,06-FireEmblem,Rickard,"Oh, uh… Hey there, Chief! Been a long time, huh? So, funny story: I decided to break in here and clean the place out- and then I got caught. Hilarious, right? Comedy gold. OK, your turn What are YOU doin’ here?",joy
FE11,06-FireEmblem,Julian,Me? I’ve washed my hands of thievery and joined the forces of justice.,neutral
FE11,06-FireEmblem,Rickard,Ohhh really? Justice? So then this wouldn’t have nothin’ to do with some new lady friend? You always did have a soft spot for a pretty face and the right features-,surprise
FE11,06-FireEmblem,Julian,"Wha- Can it, you little fink! I said it’s about justice! I’m entitled to have moral crisis now and then! …You know what? Just for that, YOU are gonna work for me, startin’ right now.",joy
FE11,06-FireEmblem,Rickard,"What? Do I have to…? Well, all right. You drive a hard bargain, but what can I say? I missed ya, Chief. Just make sure I get a cut out of the haul!",neutral
FE11,06-FireEmblem,Rickard,"…Wow! Really? A prince, you say? Thanks for springin’ me! I’m Rickard, just a small-time thief, mind you, but I’ve got big aspirations! I broke in here to clean the place out, and instead it was me that got my cloak cleaned… Since you saved my hide, I guess the least I can do is lend my services in return.",joy
FE11,06-FireEmblem,Rickard,"So you’re the prince of Altea, then? Hello. I’m Rickard. Just a small-time thief, mind you, but I’ve got big aspirations! Julian asked me to help you out, see, and what the chief says, goes! So here I am.",neutral
FE11,06-FireEmblem,Emereus,Blast! They're upon me! Why didn't those idiot soldiers stop them?!,anger
FE11,06-FireEmblem,Emereus,Rrgh... Why... ?,sadness
FE11,06-FireEmblem,Nyna,"Prince Marth… At long last. I am Nyna of House Archanea. ‘Tis Archanea’s burden to protect the world of crisis- a duty I have striven to fulfill. But Dolhr has laid waste to my kingdom, and now I find myself powerless to stop the world from falling into ruin. Marth… Please, pick up the banner where I have let it fall. Lead your might against Dolhr, and free us all.",sadness
FE11,06-FireEmblem,Marth,"Of course, Princess Nyna. Altea swore fealty to Archanea long ago, a vow we have always kept. And, as you know, it is in my blood – House Altea’s blood – to destroy Medeus just as Anri did before me.",anger
FE11,06-FireEmblem,Nyna,"Thank you, Marth. Then let me give you this. This crest is called the Fire Emblem. House Archanea bestows it only upon a true champion, one we believe has the power to save the world. With it, you gain the right to open treasure chests across the land and wield the precious items within. I know you will use them well. Never give up, Marth. Fight, until the day you restore light to our world.",joy
FE11,17-StarAndSavior,Morzas,"Kee hee hee... Wretched Altean whelp, stumbling home to the slaughter... What fool throws away a life already so preciously bought? Your mother, Liza, is dead; I killed her myself. Your sister Elice lives only because Gharnef wanted her. So what will become of you, little prince? Will you run for your life a second time? Or will you stay this time to die? Emperor Medeus would not put me on this throne if he thought you could remove me from it, kee hee hee...",anger
FE11,17-StarAndSavior,Morzas,Kee hee... Witless human! None defy a mage-dragon and live to speak of it!,anger
FE11,17-StarAndSavior,Morzas,Grrf... I stand... corrected...B ut you still lack the power... to defeat Medeus...,sadness
FE11,17-StarAndSavior,Nyna,Marth! Any word? Have you found your family? Your sister?,surprise
FE11,17-StarAndSavior,Marth,...My sister was taken by Gharnef. She is no longer here... And my...my mother is... She is dead. Slain...by that Dolhrian dragon...,sadness
FE11,17-StarAndSavior,Nyna,"....! Marth, I am truly sorry...",sadness
FE11,17-StarAndSavior,Marth,I thought there would be something...some part of my old life I would be coming back to. I fought so hard...,sadness
FE11,17-StarAndSavior,Nyna,"You fought wonderfully, Marth.",joy
FE11,17-StarAndSavior,Malledus,"...Sire, might I have a moment?",neutral
FE11,17-StarAndSavior,Marth,"All the moments you want, Malledus. What is it?",neutral
FE11,17-StarAndSavior,Malledus,"Your people have gathered outside the castle. They are overjoyed to be free again, sire, and would like very much to see their prince.",joy
FE11,17-StarAndSavior,Marth,"All right, then. I'll go at once.",neutral
FE11,17-StarAndSavior,Nyna,"Marth...perhaps you should let that wait, just until you are able to share their joy with them. We could send someone in your stead-",joy
FE11,17-StarAndSavior,Marth,"No, that would not do. Today is a momentous day for my kingdom and my people. I must celebrate with them now, not later. Anything else would be a disservice to those who died to save Altea. I am a prince before I am a son or a brother. Come, Malledus. Let us go greet my people.",neutral
FE11,24x-TheAlterspire,Marth,This must be the tower Lord Gotoh spoke of...,neutral
FE11,24x-TheAlterspire,Malledus,"Sire, it’s teeming with soldiers... Who are they? They fly no recognizable banner.",surprise
FE11,24x-TheAlterspire,Marth,They are the Keepers whose test I must pass.,neutral
FE11,24x-TheAlterspire,Malledus,"You mean to fight them, then?",neutral
FE11,24x-TheAlterspire,Marth,Gotoh says we must prove ourselves. Very well; we’ll seize the tower. Follow me!,neutral
FE11,24x-TheAlterspire,Malledus,"Sire, look! Stairs beneath the throne! Where could they lead?",fear
FE11,24x-TheAlterspire,Malledus,...Do you think this is the coffin?,surprise
FE11,24x-TheAlterspire,Marth,There are no others. And look: these markings around it are the same pattern we saw in the Fane of Raman...,neutral
FE11,24x-TheAlterspire,Malledus,"Hmm, you’re right...",neutral
FE11,24x-TheAlterspire,Marth,We found a dragon girl in the fane... I wonder if these symbols-Huh?!,surprise
FE11,24x-TheAlterspire,Malledus,Sire! The coffin... It’s opening!,joy
FE11,24x-TheAlterspire,Marth,"What? No! It must be some kind of trap, or... or some kind of... er...",surprise
FE11,24x-TheAlterspire,Marth,...woman? Could she be the master Gotoh spoke of?,surprise
FE11,24x-TheAlterspire,Nagi,...Who are you?,surprise
FE11,24x-TheAlterspire,Marth,"My name is Marth, prince of Altea. And you, my lady?",neutral
FE11,24x-TheAlterspire,Nagi,Me?! My name... is Nagi.,surprise
FE11,24x-TheAlterspire,Marth,"Nagi... I was sent here to find you, by a man named Gotoh.",neutral
FE11,24x-TheAlterspire,Nagi,Gotoh... I know that name...But from where? I cannot recall.,surprise
FE11,24x-TheAlterspire,Marth,You’ve lost your memory?,surprise
FE11,24x-TheAlterspire,Nagi,I... cannot say for certain. But your voice... I heard you calling. Did you rouse me from my sleep?,sadness
FE11,24x-TheAlterspire,Marth,I... er... Not on purpose?,neutral
FE11,24x-TheAlterspire,Nagi,Your soul... called out to me...begging for my help. For this blade...,anger
FE11,24x-TheAlterspire,Marth,That...that’s Falchion! How did you get it?!,anger
FE11,24x-TheAlterspire,Nagi,"I cannot remember... But you need it, I know that. And you need my powers.",neutral
FE11,24x-TheAlterspire,Marth,"Your... powers, my lady?",neutral
FE11,24x-TheAlterspire,Nagi,Take me with you. I must... finish what I started... I think. I must fight with you.,neutral
FE11,17x-HelenaCastle,Enemy Soldier,"Lord Dactyl, I’ve brought the mage.",neutral
FE11,17x-HelenaCastle,Dactyl,Good. Hold him up.,neutral
FE11,17x-HelenaCastle,Etzel,...Nngh....,neutral
FE11,17x-HelenaCastle,Dactyl,"Well, then? Have you been persuaded to fight for us?",neutral
FE11,17x-HelenaCastle,Etzel,...Never. I’d rather die.,sadness
FE11,17x-HelenaCastle,Dactyl,You’d rather DIE? Ha! As if a spell-slinging vagabond like you has any choice in the matter! Enough. Strip him of all his possessions and lock him up someplace. Perhaps we can use him later.,anger
FE11,17x-HelenaCastle,Enemy Soldier,"There’s not much to strip him of, milord. Just the tome and this ring...",neutral
FE11,17x-HelenaCastle,Dactyl,Ring? Let me have a look at that.,neutral
FE11,17x-HelenaCastle,Etzel,"No! Don’t you- Grr, let me go! Don’t you touch Ursula’s ring!",anger
FE11,17x-HelenaCastle,Dactyl,Wha... what are you- yaagh!,surprise
FE11,17x-HelenaCastle,Enemy Soldier,O-oi! Take your hands off Lord Dactyl!,anger
FE11,17x-HelenaCastle,Etzel,"Rrgh... please, not the ring! ...Give it BACK!",sadness
FE11,17x-HelenaCastle,Dactyl,"Unhand me, you filthy maggot!",anger
FE11,17x-HelenaCastle,Etzel,Nngh! ...Unnh...,sadness
FE11,17x-HelenaCastle,Dactyl,Take this wretch away. Now!,anger
FE11,17x-HelenaCastle,Enemy Soldier,"At once, milord!",neutral
FE11,17x-HelenaCastle,Dactyl,"Hmph, all that for some tawdry ring. ...Hmm? That gives me an idea...",surprise
FE11,17x-HelenaCastle,Enemy Soldier,"I’ve brought him, milord.",neutral
FE11,17x-HelenaCastle,Dactyl,Good. I’ve had a change of heart. I am considering giving that ring of yours back.,joy
FE11,17x-HelenaCastle,Etzel,...!,neutral
FE11,17x-HelenaCastle,Dactyl,BUT...you must face the League for us. How much considering I do hinges on how well you fight.,neutral
FE11,17x-HelenaCastle,Etzel,"...And how am I to fight unarmed, my lord?",neutral
FE11,17x-HelenaCastle,Dactyl,"Hmm? ...Ah. yes, well, you can have your little book back. But you know what the consequences will be if you betray us...",anger
FE11,17x-HelenaCastle,Etzel,"For now, I’ll just have to feign obedience...",anger
FE11,17x-HelenaCastle,Etzel,"Sorry. I mean you no harm, but neither have I any wish to die here.",sadness
FE11,17x-HelenaCastle,Dactyl,Blast! Where have those indolent guards gone?,anger
FE11,17x-HelenaCastle,Dactyl,Unnh... gwaaah!,fear
FE11,17x-HelenaCastle,Malledus,"Prince Marth! Grust’s garrison left their war chest when they fled. This much gold should buy plenty of equipment. Might I suggest, sire, you avail yourself of this opportunity to outfit your soldiers? Our next opponent will be Grust’s Sable Order. By our scouts’ reports, they march to meet us as we speak. Many say their knights are the strongest on the continent. We’ll want to be well prepared.",neutral
FE11,17x-HelenaCastle,Etzel,"You’re Prince Marth, aren’t you? I wish to thank you.",joy
FE11,17x-HelenaCastle,Marth,...Who are you?,surprise
FE11,17x-HelenaCastle,Etzel,"My name is Etzel. I am a traveling sorcerer. Those Grustian cowards stole a ring from me, and were it not for you, I might never have seen it again.",anger
FE11,17x-HelenaCastle,Marth,"The ring must have been very dear to you, then.",sadness
FE11,17x-HelenaCastle,Etzel,It’s all I have to remember my wife by. She got caught in the fighting back when Gra betrayed Altea...,sadness
FE11,17x-HelenaCastle,Marth,Those were dark days. You have my deepest sympathies; I lost my father in the same battle.,sadness
FE11,17x-HelenaCastle,Etzel,Will there be no end to this bloodshed?,anger
FE11,17x-HelenaCastle,Marth,"There will, Etzel. I have sworn to end it; that’s the very reason all of us fight.",neutral
FE11,17x-HelenaCastle,Etzel,"And you think you can end it, just like that? From anyone else’s lips that would sound absurdly naive. But I can tell you are sincere. Tell me, Prince, have you any need for an extra... spell slinger? I’ve no taste for war, but I do have a fierce hunger for ending it. Let’s usher in a new era, you and I.",anger
FE11,19-ManaketePrincess,Gharnef,Tiki... Tiki... Princess-that-was of the great divine dragons ...Can you hear my voice?,surprise
FE11,19-ManaketePrincess,Tiki,....Mm-hmm.,neutral
FE11,19-ManaketePrincess,Gharnef,Defilers have set foot inside the fane- despoilers! Punish them. Let your fire consume them!,anger
FE11,19-ManaketePrincess,Tiki,Defilers... in the fane... Punish them...,anger
