game,chapter,speaker,text,tag
FE11,XX-Epilogue,Marth,"...She was the one I most wanted to keep safe. But I failed, and I have lost her forever... It occurs to me now that perhaps she was the one protecting me all along. Caeda... Why did you take up arms with a fool like me?",sadness
FE11,XX-Epilogue,Nyna,"Marth, do not blame yourself. ...Remember Anri and Artemis. We are their descendants; perhaps we were always meant to share their curse as well as their blood. And... perhaps only the curse has exacted its price could our battle with the Shadow Dragon be won. This peace we have made... We must cherish it, Marth. We have both paid so dearly for it. Let us work together to ensure none must endure a tragedy like our again.",anger
FE11,25-Endgame:ChosenByFate,Marth,We made it. Now we just have to find Medeus...,neutral
FE11,25-Endgame:ChosenByFate,Nagi,I can sense it... A sinister will is at work here...,neutral
FE11,25-Endgame:ChosenByFate,Gotoh,"Marth, you have fought splendidly.",joy
FE11,25-Endgame:ChosenByFate,Marth,Lord Gotoh?! What are you doing here?,surprise
FE11,25-Endgame:ChosenByFate,Gotoh,I washed my hands of humankind and their foolish ways long ago. But you and your companions have convinced me that was a rash decision. Perhaps there is hope for you yet. Allow me to offer what help I can.,neutral
FE11,25-Endgame:ChosenByFate,Marth,You mean you’ll fight with us?,neutral
FE11,25-Endgame:ChosenByFate,Gotoh,"Yes. I may lack the power to stop Medeus, but his minions are another story. Let this old man strike them down and clear a path for you. ...The gods have chosen you, Marth, prince of light.",anger
FE11,25-Endgame:ChosenByFate,Marth,"Come, my friends! We have a dragon to tame! Help me confine Medeus to the shadows for all eternity and bring light back into the world!",anger
FE11,25-Endgame:ChosenByFate,Cain,His last words were as follows: “Tell my son that I leave the future of Altea and our continent in his hands.”,neutral
FE11,25-Endgame:ChosenByFate,Malledus,"Your sister knows that you are the future of Altea- nay, the whole land!",neutral
FE11,25-Endgame:ChosenByFate,Medeus,"Foolish humans! You dare disturb me while I slumber? Oh, how you will regret it as you die slowly...painfully...writhing in the fires of the inferno!",anger
FE11,25-Endgame:ChosenByFate,Medeus,"Nngh... Defeated again... by humans! Know this, Altean prince... That light which surrounds you is only a temporary respite. So long as the darkness in your hearts continues to sustain me... I cannot be... destroyed...... Rrraaahhh!!!",sadness
FE11,25-Endgame:ChosenByFate,Medeus,"Hmm? So... I am not the only dragon revived. I had heard you perished the last time. No matter; you've recovered even less of your power than me. This time, you have no chance!",neutral
FE11,07-LefcandithGauntlet,Minerva,"General Harmein, I cannot abide by these tactics of yours. Let me attack the rebels head-on, and keep my pride as a knight of Macedon.",neutral
FE11,07-LefcandithGauntlet,Harmein,"Ah, you mean the same pride that cost us all those soldiers back in Aurelis? I think not, Princess. If we’re to regroup, we need to buy time. My tactics are necessary. The emperor himself has named me commander of this post. Either obey, or accept the consequences. Your little sister Maria is still under our word, is she not? What a shame it would be, if we decided we could no longer care for her…",anger
FE11,07-LefcandithGauntlet,Minerva,"Enough! …I will obey. But the Altean knights are smarter than you give them credit for. They will prevail here, and you will regret having acting so rashly, General.",anger
FE11,07-LefcandithGauntlet,Middle-Aged Man,"Say, did you happen to get a look at the axe wrapped in Minerva’s princessly fingers? No, I suppose not, otherwise you’d not be standing here. That axe is Hauteclere, the strongest axe of ‘em all. Nobody knows who made it or where, but it’s said to rival even the three regalia, Archanea’s mightiest weapons. Why, if she got her hands on Iote’s Shield (that’un being Macedon’s treasure, see) she’d be nigh unstoppable!",anger
FE11,07-LefcandithGauntlet,Bantu,"You there. Have you come across a young girl, one by the name of Tiki? She must be found, boy! Tiki is the last of the Naga, the divine-dragon clan. Without her powers, we cannot challenge the Manaketes who serve Medeus… Me? I haven’t the power. I am a fire dragon, yes… But in the name alone, in name alone. I lost my firestone in Pyrathi. Without it, I cannot do battle. …You will be traveling much, yes? I wish to go with you. Perhaps together we can find Tiki.",fear
FE11,07-LefcandithGauntlet,Minerva,"Fie, enough! I’ve no stomach for these cat-and-mouse tactics. Come, Whitewings, we fly! Hyah!",fear
FE11,07-LefcandithGauntlet,Minerva,Rrgh… I can’t keep up the fight with these wounds… I must withdraw.,anger
FE11,07-LefcandithGauntlet,Palla,"I serve Princess Minerva, not Grust. This battle is over.",neutral
FE11,07-LefcandithGauntlet,Catria,The commander left? Then I’ve no reason to stay.,neutral
FE11,07-LefcandithGauntlet,Est,"Sorry, General. My place is with the commander.",sadness
FE11,07-LefcandithGauntlet,Harmein,"Curse Minerva and her pride! Grr, no matter. If I am to die here, then I won't be dying alone!",anger
FE11,07-LefcandithGauntlet,Harmein,Aaargh...Traitors...every...where...,anger
FE11,07-LefcandithGauntlet,Malledus,"Prince Marth, I was wondering if we might talk about the Manaketes.",neutral
FE11,07-LefcandithGauntlet,Marth,Manaketes? You mean the dragonkin?,neutral
FE11,07-LefcandithGauntlet,Malledus,"Yes, sire. I was not sure how much knowledge you had of the Manaketes. The Manaketes inhabited our continent long before the dawn of humanity. However, ordinarily their draconic disposition stayed suppressed; their power sealed within special stones. Thus rather than terrorizing humankind, they chose to live simple, peaceful lives in the quieter reaches of the world. However, a century ago, something changed. Medeus, the Shadow Dragon, surfaced in the Dolhr region and created what would be a great empire there. His forces invaded the human realm, and in the blink of an eye, he had subjected all of the land. It was then, in that darkest hour, that a young man named Anri appeared, and rose against the Shadow Dragon. In his head was a shining blade of light- Falchion- which he plunged into Medeus- and the tyrant was no more. Anri went on to found Altea- and the rest, I believe, you know.",neutral
FE11,07-LefcandithGauntlet,Marth,"Yes, Malledus… Is that what this was about? I do know my own kingdom’s history. And I know what I must do, now that Medeus has revived and restored Dolhr to its former might.",joy
FE11,07-LefcandithGauntlet,Malledus,"You are Anri’s last male descendant, the only one who can wield Falchion. You must find the blade that was taken, and put an end to Doluna and its misguided Manakete rulers.",anger
FE11,07-LefcandithGauntlet,Marth,"I will finish what my father started. I will avenge him, and bring light back into our world.",anger
FE11,08-PortWarren,Caesar,"Prince Marth, I am Caesar, and this is Radd. We are hired swords in the service of Port Warren. Grust has gathered its knights by the fortresses to the north. It's dangerous for you to stay here. Thankfully, the eastern castle has been left almost entirely unguarded; that's the place to strike. Please be careful, sire. We'll be fighting with you all the way.",neutral
FE11,08-PortWarren,Old Woman,"They say a princess of Macedon is being held captive inside Castle Deil. That's odd, don’t you think? Why would Dolhr imprison their own ally?",surprise
FE11,08-PortWarren,Young Man,I saw loads of enemy soldiers up by the northern fortresses! They’ll be pouring out of the gates any minute now. You’d better send someone to bar the exits before they do!,anger
FE11,08-PortWarren,Roger,"I bear you no ill will, but what can I say? A war's a war.",sadness
FE11,08-PortWarren,Caeda,"Good day, sir.",joy
FE11,08-PortWarren,Roger,Ack!,neutral
FE11,08-PortWarren,Caeda,"Peace, I’ve no wish to fight you. My name is Caeda. I hail from Talys.",neutral
FE11,08-PortWarren,Roger,Wh-what are you talking to me for?! This is a battlefield!,surprise
FE11,08-PortWarren,Caeda,"Might I trouble you by asking your name, good sir?",neutral
FE11,08-PortWarren,Roger,M-my name? That’s- It’s Roger... Why?,surprise
FE11,08-PortWarren,Caeda,"Hee hee, forgive me, Roger, it’s just you looked sweet and kind. I just had to stop and talk to you. Tell me: do you believe in love? Oh, listen to me. I’m sure you already have a sweetheart back in Grust.",joy
FE11,08-PortWarren,Roger,"What?! No, no! I... mean, er, I’m quite unattached at the moment.",anger
FE11,08-PortWarren,Caeda,"Roger, think of the children- the poor women and children who shed tears every day this war drags on. I joined the Archanean League to put an end to it, but I just...just...*Sniff* Oh, Roger, doesn't it break your heart?",sadness
FE11,08-PortWarren,Roger,"Aye, miss. There, there. I, too, wish nothing more than for this needless war to end.",sadness
FE11,08-PortWarren,Caeda,Then...would you consider fighting with us to end it?,neutral
FE11,08-PortWarren,Roger,"What? Oh heavens, no... I’m sorry, but I could never betray my kingdom.",sadness
FE11,08-PortWarren,Caeda,"Ah, yes, I see. You must have family back in Grust who are counting on you.",neutral
FE11,08-PortWarren,Roger,"No, not especially. My parents are dead, and it’s not as if I’ve a girl to call my own. But Grust is my home- always has been. I won’t betray her.",neutral
FE11,08-PortWarren,Caeda,And I cannot convince you to change your mind?,neutral
FE11,08-PortWarren,Roger,"I’m afraid not, miss.",fear
FE11,08-PortWarren,Caeda,"All right, sorry to bother you. But I’m glad we had this chance to talk, Roger. You’re every bit the man I thought you were. Goodbye, then...",joy
FE11,08-PortWarren,Roger,Wait- you’re leaving?!,surprise
FE11,08-PortWarren,Caeda,"Well, yes, Roger, I must! Every moment I stay here, I put you at risk. What if your comrades thought you were conspiring with the enemy? No, I must go...",fear
FE11,08-PortWarren,Roger,"...You’re very kind, Caeda. Dare I say, we don’t have girls quite like you back in Grust. Um, perhaps...I suppose I could...Aw, heck, I’m going with you!",sadness
FE11,08-PortWarren,Roger,"Prince Marth? I’m Roger, a Grustian soldier. Well, at least I was. I’m through fighting against you. Let me join your League.",neutral
FE11,08-PortWarren,Marth,"Well, certainly. We need all the strong allies we can get. But why the sudden change of heart?",neutral
FE11,08-PortWarren,Roger,"Well, er... There’s this fetching girl named Caeda who asked me to, and, uh... What can I say? I think I’m in love. Try saying no to a girl who comes racing up to you in the heat of battle just to ask if you believe in love! Whew! I must’ve turned red as a strawberry! Heh heh...",anger
FE11,08-PortWarren,Marth,......,neutral
FE11,08-PortWarren,Kannival,"W-what are you doing all the way out here? Blast, I'm finished...!",surprise
FE11,08-PortWarren,Kannival,Long...live...Grust! Nngff...,sadness
FE11,08-PortWarren,Malledus,"Sire, it's too dangerous to stay here. We must flee to Pyrathi. There are risks there, too- the Pyrathi king Mannu is said to be a descendant of the dragonkin, a Manakete. Still, we've no other recourse. We'll just have to take our chances... Keep your wits about you, sire.",fear
FE11,11-KnordaMarket,Marth,"Nyna, soon the palace will be in sight. I...know this can't be easy for you.",neutral
FE11,11-KnordaMarket,Nyna,"...When the palace fell, many, many good Archaneans were killed. The royal family...My family were...Their bodies were hung before the gates as an example. I cannot unpaint that vivid picture, of my parents grotesquely changed...I feel as though I should cry, Marth; or scream. But no tears come, and I cannot chase away the sadness and rage... ...I cannot change the past. I can only shape the future. Lead the way, Marth. I am ready. Take me home.",sadness
FE11,11-KnordaMarket,Young Man,"This here is Knorda, Archanea’s closest market town. Drop by the armories and vendors if you’ve an interest in rare goods.",neutral
FE11,11-KnordaMarket,Young Man,"A gang of ruffians have rounded up some Archanean folk and are holdin! em over at the edge of town. What a world it’s become, that we’ve gotta be prisoners in our own land!",neutral
FE11,11-KnordaMarket,Middle-Aged Man,"Three ancient weapons known as the Regalia have been passed down through the generations of House Archanea: Parthia, the bow of flame; Gradivus, the lance that pierces stone; and Mercurius, the spectral sword. Only those blessed by the gods may lay hands on them- or so it goes.",neutral
FE11,11-KnordaMarket,Old Woman,I’m sick of war. If it ain’t the screams of battle you’re hearin! it’s the bawlin! of the widows! You all should go home to your loved ones if you ask me.,anger
FE11,11-KnordaMarket,Young Man,"Watch out for the ballisticians. They can fire their missiles quite a long ways. If you see they’re usin! a weapon called an arrowspate, move your fliers out of there, before their wings get clipped! Also, ballisticians have a weapon called the thunderbolt, which is particularly effective against other ballisticians.",neutral
FE11,11-KnordaMarket,Anna,"Not everybody fighting for Grust is a bad apple, you know. Take my sweetheart, Jake. He’s got a heart of gold, that one. If you see him, tell him Anna’s worried sick about him. ’Course, my Jake won’t talk to no-one but the most beautiful of women! That’s just the way he is.",joy
FE11,11-KnordaMarket,Anna,I hope this warring is over and done with soon. And I hope my Jake is well.,neutral
FE11,11-KnordaMarket,Anna,"Jake! What are you doing back?...Oh, so you've decided to fight for the Archanean League now?...No, no, I won't stop you. Sure, I wish you'd just stay put for a change, but I know you wouldn't fight unless it were for a fine cause indeed. Go get 'em, honeycomb!",anger
FE11,11-KnordaMarket,Anna,"Go get 'em, Jake!",neutral
FE11,11-KnordaMarket,Ruffian,Heh. Whadda you want? A broken nose?,surprise
FE11,11-KnordaMarket,Marth,I hear you are holding some Archaneans here against their will. Release them at once!,anger
FE11,11-KnordaMarket,Ruffian,How ’bout I release my fist into yer- Munchin! Manaketes! The Altean army?! Aieee! Get me outta here!!!,anger
FE11,11-KnordaMarket,Marth,Is everyone all right? I know you’ve been through a lot. Go home to your families.,neutral
FE11,11-KnordaMarket,Marth,"Em? What’s wrong, lad? Why don't you go home?",surprise
FE11,11-KnordaMarket,Boy,Because! I have no home to go to.,anger
FE11,11-KnordaMarket,Marth,You! You’re a girl! Why were you dressed as a boy?,surprise
FE11,11-KnordaMarket,Linde,"To hide, sir. My name is Linde. My father is – was – Miloah, a pontifex. I donned men’s garb to escape Gharnef, but no sooner was I away when those ruffians grabbed me.",neutral
FE11,11-KnordaMarket,Marth,"So you’re Linde! I’m glad you’re safe. Princess Nyna was worried about you, you know! Well, we’re all together now. I promise to keep you out of danger.",joy
FE11,11-KnordaMarket,Linde,"No! Let me fight. With Princess Nyna’s blessing, and the tome my father left me, I can wield Aura magic. Let me use it to avenge him. I want to destroy Gharnef myself!",fear
FE11,11-KnordaMarket,Caeda,"Hail, ballistician of Grust! Are you the one they call Jake?",anger
FE11,11-KnordaMarket,Jake,"Hail yourself, sugar! What's a fetching lass like you doing out here on the battlefield? And how do you know my name?",surprise
FE11,11-KnordaMarket,Caeda,I am Caeda of Talys. An Archanean woman by the name of Anna told me about you.,neutral
FE11,11-KnordaMarket,Jake,"Really? Anna mentioned me? ...In a good way, right?",surprise
FE11,11-KnordaMarket,Caeda,She's very worried about you. She wants to know why such a good man is fighting for the wrong side.,neutral
FE11,11-KnordaMarket,Jake,"Wrong side? Hmm... Well, I have to admit, I'm not too keen on kicking Archanea while they're down...",neutral
FE11,11-KnordaMarket,Caeda,"They why not fight for Archanea instead? Help us defeat Grust and Dolhr, and set the world right.",anger
FE11,11-KnordaMarket,Jake,Well...I don't know. I don't think it's that simple... Hmm...,neutral
FE11,11-KnordaMarket,Caeda,"Anna would love you for it, I'm sure.",joy
FE11,11-KnordaMarket,Jake,"She would? Hmmm... All right, you win. But I'm doin' it for Anna- "" just to be clear!",joy
FE11,11-KnordaMarket,Jake,"I knew I wasn't cut out for the military. Well, too late now. I just hope Anna's OK...",sadness
FE11,11-KnordaMarket,Merric,"Linde, I presume? My name's Merric. Prince Marth asked me to look after you. Not that we mages need any help looking after ourselves, mind you. """,neutral
FE11,11-KnordaMarket,Linde,"Oh, you've studied magic?",neutral
FE11,11-KnordaMarket,Merric,"Yes, in Khadein.",neutral
FE11,11-KnordaMarket,Linde,Khadein... The school? My father was a student there a long time ago.,surprise
FE11,11-KnordaMarket,Merric,"The school is beautiful–was beautiful, until Gharnef took over and changed everything. I was blessed with wonderful teachers, and I found a healthy mix of friends and rivals in the other aspiring mages.",joy
FE11,11-KnordaMarket,Linde,"It sounds nice, I suppose. But my father was the only teacher and friend I ever needed. ......",joy
FE11,11-KnordaMarket,Merric,"I'm sorry, Linde...",sadness
FE11,11-KnordaMarket,Linde,"Don't be. I'm tough like my father, too. ...Let's talk about you, Merric. And about Khadein. I've never been to a school before. How do they teach?",fear
FE11,11-KnordaMarket,Jake,Are you the Altean prince? The name’s Jake. I just joined up.,neutral
FE11,11-KnordaMarket,Marth,"Many thanks, Jake.",neutral
FE11,11-KnordaMarket,Jake,"You know, I’ve been to Altea once. Have you uh... Ever paid a visit to the ecret-say op-shay there?",neutral
FE11,11-KnordaMarket,Marth,The what?,surprise
FE11,11-KnordaMarket,Jake,"The secret shop! Didn’t you know there are secret shops hidden all over the continent? Well, there’s one in Altea, too.",neutral
FE11,11-KnordaMarket,Marth,"Oh, really? Where exactly?",surprise
FE11,11-KnordaMarket,Jake,"If I told you, it wouldn’t be much of a secret, now would it? The entrance is disguised so you can’t find it.",neutral
FE11,11-KnordaMarket,Marth,Disguised?!,surprise
FE11,11-KnordaMarket,Jake,And they don’t let anybody in without a VIP card. So don’t expect to waltz through the door by accident.,neutral
FE11,11-KnordaMarket,Marth,But how do they stay in business?,neutral
FE11,11-KnordaMarket,Jake,"Who knows! Last I heard, they were desperate for customers.",neutral
FE11,11-KnordaMarket,Marth,"Then maybe they should reopen as a ""tell your friends "" shop.",neutral
FE11,11-KnordaMarket,Jake,"Ha! Very clever. Anyway, you should drop by when you’re in the neighborhood.",anger
FE11,11-KnordaMarket,Marth,But I don’t know- Ugh. Never mind.,anger
FE11,11-KnordaMarket,Khozen,"Burn...! Burn, till your blood boils and your flesh cooks!",anger
FE11,11-KnordaMarket,Khozen,Emperor Medeus...I have failed you...,sadness
FE11,11-KnordaMarket,Marth,"Good news, Nyna! We've wrested control of the gates from the enemy.",joy
FE11,11-KnordaMarket,Nyna,Then...we've won!,neutral
FE11,11-KnordaMarket,Marth,"Not quite yet. We can enter the palace, but Dolhr still holds strong inside her walls. Also, a number of knights are being held captive inside.",neutral
FE11,11-KnordaMarket,Nyna,"Loyal soldiers who fought for their kingdom and their people...Marth, I wish to free them as soon as possible.",neutral
FE11,11-KnordaMarket,Marth,"I understand. We should strike now, then, before enemy reinforcements can arrive. I believe we have a good chance.",neutral
FE11,11-KnordaMarket,Nyna,"Thank you, Marth. As always, I am counting on you. Worry no more.",joy
FE11,22-AKnightFilledSky,Michalis,"Lord Gotoh, the League has begun its attack. I wish for you to move someplace safe until the fighting has ended.",neutral
FE11,22-AKnightFilledSky,Gotoh,"Why not just end this folly now, Michalis?",neutral
FE11,22-AKnightFilledSky,Michalis,Folly? What folly?,surprise
FE11,22-AKnightFilledSky,Gotoh,"You loved your younger sister so much. It pains me to see you quarrel. If you and Minerva had worked as one, Macedon might have become a great kingdom- greater even than Archanea, perhaps. But instead, you let Gharnef trick you into destroying your family, and your kingdom with it.",sadness
FE11,22-AKnightFilledSky,Michalis,"...I cannot undo what is done. My father’s blood will always be on my hands, just as Minerva’s betrayal of her brother and country will be on hers. And Macedon has not been destroyed, not yet. So long as I carry Iote's Shield, the League’s arrows cannot fell me.",anger
FE11,22-AKnightFilledSky,Gotoh,Very well. And if you win? What then?,surprise
FE11,22-AKnightFilledSky,Michalis,"If I win, I will tell you. Right now, my only goal is to gut that Altean prince who leads the League. My pride as Macedonian king rests upon it.",anger
FE11,22-AKnightFilledSky,Gotoh,"I see... Then we’ve nothing more to discuss, have we?",neutral
FE11,22-AKnightFilledSky,Gotoh,The weight of his father’s murder threatens to crush him... Poor boy...Poor fool.,anger
FE11,22-AKnightFilledSky,Old Woman,"A great sage lives in the village to the north. He’s not very sociable, though. Hardly anyone ever sees him.",neutral
FE11,22-AKnightFilledSky,Gotoh,"Marth, Marth, why did you not heed me? Why did you not bring the two orbs? Without them, I cannot make Starlight for you. You will not be able to break through Gharnef’s Imhullu magic, not take Falchion from his clutches. Without Anri’s sword, your battle with Medeus will be fraught with peril. If you still mean to face him, you will need all the strength you can muster, every advantage you can find. If you have weapons like the sword Mercurius or the lance Gradivus, the fight may not be lost... Hmm... I, too, may be able to help in some other way. Let me think on it. Regardless, your quest has just become more difficult than you realize. I hope you are ready.",neutral
FE11,22-AKnightFilledSky,Gotoh,You have the Lightsphere and Starsphere with you? Well done! Now I can create Starlight for you.,joy
FE11,22-AKnightFilledSky,Gotoh,...There. It is finished. Take this with you; it is the only magic capable of breaking through Imhullu. Use it to stop that fiend Gharnef once and for all.,anger
FE11,22-AKnightFilledSky,Michalis,"Made it this far, have you? Don’t gloat yet. My Dragoons and I still rule these skies!",anger
FE11,22-AKnightFilledSky,Michalis,"Minerva, I have missed you, Sister. Let us embrace one last time.",joy
FE11,22-AKnightFilledSky,Minerva,Michalis...,neutral
FE11,22-AKnightFilledSky,Michalis,Well? Strike! A moment’s hesitation spells death on the battlefield. I know I taught you better.,anger
FE11,22-AKnightFilledSky,Minerva,You will not lay down your lance and walk the right path?,neutral
FE11,22-AKnightFilledSky,Michalis,"Don’t be a child. There are no right paths; just mine and yours, two that will never cross.",sadness
FE11,22-AKnightFilledSky,Minerva,"Very well. Then you leave me no choice. Embrace you I shall, Brother!",neutral
FE11,22-AKnightFilledSky,Michalis,M-Maria? What are you doing here?,surprise
FE11,22-AKnightFilledSky,Michalis,The Whitewings? Ha! Come to try and slay your king?,anger
FE11,22-AKnightFilledSky,Michalis,The Whitewings? Ha! Come to try and slay your king?,anger
FE11,22-AKnightFilledSky,Michalis,The Whitewings? Ha! Come to try and slay your king?,anger
FE11,22-AKnightFilledSky,Michalis,"I’ve been waiting for you, Altean whelp. I swear on my crown, you will die!",anger
FE11,22-AKnightFilledSky,Michalis,"Aaagh! I am finished. Forgive me, my people.",sadness
FE11,22-AKnightFilledSky,Marth,"First General Camus of Grust... Now Prince Michalis of Macedon. Men of such promise... Had the times been different, the two might have led illustrious lives.",neutral
FE11,22-AKnightFilledSky,Malledus,"Yes, Prince Michalis was a brilliant man with great things ahead of him. But in the end, the rashness of youth did him in.",joy
FE11,22-AKnightFilledSky,Marth,"Only because Gharnef found his weakness and exploited it. Until we stop that fiend, this spiral of misery will never cease.",anger
FE11,22-AKnightFilledSky,Malledus,Then shall we go to Thabes? Lord Gotoh said the city lies someplace far to the north of Khadein.,neutral
FE11,22-AKnightFilledSky,Marth,"Yes, in the heart of the desert...",fear
FE11,22-AKnightFilledSky,Malledus,"Thabes is an old city... None in recent memory have gone there and returned alive. Within its walls remain many powerful apparatus crafted of long-forgotten magic. Lord Gotoh believes Gharnef is harnessing their power, and that is why he wields such influence over the continent.",neutral
FE11,22-AKnightFilledSky,Marth,And he has Imhullu as well... This will be a struggle.,neutral
FE11,22-AKnightFilledSky,Marth,"Still, Gharnef’s reign must end. The world was so much more beautiful before he painted it red...",joy
FE11,15-AnOasisOfMagic,Gharnef,"What? The dregs of Archanea have come to challenge my kingdom? Ha ha ha... Really, do they think people have not tried before? So long as I possess this Imhullu magic, they cannot snuff my life out. No one can. As for the White Sage... He will trouble me no longer. With the dragon-goddess right where I want her, in the Fane of Raman, there is no way for Gotoh's Starlight to disperse the shadows that guard me.",anger
