game,chapter,speaker,text,tag
FE11,15-AnOasisOfMagic,Young Man,"Fight Gharnef? Are you mad? You'll never stop him! His magic, Imhullu, summons up foul spirits that protect him! Only the White Sage Gotoh's magic can undo him: the magic of Starli- Whoa, there. I need to hold my tongue! He might be listenin' with those wizard-ears of his, for all I know. Go on, work a little magic yourself and disappear, huh? Shoo!",anger
FE11,15-AnOasisOfMagic,Young Man,"You think those clothes o'metal will protect you from mages? Ha! Armor won't save you. You need a Barrier staff! Another thing, about Gharnef- here, move in closer in case he's listenin'. You don't want to fight him head on. He never stays put in Khadein for very long anyway. If he tries to attack you, ride it out. Good things come to those who wait.",neutral
FE11,15-AnOasisOfMagic,Gharnef,"You dare oppose me, fool? You must not value your life. Cower before the might of the magic Imhullu: once forbidden, now unleashed!",anger
FE11,15-AnOasisOfMagic,Gharnef,"Altean prince! I fear you are not quite imposing enough to warrant my staying here. But if it's Falchion you want, come and take it. I shall be waiting at the Temple of Thabes.",anger
FE11,15-AnOasisOfMagic,Marth,No Falchion...The battle was for naught.,neutral
FE11,15-AnOasisOfMagic,Gotoh,...Marth...Prince Marth.,joy
FE11,15-AnOasisOfMagic,Marth,Huh? Who are you?!,surprise
FE11,15-AnOasisOfMagic,Gotoh,My name is Gotoh...I am speaking to you from Macedon through magic.,neutral
FE11,15-AnOasisOfMagic,Marth,Gotoh...the White Sage?,neutral
FE11,15-AnOasisOfMagic,Gotoh,"Some have used that name, yes. You must listen to me. As you suspect, Gharnef has made off with Falchion. With Imhullu and Falchion in the sorcerer's grasp, Dolhr now must think twice before challenging him. Gharnef knows this. And one day, he plans to conquer Dolhr and rule the entire world.",neutral
FE11,15-AnOasisOfMagic,Marth,"Is Imhullu so powerful a magic, then?",neutral
FE11,15-AnOasisOfMagic,Gotoh,"Yes. The mage who wields it cannot be killed; cannot be so much as scratched. I was the magic's guardian once. Knowing its forbidden power could work terrible evils, so I kept it close. But Gharnef, one of my two pupils- Miloah being the other- took the forbidden tome and vanished. Now you are paying for my carelessness. Forgive me. I wish to make amends by teaching you the only way to undo Imhullu's power.",sadness
FE11,15-AnOasisOfMagic,Marth,Which is...?,surprise
FE11,15-AnOasisOfMagic,Gotoh,"It is called Starlight. One blast is enough to break through Imhullu's shadowy protection. But to cast the magic, you need two orbs: the Lightsphere and the Starsphere. Heed me, Marth. When you find the Lightsphere and Starsphere, bring them to me. Then I will give you the magic you seek. Then you will have Starlight, and with it, Gharnef's reign will end.",neutral
FE11,12x-ATraitor'sWorth,Dejanira,"Have you heard, Horace? I am told the rebels just recaptured the palace. That accursed Akaneian wench! Never mind Camus’s pleas. We should have put her to the sword with the rest of them…",fear
FE11,12x-ATraitor'sWorth,Horace,...,neutral
FE11,12x-ATraitor'sWorth,Dejanira,"Hm, something bothering you, now? Don’t tell me you are toying with the idea of rejoining your motherland? Because if you do, I think you know exactly what will befall your people.",anger
FE11,12x-ATraitor'sWorth,Horace,"Yes, you’ve made it quite clear! I am an Akaneian knight no longer. I knew this day would come when I gave me lance to Doluna. I will not flinch.",anger
FE11,12x-ATraitor'sWorth,Dejanira,Good. Then gather your soldiers and kill these rebels before they cause any more trouble.,anger
FE11,12x-ATraitor'sWorth,Enemy Soldier,"Lord Horace, our soldiers are in position.",neutral
FE11,12x-ATraitor'sWorth,Horace,Good.,joy
FE11,12x-ATraitor'sWorth,Enemy Soldier,Shall we advance on the enemy?,neutral
FE11,12x-ATraitor'sWorth,Horace,"...No. That won’t be necessary. We’ll lure them in close, then strike. No one attacks unless the enemy makes a move first. Is that clear?",anger
FE11,12x-ATraitor'sWorth,Marth,Lord Horace! I am Marth of Altea. I ask that you lay down your arms....,neutral
FE11,12x-ATraitor'sWorth,Horace,Is Princess Nyna safe?,surprise
FE11,12x-ATraitor'sWorth,Marth,"She is- and she’s quite worried about you, sir.",fear
FE11,12x-ATraitor'sWorth,Horace,"So Her Highness is alive... The soldiers who died protecting her can rest in peace. ...Now then, Prince Marth. Draw your sword.",sadness
FE11,12x-ATraitor'sWorth,Marth,What? But...Lord Horace!,surprise
FE11,12x-ATraitor'sWorth,Horace,"I chose to betray Akaneia, and now I must abide by that choice. Princess Nyna has returned to the palace, and Akaneia is restored. I have no regrets.",sadness
FE11,12x-ATraitor'sWorth,Old Man,"Lord Horace, who rules this land, used to be a knight of Akaneia. After the palace fell, though, he bent his knee to the Dolunian emperor and has been servin’ him ever since. For that, folks call him a traitor and say he tarnished his knightly brethren’s reputation. Well, that’s a load of hogwash. He broke his knightly oaths to protect us! Not ’cause he’s some traitor. Please, sire, you have to help clear his name. Here…Lord Horace’s father, bless him, gave me this weapon as a gift long ago. I know he’d be glad to see it used to restore his son’s honor.",joy
FE11,12x-ATraitor'sWorth,Young Woman," Are you with the League? Please, sir, I’m beggin’ ya...You have to help Lord Horace. He’s always looked out for us small folk, before and after he inherited the land. He’s a pillar of strength, he is. We’d be dead if he hadn’t made the tough choices he did. The least we can do is rescue him from his plight now. Here, I’ve got this magic tome one of our villagers found after the last battle on our soil. You take it, and find some way to save him. Promise!",fear
FE11,12x-ATraitor'sWorth,Dejanira,Vexatious rebels! I’ll skewer you like rabbits!,anger
FE11,12x-ATraitor'sWorth,Dejanira,Nngh! You'll... pay...,neutral
FE11,12x-ATraitor'sWorth,Horace,What!? Dejanira’s been killed?! Then... it’s over. Soldiers! Lay down your weapons! No more Akaneian blood shall be shed! ...Mine shall be the last.,anger
FE11,12x-ATraitor'sWorth,Horace,"Bravo, Prince Marth. I yield. Spare the lives of my soldiers and treat my people kindly, and you may do with me as you see fit.",neutral
FE11,12x-ATraitor'sWorth,Villager,"No! Wait, please! Lord Horace is a good man! Doluna threatened him, said they’d raze the land corner to corner if he didn’t comply. So you see-",fear
FE11,12x-ATraitor'sWorth,Horace,Hush! You’ve said enough.,anger
FE11,12x-ATraitor'sWorth,Marth,"But, Lord Horace...",neutral
FE11,12x-ATraitor'sWorth,Horace,I betrayed my fellow knights and besmirched their good name. I will not dress up my sins as kindnesses! I accept my punishment. Allow me to die a knight’s death.,anger
FE11,12x-ATraitor'sWorth,Nyna,I will not!,anger
FE11,12x-ATraitor'sWorth,Horace,.....! Princess Nyna?,surprise
FE11,12x-ATraitor'sWorth,Nyna,"Horace. I heard what you said. And you have it quite right. Your crimes deserve death, or worse.",anger
FE11,12x-ATraitor'sWorth,Marth,"Nyna, what are you-",neutral
FE11,12x-ATraitor'sWorth,Nyna,But I shall give you no knight’s death. I shall give you a traitor’s life. You say you will not dress up your sins. I say you will not run from them either.,anger
FE11,12x-ATraitor'sWorth,Horace,Your Highness...! Are you saying you wish me to live?,surprise
FE11,12x-ATraitor'sWorth,Nyna,"You did all in your power to protect these people. That was honorable, Horace. But if you die today, no one will remember you for anything but your one act of betrayal. Your soldiers will have to bear that shame in your stead. Do you call that justice?",anger
FE11,12x-ATraitor'sWorth,Horace,.....,neutral
FE11,12x-ATraitor'sWorth,Nyna,"Starting today, you shall prove to the world there was value in your actions. Show us a traitor’s worth. Show us what the soldiers who fought and died for you saw to be true.",anger
FE11,12x-ATraitor'sWorth,Horace,I... I do not know what to say.,neutral
FE11,12x-ATraitor'sWorth,Nyna,"I have claimed your life, Horace. You have no say. You shall fight for us...and you shall not die. I forbid it.",anger
FE11,12x-ATraitor'sWorth,Horace,"Heh... Very well, Your Highness. As you command...",neutral
FE11,12x-ATraitor'sWorth,Marth,"Nyna, we have put down the western insurgence.",neutral
FE11,12x-ATraitor'sWorth,Nyna,And Horace?,neutral
FE11,12x-ATraitor'sWorth,Marth,I am sorry...,sadness
FE11,12x-ATraitor'sWorth,Nyna,"Poor Horace. Marth, in his heart, I do not think he truly wished to betray Akaneia.",sadness
FE11,12x-ATraitor'sWorth,Marth,Nor I. Doluna must have threatened to do harm to his people.,anger
FE11,12x-ATraitor'sWorth,Marth,"So Horace capitulated, to keep them safe... He acted to save lives, yet the world will brand him a traitor. That one word will come to define him... and none will ever know the traitor’s worth.",anger
FE11,12-TheAgelessPalace,Midia,"Bishop, what do you make of this? I hear shouting in the corridors.",neutral
FE11,12-TheAgelessPalace,Boah,Hmm...Princess Nyna must have returned with an army in tow.,neutral
FE11,12-TheAgelessPalace,Midia,An army?! Really? Then we are saved!,surprise
FE11,12-TheAgelessPalace,Boah,"Saved, perhaps...or doomed. Surely the enemy realizes we are more trouble alive than dead now.",sadness
FE11,12-TheAgelessPalace,Midia,"You do not take my meaning, Bishop. By ""we"" I mean Archanea. Archanea is saved. If Princess Nyna has truly come to chase the enemy from our halls, to free us...Then my death will have meaning.",neutral
FE11,12-TheAgelessPalace,Boah,"Ho ho...I admire your spirit, child. I always have. But think how Astram would grieve if you were to die.",joy
FE11,12-TheAgelessPalace,Midia,I...I had hoped to see him one last time- to say goodbye. That alone I regret.,sadness
FE11,12-TheAgelessPalace,Boah,"Ah, but you have not died yet. Midia. Hang on to hope.",sadness
FE11,12-TheAgelessPalace,Volzhin,Rebel pup! You dare defy Dolhr? Then writhe in the fires of Bolganone!,anger
FE11,12-TheAgelessPalace,Volzhin,Do not think...you have won... Dolhr...is undying... Nngh!,anger
FE11,12-TheAgelessPalace,Nyna,"Marth, thank you. Were it not for you, I may never have seen the halls of my house again.",joy
FE11,12-TheAgelessPalace,Marth,"I could not have done it alone, Nyna. The whole Archanean League fought tooth and nail this day.",anger
FE11,12-TheAgelessPalace,Nyna,"True, and yet all the same... I have little doubt your exploits are the ones that will live on in song. I have a gift for you, to celebrate your achievements here. This bow is called Parthia. It is one of the three regalia that have been passed down through House Archanea. The other two regalia- the sword Mercurius and the lance Gradivus are not here. The enemy took them when they fled. I am sorry. I had hoped to give you all three, and thus aid you in the battles to come....",sadness
FE11,12-TheAgelessPalace,Marth,"Your concern for me is more than enough, Nyna. One day, I will get your family's treasures back and use them to crush Dolhr. I swear it on this emblem of fire!",anger
FE11,18-TheSableOrder,Malledus,"Prince Marth, I see them: a cohort of Grustian knights, out on the far side of the bridge. That must be the Sable Order...",neutral
FE11,18-TheSableOrder,Nyna,"Marth, I heard the enemy forces have been spotted.",neutral
FE11,18-TheSableOrder,Marth,"Yes, that’s right. The Sable Order, it seems",neutral
FE11,18-TheSableOrder,Nyna,"Really? Tell me, who leads them?",surprise
FE11,18-TheSableOrder,Marth,Why does it matter?,surprise
FE11,18-TheSableOrder,Nyna,"Oh... no, it’s just- they say the Sable Order is led by a brilliant general. I was... wondering if he was riding with them today.",neutral
FE11,18-TheSableOrder,Marth,"You must mean General Camus. I am told Dolhr is not very happy with him at the moment, brilliant or not. Something about acting outside orders... They’ll be keeping him on a short leash; I don’t expect we’ll see him here.",anger
FE11,18-TheSableOrder,Nyna,That... that is good news...,sadness
FE11,18-TheSableOrder,Young Man,"You know how the Fane of Raman is supposed to be protected by a fearsome guardian? Well, I heard the “fearsome guardian” is nowt but a wee lass. If that’s true, you have to wonder why she’d stay all by herself in a dreary place like that. Mayhap she broke her ma’s favorite vase and got stuck there as a punishment? Ha ha, right.",fear
FE11,18-TheSableOrder,Est,"Ah, you’re Prince Marth! I am Est, of the Medonian Whitewings- Palla and Catria’s younger sister. I’ve been looking for you. Initially I intended to join up with you along with my sisters, but then I heard Grust had made off with one of Akaneia’s three regalia- the sword Mercurius- so I flew there to get it back. This is Mercurius right here. It’s lovely, isn’t it? And powerful! In the right hands, I think you’ll find it a formidable weapon indeed.",joy
FE11,18-TheSableOrder,Est,Catria!,neutral
FE11,18-TheSableOrder,Catria,Est! It's about time you made it back. I was so worried...,fear
FE11,18-TheSableOrder,Est,"Sorry... I won't leave you like that again. We belong together anyway. When the three of us surround an enemy, we're just about unstoppable!",sadness
FE11,18-TheSableOrder,Catria,"True... but even so, I like having you somewhere I can keep an eye on you. Ha ha.",neutral
FE11,18-TheSableOrder,Est,Hey! What's that supposed to mean?,surprise
FE11,18-TheSableOrder,Est,"Hey, Palla. I'm not slowing you and Catria down, am I?",fear
FE11,18-TheSableOrder,Palla,Why would you say that?,surprise
FE11,18-TheSableOrder,Est,I don't know... You and she have so much more experience. Sometimes I... I just feel like I'm not pulling my load.,sadness
FE11,18-TheSableOrder,Palla,Ha ha... Est... You're doing just fine. There are no half-Whitewings or almost-Whitewings. You're one of us because you're every bit as good as us. Have a little confidence.,neutral
FE11,18-TheSableOrder,Est,"Right, confidence...",neutral
FE11,18-TheSableOrder,Palla,...Feel better?,neutral
FE11,18-TheSableOrder,Est,"Uh-huh. Thanks, Palla. It's funny... Whenever I talk to you, I calm right down. Promise you'll always be there for me, Palla.",neutral
FE11,18-TheSableOrder,Palla,I will... I promise.,neutral
FE11,18-TheSableOrder,Est,"Commander, did anybody tell you? I flew all the way to Grust and brought back Mercurius. Pretty spiffy, huh?",neutral
FE11,18-TheSableOrder,Minerva,"Yes, Marth told me all about it. Very brave of you to undertake such a dangerous task alone. Well done, Est.",fear
FE11,18-TheSableOrder,Est,"Hee hee! You mean it? Thanks, Commander! You should have seen the arrows whooshing past me left and right! But I'm a Whitewing, right? So I swooped down and let 'em have it! Just watch, though. I'll find some way to top it.",joy
FE11,18-TheSableOrder,Minerva,"I don't doubt it. I expect great things from you, Est.",neutral
FE11,18-TheSableOrder,Est,Hee hee! You mean it?,joy
FE11,18-TheSableOrder,Sternlin,You shall not pass! Not today! Not ever!,anger
FE11,18-TheSableOrder,Sternlin,You... shall... not... unnh...,sadness
FE11,18-TheSableOrder,Nyna,We’ve made it across the strait.,neutral
FE11,18-TheSableOrder,Marth,Yes. But the real battle may yet be ahead of us.,neutral
FE11,18-TheSableOrder,Marth,Malledus... Can we be certain the Lightsphere and the Starsphere are in the Fane of Raman?,neutral
FE11,18-TheSableOrder,Malledus,"Yes, sire; but unfortunately, they may not be all we find. The fane is said to be guarded by a goddess, one with fearsome powers. Those who defile her sanctuary are punished by fire; none are spared from the blaze.",fear
FE11,18-TheSableOrder,Nyna,"Perhaps we should reconsider, Marth...",neutral
FE11,18-TheSableOrder,Marth,"Perhaps... But if none are spared from the blaze, where do the rumors come from? Besides, we need those two orbs.",neutral
FE11,18-TheSableOrder,Malledus,"Well, might I suggest you take in just a few able companions, and let the sleeping dragons lie?",neutral
FE11,18-TheSableOrder,Marth,"Sage advice. I’ve no desire to tear apart a holy place, whether the goddess is home or not... I’ll choose a handful of elite to search for the orbs with me.",neutral
FE11,23-DarkPontifex,Marth,The Temple of Thabes... He’s here... somewhere...,neutral
FE11,23-DarkPontifex,???,"Heh heh heh... Come to play, little Marth?",joy
FE11,23-DarkPontifex,Gharnef,"‘Tis I, Gharnef. I have been waiting for you.",neutral
FE11,23-DarkPontifex,Marth,Waiting?,surprise
FE11,23-DarkPontifex,Gharnef,"Oh yes. For you to dance around the continent, collecting powerful weapons and killing off my competition. Thanks to you, Camus and Michalis will trouble me no more. You have my gratitude, diligent prince.",neutral
FE11,23-DarkPontifex,Marth,You... monster!,anger
FE11,23-DarkPontifex,Gharnef,"Tsk, tsk, don’t spoil the moment, now. You’re about to do me one last favor... Die, Prince. Heh heh heh!",anger
FE11,23-DarkPontifex,Marth,That’s what you think. I have something else in mind.,neutral
FE11,23-DarkPontifex,Gharnef,"Heh, is that a threat? If you mean to harm me, first you’ll have to find me, boy.",surprise
FE11,23-DarkPontifex,Marth,And what is that supposed to mean?,surprise
FE11,23-DarkPontifex,Malledus,"My prince! Several sorcerers have been sighted throughout the temple! They’re... They all seem to be Gharnef, sire!",fear
FE11,23-DarkPontifex,Gharnef,"Heh heh! Fight, boy, fight! Wear yourself thin fighting puppets and shadows! But the only way you’ll claim Falchion is by defeating the real me. Heh heh, ha ha ha ha!",anger
FE11,23-DarkPontifex,Malledus,"Sire, we’ve pinpointed where Gharnef is keeping the magical apparatus that gives him his power.",neutral
FE11,23-DarkPontifex,Marth,Where?,surprise
FE11,23-DarkPontifex,Malledus,The Tower of Thabes atop this very temple.,neutral
FE11,23-DarkPontifex,Marth,Then we don’t need to fight Gharnef... If we find those apparatus.,neutral
FE11,23-DarkPontifex,Malledus,Gharnef’s power- a great deal of power- will be sealed forever.,neutral
FE11,23-DarkPontifex,Marth,Then let’s hurry and seize the entrance to the tower!,neutral
FE11,23-DarkPontifex,Malledus,"A word of caution, sir. Stopping the apparatus will not undo Imhullu power- only Gharnef’s. He still has Falchion in his keeping; if you want the blade back, you must defeat him now, before seizing the tower.",neutral
FE11,23-DarkPontifex,Gharnef,"Heh heh heh... You dare challenge me, fool? You must not value your life. Cower before the might of the dark magic Imhullu!",anger
FE11,23-DarkPontifex,Gharnef,"Agh! What... Where did you get...Starlight...? Still, you are a fool...Your power is not enough to defeat Medeus... I shall be waiting in the pits of the inferno... for when he sends you to join me... Heh heh, ha ha ha!",anger
FE11,23-DarkPontifex,Marth,Malledus! Quickly! Find the apparatus and shut them down!,anger
FE11,23-DarkPontifex,Malledus,"Right away, sire!",neutral
FE11,23-DarkPontifex,Gharnef,"...Blast! How... how did they find the apparatus? All my power... Still, they are fools if they think they can defeat Medeus with such cheap tricks... Heh heh, ha ha ha!",anger
FE11,23-DarkPontifex,Malledus,"Gharnef is getting away, sire! Shall we give chase?",neutral
FE11,23-DarkPontifex,Marth,"No... let him go. Without his magical apparatus, he has no power left to abuse.",sadness
FE11,23-DarkPontifex,Allied Solider,"Sire! We found Princess Elice up in the Tower of Thabes! She’s on her way to see you right- Ah, here she is!",fear
FE11,23-DarkPontifex,Marth,Elice!!!,anger
FE11,23-DarkPontifex,Elice,Marth! Oh look at you. A man grown!,joy
FE11,23-DarkPontifex,Marth,"Sister, I was so worried. None had seen you since the castle fell. I... I feared the worst.",fear
FE11,23-DarkPontifex,Elice,"I was prepared for the worst, if that was what it took to ensure your safety. But they did not kill me. Gharnef spared my life.",neutral
FE11,23-DarkPontifex,Marth,Why would he spare you?,neutral
FE11,23-DarkPontifex,Elice,"Marth, have you heard of the staff of Aum?",neutral
FE11,23-DarkPontifex,Marth,"The staff that brings back the dead? It was lost to the world long ago, or so the legend goes.",neutral
FE11,23-DarkPontifex,Elice,"Yes, but Gharnef found it... in the Resurrectory.",neutral
FE11,23-DarkPontifex,Marth,The Resurrectory? What was it doing in a temple in the middle of Dolhr?,surprise
FE11,23-DarkPontifex,Elice,"I could not say. But that was why Gharnef kept me alive: he wished me to wield it. The staff of Aum’s power can only be channeled by women of royal blood. Marth, you are going to Dolhr, are you not?",neutral
FE11,23-DarkPontifex,Marth,Yes. I must settle things with Medeus.,neutral
FE11,23-DarkPontifex,Elice,"Then take me to the Resurrectory along the way to claim the staff. Aum works but once, but I will use it to revive a lost comrade.",neutral
FE11,21-ClashInMacedon,Marth,"Princess Minerva, we will soon reach the Macedonian border. Are you certain you wish to join the battle? If you’ve any reservations about fighting your own countrymen-",neutral
FE11,21-ClashInMacedon,Minerva,"If I did, Prince Marth, I would not have offered you my axe.",neutral
FE11,21-ClashInMacedon,Marth,But surely-,neutral
FE11,21-ClashInMacedon,Minerva,"You have the wrong idea. Perhaps you think I wish to spare my brother and former vassals, forgive them for seeing things differently?",anger
FE11,21-ClashInMacedon,Marth,...Don’t you?,surprise
FE11,21-ClashInMacedon,Minerva,"I would be lying if I said I did not wish it were that simple. But history needs to remember that when Macedon went astray, it was a Macedonian who set things right.",neutral
FE11,21-ClashInMacedon,Marth,Even if it means your own brother may die?,anger
FE11,21-ClashInMacedon,Minerva,"Since I was little, I followed in Michalis’s footsteps. Whatever books he read, I read; whenever he practiced the sword, I was close by, watching, learning... He was always a step ahead: my hero, something to aspire to. Even now, some part of me loves him. ...I love him enough to spare him death on some stranger’s sword, you see? Let him be punished by my hands.",neutral
FE11,21-ClashInMacedon,Orridyon,Rebels! You have strutted into the wrong kingdom this time!,anger
FE11,21-ClashInMacedon,Orridyon,Nngh! I am but a pebble... in Macedon's unshakeable foundation...,anger
FE11,21-ClashInMacedon,Gotoh,...Prince Marth...,joy
FE11,21-ClashInMacedon,Marth,"That voice! Lord Gotoh, is that you?",surprise
FE11,21-ClashInMacedon,Gotoh,"I see you have made it to Macedon. You will find me in a village north of the Macedon aerie, their castle. If you possess the Lightsphere and Starsphere, have them in hand when you visit me here. ...Ah, yes. I also have good news. Your sister Elice is unharmed.",joy
FE11,21-ClashInMacedon,Marth,What?! You are certain? Where is she now?,surprise
FE11,21-ClashInMacedon,Gotoh,"Thabes, city of illusion. Gharnef took her with him when he fled. I pray you rescue her soon.",fear
FE11,21-ClashInMacedon,Marth,I will!,neutral
FE11,21-ClashInMacedon,Gotoh,"But first, bring me the two orbs. Without Starlight’s mighty blast, Gharnef will only add your life to the list of things he has taken from you.",anger
FE11,00-Prologue4,Malledus,Prince Marth. ...Sire? Sire! Are you listening?!,surprise
FE11,00-Prologue4,Marth,Huh? ...Oh. Malledus.,surprise
FE11,00-Prologue4,Malledus,"Get ahold of yourself, Sire! I know how you grieve, but the Gra host that pursues us will not be interested. We must keep moving, and with all haste at that.",neutral
FE11,00-Prologue4,Marth,I...I'm sorry. These thoughts are hard to put aside.,sadness
FE11,00-Prologue4,Malledus,"From here, we will cross out of Altea and begin our escape to Talys. I trust you are prepared?",neutral
FE11,00-Prologue4,Marth,"Talys... I've heard the name. An island kingdom to the east, isn't it?",neutral
FE11,00-Prologue4,Malledus,"That is correct. The king there was a good friend to your father- and perhaps more importantly, a true friend. It was Princess Elice's wish that you seek refuge in Talys should things ever go awry.",neutral
FE11,00-Prologue4,Marth,"Me, but not her...",neutral
FE11,00-Prologue4,Malledus,"I've arranged for a boat to take us from the northeast shore. But to get there, we'll first need to cut through a prison to the north. I managed to come by a key to the premises. Let me hand it over.",neutral
FE11,00-Prologue4,Malledus,"Now, on the road, you may notice people who seem to be fighting for Gra against their own wishes. Before you resort to your blade, you should try talking to them first.",neutral
FE11,00-Prologue4,Young Man,"Boy, I don’t envy you! The enemy horde is closing in on you faster’n a bolt of Thoron. You and your friends had better hightail it on outta here!",anger
FE11,00-Prologue4,Old Man,Sometimes victory on a battlefield requires that someone you care about make a sacrifice. But parting with one comrade may be the only way to meet another. You need to accept your losses in life and move forward.,neutral
FE11,00-Prologue4,Woman,"My word! Aren’t you–No, you cannot stay here! Run! Before their soldiers come back! Here, this is the bow my granddaughter always used. Take it, sire! Please, promise you’ll stay safe...",joy
FE11,00-Prologue4,Captain,Enemies south of the prison?,neutral
FE11,00-Prologue4,Soldier,"Yes, sir. Not many of 'em, but the scouts say they're a tough bunch all the same. And guess who's with 'em...",neutral
FE11,00-Prologue4,Captain,...You're saying the prince is coming this way?,surprise
FE11,00-Prologue4,Soldier,"Yes, sir. How ought we proceed? The main force ‘as yet to arrive, and- to be honest, sir- we need 'em.",neutral
FE11,00-Prologue4,Captain,Bah! You're cowed too easily. We can win...if we set a trap.,anger
