game,chapter,speaker,text,tag
FE13Paralogues,P08-ADuelDisgraced,Kjelle,You would do this for a stranger?,surprise
FE13Paralogues,P08-ADuelDisgraced,Chrom,Is that a problem?,surprise
FE13Paralogues,P08-ADuelDisgraced,Kjelle,"N-no, of course not. Thank you.",neutral
FE13Paralogues,P08-ADuelDisgraced,Chrom,Excuse me—,neutral
FE13Paralogues,P08-ADuelDisgraced,Kjelle,"Wha—?! Die, fiend! Y-you parried my spear. But how did you... Wait. Do I know you? I feel as if we've met, but... No, that's impossible.",surprise
FE13Paralogues,P08-ADuelDisgraced,Chrom,"I hate to interrupt your musing, but could you perhaps lower your spear? We've been sent here to help you. They are too many for you to fight alone. We'll take care of the rabble while you fight your duel.",anger
FE13Paralogues,P08-ADuelDisgraced,Kjelle,You would do this for a stranger?,surprise
FE13Paralogues,P08-ADuelDisgraced,Chrom,Is that a problem?,surprise
FE13Paralogues,P08-ADuelDisgraced,Kjelle,"N-no, of course not. Thank you.",neutral
FE13Paralogues,P08-ADuelDisgraced,Cassius,Most people think a man who fights dirty is too weak to win otherwise. Heh heh... Suits me just fine. A cocky fool is an easy target!,anger
FE13Paralogues,P08-ADuelDisgraced,Kjelle,"If you believe in gods, you'd better pray to them now!",neutral
FE13Paralogues,P08-ADuelDisgraced,Cassius,"My, my. Aren't we confident?",neutral
FE13Paralogues,P08-ADuelDisgraced,Kjelle,"I don't fear you, coward!",anger
FE13Paralogues,P08-ADuelDisgraced,Cassius,"Aye, I suppose not. Most fools assume that liars and sneaks like me are weak. They want us to be weak, see? They NEED it. It lets them hold on to the fantasy that right prevails in the end. Heh... They can think what they want. A cocky fool is an easy target. Truth is, in the end, it's the clever ones who always survive.",anger
FE13Paralogues,P08-ADuelDisgraced,Kjelle,A man who takes hostages in order to win a duel has no claim to cleverness. Even an animal would not stoop so low! But enough. I've no more words to waste on the likes of you. My master will have vengeance!,anger
FE13Paralogues,P08-ADuelDisgraced,Cassius,"Wrong, girl. Your master will have COMPANY!",anger
FE13Paralogues,P08-ADuelDisgraced,Maiden,Kjelle! Thank the gods you're safe!,joy
FE13Paralogues,P08-ADuelDisgraced,Kjelle,I kept my promise. Your husband can rest in peace now.,sadness
FE13Paralogues,P08-ADuelDisgraced,Maiden,"I may have a way to thank you. This was his, and I'm sure he would have wanted you to have it.",joy
FE13Paralogues,P08-ADuelDisgraced,Kjelle,This is a precious keepsake. Its rightful place is with you.,neutral
FE13Paralogues,P08-ADuelDisgraced,Maiden,"I'll not forget my husband for lack of a memento, dear. Now please, take it.",sadness
FE13Paralogues,P08-ADuelDisgraced,Kjelle,You're certain?,neutral
FE13Paralogues,P08-ADuelDisgraced,Maiden,Absolutely.,neutral
FE13Paralogues,P08-ADuelDisgraced,Kjelle,Then...thank you.,joy
FE13Paralogues,P08-ADuelDisgraced,Maiden,"Just swear to take care of yourself, Kjelle. Swear you'll stay safe.",anger
FE13Paralogues,P08-ADuelDisgraced,Kjelle,I swear it.,anger
FE13Paralogues,P08-ADuelDisgraced,Sully,Looks like the good guys won after all. Ain't that a kick in the teeth?,anger
FE13Paralogues,P08-ADuelDisgraced,Kjelle,"Thank you for your help, but I fear other tasks yet lie ahead of me. I still have to find my parents.",neutral
FE13Paralogues,P08-ADuelDisgraced,Sully,"Aw, hell. Your parents are missing? That's rough, kid. Any idea where they might have gone?",anger
FE13Paralogues,P08-ADuelDisgraced,Kjelle,"I have a ring my father gave my mother, but precious little else to go on.",neutral
FE13Paralogues,P08-ADuelDisgraced,Sully,Mind if I take a look?,neutral
FE13Paralogues,P08-ADuelDisgraced,Kjelle,"No, of course not.",neutral
FE13Paralogues,P08-ADuelDisgraced,Sully,"Well, I'll be damned... Kid? This is MY ring.",anger
FE13Paralogues,P08-ADuelDisgraced,Kjelle,Your ring? But then...,surprise
FE13Paralogues,P08-ADuelDisgraced,Sully,"Hah! I get it. You're one of the kids who came back with Lucina, yeah? Which means...I've got a new lead for you on the parent front, kiddo. ...I'm your mom.",joy
FE13Paralogues,P08-ADuelDisgraced,Kjelle,Y-you?!,surprise
FE13Paralogues,P08-ADuelDisgraced,Sully,You expecting someone prettier?,surprise
FE13Paralogues,P08-ADuelDisgraced,Kjelle,N-no! Of course not! I mean... You look as beautiful now as when I knew you.,joy
FE13Paralogues,P08-ADuelDisgraced,Sully,Har! So I'm not all wrinkled or missing a hand or anything? That's a relief.,surprise
FE13Paralogues,P08-ADuelDisgraced,Kjelle,"You were a beautiful and vibrant woman, despite the ill times we lived in. You taught me how to be strong. You taught me to survive.",joy
FE13Paralogues,P08-ADuelDisgraced,Sully,"All right, kid, sit down. I want to know every last detail about the future.",neutral
FE13Paralogues,P08-ADuelDisgraced,Kjelle,You bet!,neutral
FE13Paralogues,P08-ADuelDisgraced,Sully,...Is that how you address you mother?,surprise
FE13Paralogues,P08-ADuelDisgraced,Kjelle,"I mean, y-yes! Yes ma'am!",neutral
FE13Paralogues,P08-ADuelDisgraced,Sully,Much better.,neutral
FE13Paralogues,P08-ADuelDisgraced,Kjelle,Hee hee. You always were tough on me.,joy
FE13Paralogues,P08-ADuelDisgraced,Sully,That's right. Any child of mine is gonna have to learn to respect their elders!,anger
FE13Paralogues,P08-ADuelDisgraced,Kjelle,"...It's good to see you, Mother.",joy
FE13Paralogues,P15-AShotFromTheDark,Ezra,"All alone are you lamb? Off searching for dear old mum? How very sweet. But the world's a dangerous place my dear, full of wolves waiting to snatch you up.",anger
FE13Paralogues,P15-AShotFromTheDark,Noire,"Um... th-thank you for the warning, sir, b-but...",joy
FE13Paralogues,P15-AShotFromTheDark,Ezra,"That's no warning, lamb. I'm a wolf, and you've been snatched! Now come quietly. Scars tend to lower the sale price.",anger
FE13Paralogues,P15-AShotFromTheDark,Frederick,"Slavers, milord. Such damnable scum...",anger
FE13Paralogues,P15-AShotFromTheDark,Chrom,We'll have to hurry if we hope to catch them.,fear
FE13Paralogues,P15-AShotFromTheDark,Tharja,"Or we could stay here and just let me go to work on them. A curse to wither them away, perhaps? A slow death over a year? Oh, fie. Let's make it two.",anger
FE13Paralogues,P15-AShotFromTheDark,Chrom,I think their captive would likely appreciate something a bit more immediate. Shepherds! Saving the girl is our top priority! Now move out!,joy
FE13Paralogues,P15-AShotFromTheDark,Noire,"It's over... My life is over... Mother, I'll be by your side soon...",sadness
FE13Paralogues,P15-AShotFromTheDark,Noire,"So this is how it ends... Killed... or worse. A clean death would be a mercy compared to what awaits... Huh? What's this? An old bow? Hmm, the string's still taut. I suppose I could use this to try and fight my way out. B-but those bandits are so strong and scary and... W-wait! My talisman! Let me just grab my talisman and then... ...... ...I AM THE FIRE AND FURY! ALL WHO DEFY ME WILL PERISH! REPENT, SCUM! REPENT THOUGH IT WILL SAVE YOU NOT! REPENT AND DESPAIR! BWAAA HA HA HA HA!",anger
FE13Paralogues,P15-AShotFromTheDark,Noire,"Oh, thank you! Thank you so much! Had you not saved me, I... I fear to even think what would have happened...",joy
FE13Paralogues,P15-AShotFromTheDark,Chrom,"It's all right, take it easy. No one's going to hurt you now.",neutral
FE13Paralogues,P15-AShotFromTheDark,Noire,"*Sniff* P-please, sir... Let me come with you. There's someone I need to talk to, but I'm s-scared to be alone...",fear
FE13Paralogues,P15-AShotFromTheDark,Tharja,What do you want?,neutral
FE13Paralogues,P15-AShotFromTheDark,Noire,"I, um... I mean... Er... H-here, please look at this.",sadness
FE13Paralogues,P15-AShotFromTheDark,Tharja,Nice ring. Looks just like mine. You messing around with alchemy? Or is this something... darker?,surprise
FE13Paralogues,P15-AShotFromTheDark,Noire,Wha--? N-no! It's nothing of the sort! It's just...,surprise
FE13Paralogues,P15-AShotFromTheDark,Tharja,"Tell me the truth, girl. You don't want to see what happens if you lie to me.",neutral
FE13Paralogues,P15-AShotFromTheDark,Noire,"P-please, just give me... I n-need a moment... M-my talisman... Wh-where is my talisman... ......",sadness
FE13Paralogues,P15-AShotFromTheDark,Tharja,......,neutral
FE13Paralogues,P15-AShotFromTheDark,Noire,I AM BLOOD AND THUNDER! I AM A RIGHTEOUS FURY! ...I AM YOUR FUTURE DAUGHTER!,anger
FE13Paralogues,P15-AShotFromTheDark,Tharja,You are trying my patience.,neutral
FE13Paralogues,P15-AShotFromTheDark,Noire,"INSOLENCE! I speak the truth! The ring I bear also hails from the future. A memento of you, my departed mother!",anger
FE13Paralogues,P15-AShotFromTheDark,Tharja,And that bizarre talisman?,surprise
FE13Paralogues,P15-AShotFromTheDark,Noire,"Your own handiwork! Wrought to steel the mewling heart of your coward daughter! In its strength did I find blessed escape from grief and solitude! Fear of death and killing, too, it drove from me, until I became an avatar of retribution! Only by clinging to it have I survived the crushing desolation of a ruinated future! BWAA HA HA HA HA!",anger
FE13Paralogues,P15-AShotFromTheDark,Tharja,"Oh, give me that.",neutral
FE13Paralogues,P15-AShotFromTheDark,Noire,"Um, w-wait! I need that! Without it, I can't--",neutral
FE13Paralogues,P15-AShotFromTheDark,Tharja,Survive? You can and will. And not by becoming some avatar of retribution. Just be my daughter. Leave the retribution to me.,anger
FE13Paralogues,P15-AShotFromTheDark,Noire,M-Mother...,neutral
FE13Paralogues,P15-AShotFromTheDark,Tharja,"My, this is a nasty little number. The future me is good. ...And very, very bad. Hee hee. I can't wait.",anger
FE13Paralogues,P15-AShotFromTheDark,Noire,"M-Mother, you're f-frightening me! ...A-again!",fear
FE13Paralogues,P15-AShotFromTheDark,Tharja,"This little trinket will advance my research in the dark arts nicely... Hmm... You have my blood, right? I'm going to need a bit of it back.",neutral
FE13Paralogues,P15-AShotFromTheDark,Noire,Aaaaiiieee! I... I mean... BLEED ME DRY AND I SHALL BE AS THUNDER STILL!,sadness
FE13Paralogues,P15-AShotFromTheDark,Tharja,See. No daughter of mine needs some mummer's prop to be strong. Hee... Hee hee...,joy
FE13Paralogues,P15-AShotFromTheDark,Noire,BWAAA HA HA HA HA!,joy
FE13Paralogues,P15-AShotFromTheDark,Tharja,Eee hee hee hee hee!,joy
FE13Paralogues,P15-AShotFromTheDark,Chrom,"Oh, this is just wonderful...",joy
FE13Paralogues,P16-DaughterToDragons,Nah,"All right, Nah... You can do this.You're strong! You're brave! You... EEEEEEK! Ha ha...haaaaa... Just a statue. Nothing to be afraid of...",fear
FE13Paralogues,P16-DaughterToDragons,Nah,"AAAAAH! What the heck is that?!  *Huff, huff* ...Wait a minute, this is silly. I can turn into a dragon... What am I worried about? Now how do I get out of this wretched place?",fear
FE13Paralogues,P16-DaughterToDragons,Chrom,"Did anyone else hear a girl scream? Come on, Shepherds! Hurry!",fear
FE13Paralogues,P16-DaughterToDragons,Nah,Eeeeeek!,fear
FE13Paralogues,P16-DaughterToDragons,Chrom,Wait! I'm a friend! We're here to help.,neutral
FE13Paralogues,P16-DaughterToDragons,Nah,"Whew, good thing you spoke up there... I was about to melt you with my breath.",neutral
FE13Paralogues,P16-DaughterToDragons,Chrom,Huh? Your breath seems fine to me...? ...Oh. I get it. You're a manakete. So perhaps you'd like to tell me your name?,surprise
FE13Paralogues,P16-DaughterToDragons,Nah,Nah.,neutral
FE13Paralogues,P16-DaughterToDragons,Chrom,"Look, if I somehow offended you, I apologize. But you could at least-",sadness
FE13Paralogues,P16-DaughterToDragons,Nah,"No, NAH. N-A-H. That's my name. Ugh, why does this always happen...",sadness
FE13Paralogues,P16-DaughterToDragons,Chrom,"Er, right. Let's discuss it later, okay? For now, just stay behind me.",neutral
FE13Paralogues,P16-DaughterToDragons,Nah,"Behind you? I can turn into a dragon, you know. I'm pretty strong.",neutral
FE13Paralogues,P16-DaughterToDragons,Chrom,"Dragonkin or no, you're still a child, and I won't have you taking unnecessary risks. Now let's get you out of here.",anger
FE13Paralogues,P16-DaughterToDragons,Nah,"Stern, aren't you? Fair enough. I like your attitude. Lead the way, sir. I'm right behind you.",neutral
FE13Paralogues,P16-DaughterToDragons,Nowi,"Ooh, you're the little girl we're looking for!",anger
FE13Paralogues,P16-DaughterToDragons,Nah,It takes one to know one...,neutral
FE13Paralogues,P16-DaughterToDragons,Nowi,"Ha-hah! It may look that way, but I'm actually quite old. I'm a dragonkin!",neutral
FE13Paralogues,P16-DaughterToDragons,Nah,"Oh? Well so am I, actua- Wait, are you Nowi?",surprise
FE13Paralogues,P16-DaughterToDragons,Nowi,"Wow, nice guess!",joy
FE13Paralogues,P16-DaughterToDragons,Nah,It IS you!,surprise
FE13Paralogues,P16-DaughterToDragons,Nowi,"All right, I've told you my name. Now you tell me yours.",neutral
FE13Paralogues,P16-DaughterToDragons,Nah,Nah.,neutral
FE13Paralogues,P16-DaughterToDragons,Nowi,"Oh, come on, why not?!",surprise
FE13Paralogues,P16-DaughterToDragons,Nah,"No, NAH. N-A-H. That's my name.",neutral
FE13Paralogues,P16-DaughterToDragons,Nowi,That's a confusing name...,neutral
FE13Paralogues,P16-DaughterToDragons,Nah,And whose fault is that?!,surprise
FE13Paralogues,P16-DaughterToDragons,Nowi,"How the heck should I know? Anyway, this place isn't safe. Let's get you out of here!",surprise
FE13Paralogues,P16-DaughterToDragons,Nah,After you...,neutral
FE13Paralogues,P16-DaughterToDragons,Nah,"Thank you so much. If you hadn't have come, I'd have been an adorable smear on the wall by now...",joy
FE13Paralogues,P16-DaughterToDragons,Chrom,Can you make it home on your own?,surprise
FE13Paralogues,P16-DaughterToDragons,Nah,I... I don't have a home. Not anymore.,sadness
FE13Paralogues,P16-DaughterToDragons,Chrom,Then I'll arrange one for you in Ylisse.,neutral
FE13Paralogues,P16-DaughterToDragons,Nah,"No, my place is here with you now. I'm strong enough to fight, you know.",neutral
FE13Paralogues,P16-DaughterToDragons,Chrom,"Well, seeing as you're a manakete, I certainly don't doubt that... Look, if you're sure this is what you want, then we'd love to have you.",neutral
FE13Paralogues,P16-DaughterToDragons,Nah,I'm sure. And thank you. You won't regret it.,joy
FE13Paralogues,P16-DaughterToDragons,Nah,"Can I ask you something, Nowi? Does this look familiar?",neutral
FE13Paralogues,P16-DaughterToDragons,Nowi,"Whoa, you have the same ring as me! What a crazy coincidence!",surprise
FE13Paralogues,P16-DaughterToDragons,Nah,"It's not a coincidence. This is your ring. It's a memento of my mother. From... the future. It keeps me safe, now that... Now that you're gone.",neutral
FE13Paralogues,P16-DaughterToDragons,Nowi,Nah...,neutral
FE13Paralogues,P16-DaughterToDragons,Nah,"No, I'm serious. It does.",fear
FE13Paralogues,P16-DaughterToDragons,Nowi,"Huh? Oh, hee hee! You did it to yourself that time! But no, I think it's very sweet. And now that you're with me, you don't have to hold back.",joy
FE13Paralogues,P16-DaughterToDragons,Nah,I wasn't holding back. I fought as hard as I could...,sadness
FE13Paralogues,P16-DaughterToDragons,Nowi,"No, you fought brilliantly, Nah. But that's not what I meant. I was talking about your tears. If you're sad, you can talk to me.",sadness
FE13Paralogues,P16-DaughterToDragons,Nah,"No, I... I have to be strong. Everyone expects me to. I can turn into a dragon, you know? And that's not... normal. So I have to put on a brave face and protect everyone, just like you do.",sadness
FE13Paralogues,P16-DaughterToDragons,Nowi,"Your mother cries all the time, dear. ...Aaaaaall the time. Trust me on this—holding things back won't make you stronger. Just be you, Nah. That's enough.",sadness
FE13Paralogues,P16-DaughterToDragons,Nah,"I... This whole time, I...",sadness
FE13Paralogues,P16-DaughterToDragons,Nowi,"I know it's been pretty scary, but you made it through!",joy
FE13Paralogues,P16-DaughterToDragons,Nah,"*Sniff* Mother, I... Oh, it was awful... I thought I was going to DIE... *Sob* Waaaaaah!",sadness
FE13Paralogues,P16-DaughterToDragons,Nowi,"*Sniff* It... it's okay, Nah. Mother's here, now.",sadness
FE13Paralogues,P09-WingsOfJustice,Robin,Quite the bustling little town.,neutral
FE13Paralogues,P09-WingsOfJustice,Chrom,The harvest must've just come in. I wager there's some good eating to be had!,neutral
FE13Paralogues,P09-WingsOfJustice,Lissa,Count me in! It's been DAYS since I had a proper meal!,neutral
FE13Paralogues,P09-WingsOfJustice,Villager,Welcome to the Grub Sh-ACK! Y-you're... You're...,joy
FE13Paralogues,P09-WingsOfJustice,Chrom,Um...?,neutral
FE13Paralogues,P09-WingsOfJustice,Villager,"T-terribly sorry, sir, but we're closed!",sadness
FE13Paralogues,P09-WingsOfJustice,Chrom,That was...odd. I guess we'll try elsewhere.,neutral
FE13Paralogues,P09-WingsOfJustice,Lucina,"This place looks open, Father. ...Ooh, they have pottage!",anger
FE13Paralogues,P09-WingsOfJustice,Maiden,Eeek!,fear
FE13Paralogues,P09-WingsOfJustice,Lucina,Hmm?,neutral
FE13Paralogues,P09-WingsOfJustice,Maiden,"P-please, not again! We'll be ruined! This tavern is all we have! Mercy, sirs! Leave us in peace!",fear
FE13Paralogues,P09-WingsOfJustice,Chrom,People here don't seem to like us very much.,neutral
FE13Paralogues,P09-WingsOfJustice,Frederick,"I did a little investigating on that front, milord. It seems a band of nasty rogues have been harrying them without pause for some time. Apparently, they are led by a man who masquerades as...you.",anger
FE13Paralogues,P09-WingsOfJustice,Chrom,*Sigh* So that's what this is about. Any idea where they are?,surprise
FE13Paralogues,P09-WingsOfJustice,Frederick,"It seems they headed north, milord.",neutral
FE13Paralogues,P09-WingsOfJustice,Chrom,Then so shall we.,neutral
FE13Paralogues,P09-WingsOfJustice,Ruger,Heh heh... Another fine haul. Long live the great Chrom!,joy
FE13Paralogues,P09-WingsOfJustice,Cynthia,"Chrom? Father? Faaather? Pegasus Knight Cynthia, returned from patrol, sir! ...Whoops!  Ooh... Right on the face... S-sorry for my clumsiness, sir! I promise not to trip again for at least 24 hours!",sadness
FE13Paralogues,P09-WingsOfJustice,Ruger,"That'd be a new record... Now out with it, girl! What'd you see?",surprise
FE13Paralogues,P09-WingsOfJustice,Cynthia,"A suspicious band of travelers have been making inquiries in town, sir.",neutral
FE13Paralogues,P09-WingsOfJustice,Ruger,Oh?,surprise
FE13Paralogues,P09-WingsOfJustice,Cynthia,"They call their leader Chrom, sir. I suspect they are impostors posing as you! They must be stopped at once, Father!",neutral
FE13Paralogues,P09-WingsOfJustice,Ruger,"Cynthia, what did I say about calling me that around the men?",surprise
FE13Paralogues,P09-WingsOfJustice,Cynthia,"S-sorry, Father! I mean, Chrom! Milord! ...It won't happen again.",sadness
FE13Paralogues,P09-WingsOfJustice,Ruger,"Your mind's near as slippery as your feet... Anyway, we, uh, don't have the men to battle this impostor right now. Best swallow our pride and exercise the better part of valor for now.",neutral
FE13Paralogues,P09-WingsOfJustice,Cynthia,"Levelheaded and humble as ever, sir! Allow me to draw their attention while you retreat to safety!",neutral
FE13Paralogues,P09-WingsOfJustice,Ruger,"Yes, yes, of course. A fine plan.",neutral
FE13Paralogues,P09-WingsOfJustice,Cynthia,"I won't let you down, sir!",anger
FE13Paralogues,P09-WingsOfJustice,Ruger,"...... ...Gads, she's dumb as a brick. Good thing her spear is sharper than her wit. Still, at least she stopped ranting about hailing from the future...",anger
FE13Paralogues,P09-WingsOfJustice,Ruger,Heh heh... Another fine haul. Long live the great Chrom!,joy
FE13Paralogues,P09-WingsOfJustice,Cynthia,"Chrom? Sir? Pegasus Knight Cynthia, returned from patrol, sir! ...Whoops!  Oof... Right on the face... S-sorry for my clumsiness, sir! I promise not to trip again for at least 24 hours!",sadness
FE13Paralogues,P09-WingsOfJustice,Ruger,"That'd be a new record... Now out with it, girl! What did you see?",surprise
FE13Paralogues,P09-WingsOfJustice,Cynthia,"A suspicious band of travelers have been making inquiries in town, sir.",neutral
FE13Paralogues,P09-WingsOfJustice,Ruger,Oh?,surprise
FE13Paralogues,P09-WingsOfJustice,Cynthia,"They call their leader Chrom, sir. I suspect they are impostors posing as you! They must be stopped at once!",neutral
FE13Paralogues,P09-WingsOfJustice,Ruger,"Er, riiight. Posing as...me. But, uh, we don't have the men to battle these impostors right now. Best swallow our pride and exercise the better part of valor for now.",neutral
FE13Paralogues,P09-WingsOfJustice,Cynthia,"Levelheaded and humble as ever, sir! Allow me to draw their attention while you retreat to safety!",neutral
FE13Paralogues,P09-WingsOfJustice,Ruger,"Yes, yes, of course. A fine plan.",neutral
FE13Paralogues,P09-WingsOfJustice,Cynthia,"I won't let you down, sir!",anger
FE13Paralogues,P09-WingsOfJustice,Ruger,"...... Gads, she's dumb as a brick. ...Still, full marks for enthusiasm.",anger
FE13Paralogues,P09-WingsOfJustice,Chrom,And you are...?,surprise
FE13Paralogues,P09-WingsOfJustice,Cynthia,"All who would pretend to Chrom's name will answer to me for their deceit! Lay down your arms and surrender, or face judgement at my spear!",anger
FE13Paralogues,P09-WingsOfJustice,Chrom,"Well, she certainly seems eager. What do you think, Robin? If she's being honestly deceived, we may be able to show her the truth.",neutral
FE13Paralogues,P09-WingsOfJustice,Cynthia,"Enough! In the name of my lord Chrom, cast down your sword or draw it!",anger
FE13Paralogues,P09-WingsOfJustice,Ruger,"Hmm? A band of mercenaries? Luck smiles on me today! A few pretty lies, and I'll have the lot of 'em fighting for me!",joy
FE13Paralogues,P09-WingsOfJustice,Ruger,"Haaalp! I am Chrom, ruler of Ylisse! I'm being hunted by brigands! If you help me, I'll see to it that you're handsomely rewarded!",anger
FE13Paralogues,P09-WingsOfJustice,Ruger,"Hold fast until I give the word. The moment they clear that rubble, fall on them like an avalanche!",fear
FE13Paralogues,P09-WingsOfJustice,Ruger,"Still not coming, are you? Then the initiative will be ours!",surprise
FE13Paralogues,P09-WingsOfJustice,Sumia,"Pardon me, but...I think you may be misinformed. Can we speak a moment?",neutral
FE13Paralogues,P09-WingsOfJustice,Cynthia,Don't waste your breath! Your lies ring hollow! Your...ring? ...Ring? Y-your RING! MOTHER!,surprise
FE13Paralogues,P09-WingsOfJustice,Sumia,...What?,surprise
FE13Paralogues,P09-WingsOfJustice,Cynthia,"It is you! Oh, Mother, you're alive! I never thought I'd see you again! I...I... *sniff* Waaaaaaaaaah!",sadness
FE13Paralogues,P09-WingsOfJustice,Sumia,Um...are you all right?,surprise
FE13Paralogues,P09-WingsOfJustice,Cynthia,"WAIT! But if you're on that side, that means... Ohmigosh. My Chrom is a FAKE! Oh, I am going to KILL him for this! I'm going to plant a flying hoof right in his stupid liar face!",anger
FE13Paralogues,P09-WingsOfJustice,Sumia,"Wait! We really should... Well, at least she's not confused anymore. If only I could say the same for me...",sadness
FE13Paralogues,P09-WingsOfJustice,Chrom,Still your spear a moment and hear me out. You've been lied to!,neutral
FE13Paralogues,P09-WingsOfJustice,Cynthia,"Spare me your tales, brigand! I have nothing to say to someone who would impersonate my mother's dearest friend!",anger
FE13Paralogues,P09-WingsOfJustice,Chrom,Your...mother?,surprise
FE13Paralogues,P09-WingsOfJustice,Cynthia,You heard me! How dare you besmirch my mother Sumia's name!,anger
FE13Paralogues,P09-WingsOfJustice,Chrom,"And it all becomes clear... Well, welcome to the past.",neutral
FE13Paralogues,P09-WingsOfJustice,Cynthia,Wha—?! But how could you know?,surprise
FE13Paralogues,P09-WingsOfJustice,Chrom,That you came from the future? Lucina told me all about it.,neutral
FE13Paralogues,P09-WingsOfJustice,Cynthia,Lucy's here?!,surprise
FE13Paralogues,P09-WingsOfJustice,Chrom,In the flesh.,neutral
FE13Paralogues,P09-WingsOfJustice,Cynthia,Then...you're the real Chrom?,surprise
FE13Paralogues,P09-WingsOfJustice,Chrom,Last I checked.,neutral
FE13Paralogues,P09-WingsOfJustice,Cynthia,"Ugh, I'm so sorry! I've always been gullible, ever since I was a little girl, but... Hey! This means the other Chrom LIED! Oh, I'm going to kill him for this! I'm going to plant a flying hoof right in his stupid liar face!",anger
FE13Paralogues,P09-WingsOfJustice,Chrom,Still your spear a moment and hear me out. You've been lied to!,neutral
FE13Paralogues,P09-WingsOfJustice,Cynthia,"Spare me your tales, brigand! I've nothing to say to someone who would impersonate my father!",anger
FE13Paralogues,P09-WingsOfJustice,Chrom,"Your what? Oh, for the love of... How many daughters are going to come back in time to see me?",surprise
FE13Paralogues,P09-WingsOfJustice,Cynthia,Huh? H-how did you know I-,surprise
FE13Paralogues,P09-WingsOfJustice,Chrom,I already went through this with Lucina.,neutral
FE13Paralogues,P09-WingsOfJustice,Cynthia,Lucy's here?!,surprise
FE13Paralogues,P09-WingsOfJustice,Chrom,In the flesh. ...Though she neglected to mention she had a sister.,neutral
FE13Paralogues,P09-WingsOfJustice,Cynthia,"Wait—then you really are...! Oh, Father! I missed you SOOOOO MUUUCH!",surprise
FE13Paralogues,P09-WingsOfJustice,Chrom,My... my ears...,neutral
FE13Paralogues,P09-WingsOfJustice,Cynthia,I knew something was fishy with that guy! He barely even smiled when I found him. My REAL father would've given me a big hug and called me his little pega-pony princess!,joy
FE13Paralogues,P09-WingsOfJustice,Chrom,...Please tell me I never actually say that.,sadness
FE13Paralogues,P09-WingsOfJustice,Cynthia,"You'll say it right now, if you want me to believe you're the real Chrom!",neutral
FE13Paralogues,P09-WingsOfJustice,Chrom,"Uh... It's... it's good to see you, my... Um... My little pega-pony princess...",joy
