game,chapter,speaker,text,tag
FE13Paralogues,P02-TheSecretSeller,Vincent,"I do believe it is, Victor! Oh, but try not to kill them all this time, hmm? It tends to cut into profits.",anger
FE13Paralogues,P02-TheSecretSeller,Anna,"Hate to be the bearer of bad news, but I'm afraid this village is closed.",fear
FE13Paralogues,P02-TheSecretSeller,Victor,"You! We have business, you and I, and I aim to settle the debt. Vincent will be avenged today!",neutral
FE13Paralogues,P02-TheSecretSeller,Anna,"Oh, dear. Have we met?",sadness
FE13Paralogues,P02-TheSecretSeller,Victor,"Playing dumb won't save you, girly. The gold you net from the slavers will build Vincent the finest grave in the land!",anger
FE13Paralogues,P02-TheSecretSeller,Anna,"Careful, love. Us traders are known to make some very deep cuts.",neutral
FE13Paralogues,P02-TheSecretSeller,Frederick,That village is in danger. One must ride ahead and warn them of what's coming.,fear
FE13Paralogues,P02-TheSecretSeller,Chrom,...Anna? What are you doing here?,surprise
FE13Paralogues,P02-TheSecretSeller,Anna,"My thanks, stranger. It's nice to see a friendly face for once.",joy
FE13Paralogues,P02-TheSecretSeller,Chrom,"Stranger? Now I'm confused. Aren't you...? I mean... Anyway, never mind. The important thing is that you're safe. You seem to have things well in hand, but I hope you won't mind a little company? Just until we sort these rogues out.",surprise
FE13Paralogues,P02-TheSecretSeller,Anna,"Aw, you're worried! That's adorable! I welcome the assistance.",joy
FE13Paralogues,P02-TheSecretSeller,Anna,"Ugh. Well, that was careless... Sorry, friends. Looks like I've got to close up shop for today.",sadness
FE13Paralogues,P02-TheSecretSeller,Elder,"That peddler woman was fighting to protect the village, you say? That kind of warmth is more than welcome in these cold lands. Here. Please use this to heal her if she's hurt.",neutral
FE13Paralogues,P02-TheSecretSeller,Victor,"Give up now! I was born a Victor, and victory will be mine!",anger
FE13Paralogues,P02-TheSecretSeller,Victor,"I... I see an open field, Vincent... Such beautiful flowers...",joy
FE13Paralogues,P02-TheSecretSeller,Anna,"Ah, I see now. You must have met one of my sisters.",neutral
FE13Paralogues,P02-TheSecretSeller,Chrom,"Sisters? Gods, you look identical.",neutral
FE13Paralogues,P02-TheSecretSeller,Anna,"Yes, there's a strong family resemblance. Oh, and we're all traveling merchants.",neutral
FE13Paralogues,P02-TheSecretSeller,Chrom,...With the same name?,surprise
FE13Paralogues,P02-TheSecretSeller,Anna,"Yes, actually.",neutral
FE13Paralogues,P02-TheSecretSeller,Chrom,Your holiday feasts must be very confusing. How do you tell each other apart?,surprise
FE13Paralogues,P02-TheSecretSeller,Anna,"Heh, that's part of the secret! Anyway, happy shopping, and may the gods of the open road keep you!",joy
FE13Paralogues,P01-SickleToSword,Donnel,"Halp! You gots to help us! I’m beggin’ you, milords!",anger
FE13Paralogues,P01-SickleToSword,Chrom,Slow down. What happened?,surprise
FE13Paralogues,P01-SickleToSword,Brigand,Oy! There’s the wee piglet!,anger
FE13Paralogues,P01-SickleToSword,Chrom,...Great. Bandits.,neutral
FE13Paralogues,P01-SickleToSword,Brigand,"What’s this? A little lording come to watch over his chattel? Haw ha—Aw, damn me! Sh-Shepherds!",anger
FE13Paralogues,P01-SickleToSword,Chrom,"That’s right. So, what’ll it be? Run and live? Or fight and die?",fear
FE13Paralogues,P01-SickleToSword,Brigand,Rrgh!,anger
FE13Paralogues,P01-SickleToSword,Chrom,"Quickly, lad. What happened here?",surprise
FE13Paralogues,P01-SickleToSword,Donnel,"Y-yes, milord! Right away, milord! ...Er, if it please Your Graciousness.",fear
FE13Paralogues,P01-SickleToSword,Chrom,Maybe just hold off on titles for now. What’s your name?,surprise
FE13Paralogues,P01-SickleToSword,Donnel,"Donny. Er, that is, Donnel. ...Your Majestyful. I live in the village just beyond, sir.",neutral
FE13Paralogues,P01-SickleToSword,Chrom,"I guess that’ll do. Now, what happened?",neutral
FE13Paralogues,P01-SickleToSword,Donnel,"That rotten-toothed, pig-stinkin’ bandit you just ran off attacked us! Er, pardon my language, You Lordliness. I’m the only one what got away, and even then just barely. They were roundin’ up others to haul ‘em off to a bandit camp... Please, sir! You gots to save them folks! My ma’s one of ‘em, and... She’s all I got in this world! Please, Your Royal Highness!",anger
FE13Paralogues,P01-SickleToSword,Chrom,"This blasted war seems to spawn more evils by the day. All right, Donny. We’ll save your ma. Can you lead us to her?",anger
FE13Paralogues,P01-SickleToSword,Donnel,"Aw, thank you, milord! Thank you! Just follow me, Your Sirness!",joy
FE13Paralogues,P01-SickleToSword,Roddick,...And you’re sure a’this?,neutral
FE13Paralogues,P01-SickleToSword,Brigand,"On the grave of my sainted mother, I swear it. It was Chrom and his Shepherds, and no mistake!",anger
FE13Paralogues,P01-SickleToSword,Roddick,Heh heh heh. A fancy lord’ll fetch a high ransom from noble folk. We’ll have the little man squealin’ for mercy in no time!,joy
FE13Paralogues,P01-SickleToSword,Mother,"We got nothin’ left to take, sirs! Please, let our children go!",fear
FE13Paralogues,P01-SickleToSword,Roddick,Quit yer bleatin’!,anger
FE13Paralogues,P01-SickleToSword,Brigand,"Oy, Roddick! I think this cow’s the mum of the brat what ran away.",anger
FE13Paralogues,P01-SickleToSword,Roddick,"...Say, I know this one. You’re the wife of the man what broke my rib last time we were ‘ere.",sadness
FE13Paralogues,P01-SickleToSword,Mother,"And you killed him for it, monster! I wish he’d done for you first...",anger
FE13Paralogues,P01-SickleToSword,Roddick,"Small wonder the brat’s got more brass than brains if you’re his mum. Guess we’ll see for ourselves when we catch him, eh? Maybe we’ll even make ya watch as we gut him! Bwa ha ha!",anger
FE13Paralogues,P01-SickleToSword,Mother,"N-no! Please, he’s just a boy!",fear
FE13Paralogues,P01-SickleToSword,Donnel,"This here’s where they’ve taken up camp, Your Lordshipness.",neutral
FE13Paralogues,P01-SickleToSword,Chrom,"Er...right. Thanks, Donny. Stay close, now.",neutral
FE13Paralogues,P01-SickleToSword,Donnel,"Beg pardon, milord? You don’t mean...? I...I can’t fight, sir! I ain’t never even stuck a pig before!",anger
FE13Paralogues,P01-SickleToSword,Chrom,"Oh, sorry. I just assumed... I mean... Look, just stay here. You’ll be fine.",sadness
FE13Paralogues,P01-SickleToSword,Donnel,"I wish I was strong as you sirs and madams! Kick that scum out single handed, I would!",anger
FE13Paralogues,P01-SickleToSword,Chrom,Then you should fight and grow stronger.,neutral
FE13Paralogues,P01-SickleToSword,Donnel,But I ain’t—,neutral
FE13Paralogues,P01-SickleToSword,Chrom,"No man is born a warrior, Donny. And farm work makes for fine training—a sickle’s not far from a sword, after all. Bandits may be tougher than wheat, but the principle’s the same.",neutral
FE13Paralogues,P01-SickleToSword,Donnel,"Ngh... *sniff* A-all right, milord. As you say, I’m no warrior. But these’re my people. I gots to do what I can!",sadness
FE13Paralogues,P01-SickleToSword,Chrom,Everyone in place?,neutral
FE13Paralogues,P01-SickleToSword,Donnel,R-ready! *ulp*,neutral
FE13Paralogues,P01-SickleToSword,Donnel,"Fight and get stronger, he says... Guess it can’t hurt to try. I sure hope I don’t get in the way! Gosh, that would be just awful...",fear
FE13Paralogues,P01-SickleToSword,Donnel,I don’t think I can... go any farther... Your Majestiness...,sadness
FE13Paralogues,P01-SickleToSword,Chrom,"You’ve done enough, Donny! Fall back! We’ll take things from here.",fear
FE13Paralogues,P01-SickleToSword,Donnel,S-sorry...,sadness
FE13Paralogues,P01-SickleToSword,Roddick, Time them castle whelps learned what us wild-born men can do!,anger
FE13Paralogues,P01-SickleToSword,Roddick, Gahaugh! Nngh...This ain't...where...,sadness
FE13Paralogues,P01-SickleToSword,Donnel,We did it! We’re rid of them bandits for good and all!,anger
FE13Paralogues,P01-SickleToSword,Chrom,"A worthy first victory, Donny. You fought well.",joy
FE13Paralogues,P01-SickleToSword,Donnel,"Ma! Ma, it’s me!",neutral
FE13Paralogues,P01-SickleToSword,Mother,"Oh, Donny! Thank goodness you’re safe! I was worried near to death, boy! I can’t thank you enough for savin’ my son and our village, milord. ...Donny! Where are your manners?! Take a knee and thank His Lordness!",joy
FE13Paralogues,P01-SickleToSword,Donnel,"Er, I can’t begin to repay all what you done for us, sir! Th-thank you!",joy
FE13Paralogues,P01-SickleToSword,Chrom,"You led the charge, Donny. We just picked off the stragglers. Hone your potential and use it to keep this village safe.",neutral
FE13Paralogues,P01-SickleToSword,Donnel,W-wait! Please!,fear
FE13Paralogues,P01-SickleToSword,Chrom,Something wrong?,neutral
FE13Paralogues,P01-SickleToSword,Donnel,"I has a request, sir. If it please Your Graceliness... Take me with you, milord! Lemme be a Shepherd like you! I’m good with livestock, I am! Please, sir!",joy
FE13Paralogues,P01-SickleToSword,Mother,"Hush now, you fool boy!",anger
FE13Paralogues,P01-SickleToSword,Donnel,I want to hone my...whatever he said. I want to keep this place safe! I never thought I was good for nothin’ more than shovelin’ dirt... But milord showed me there’s more I can do. More I needs to be doing!,sadness
FE13Paralogues,P01-SickleToSword,Mother,"You needs be knowin’ your place, boy! A farmhand’s no fit for a royal—",neutral
FE13Paralogues,P01-SickleToSword,Chrom,"Actually, we’d be thrilled to have him. The Shepherds need every good man we can find, and your son fought bravely.",joy
FE13Paralogues,P01-SickleToSword,Mother,"Y-you’re very kind to say as much, Your Lordshipness, but... *Siiigh* Well, you’re a man grown now, Donny. I s’pose you can make up your own mind.",neutral
FE13Paralogues,P01-SickleToSword,Donnel,"Aw, Ma...",neutral
FE13Paralogues,P01-SickleToSword,Mother,"...... You just come home safe, love. I’ll see that the village is still standin’ when you return a hero. ...Well?! Off with you, then! Glory’s waiting’, boy!",joy
FE13Paralogues,P01-SickleToSword,Donnel,"I ain’t fightin’ for glory, Ma. I’m fightin’ for you! But if I do find some glory, I’ll be sure to bring it home for you!",joy
FE13Paralogues,P01-SickleToSword,Mother,"...Just come home alive, Donny.",sadness
FE13Paralogues,P01-SickleToSword,Donnel,"Ma! Ma, it’s me!",neutral
FE13Paralogues,P01-SickleToSword,Mother,"Oh, Donny! Thank goodness you’re safe! I was worried near to death, boy! I can’t thank you enough for savin’ my son and our village, milord. ...Donny! Where are your manners?! Take a knee and thank His Lordness!",joy
FE13Paralogues,P01-SickleToSword,Donnel,"Er, I can’t begin to repay all what you done for us, sir! Th-thank you!",joy
FE13Paralogues,P01-SickleToSword,Chrom,"You did enough, Donny. And you’re young yet. In time, you’ll be defending this village single handedly.",neutral
FE13Paralogues,P01-SickleToSword,Donnel,"Still, I... I’m sorry I wasn’t more help, Your Princeliness.",sadness
FE13Paralogues,P17-TheThreatOfSilence,Chrom,Mmm... The air is sweet here. It's so calming.,joy
FE13Paralogues,P17-TheThreatOfSilence,Lissa,"Makes you want to just flop down and take a huge nap, doesn't it?",neutral
FE13Paralogues,P17-TheThreatOfSilence,Lucina,Tempting...,neutral
FE13Paralogues,P17-TheThreatOfSilence,Robin,Odd. It seems like anywhere else to me...,surprise
FE13Paralogues,P17-TheThreatOfSilence,Say'Ri,"This is Naga's Cradle. It is said the divine dragon once called this place home. Here, the Voice will enact a holy rite to commune with Naga and regain her power.",neutral
FE13Paralogues,P17-TheThreatOfSilence,Tiki,......,neutral
FE13Paralogues,P17-TheThreatOfSilence,Lucina,Lady Tiki.,neutral
FE13Paralogues,P17-TheThreatOfSilence,Tiki,......,neutral
FE13Paralogues,P17-TheThreatOfSilence,Lucina,...Lady Tiki?,surprise
FE13Paralogues,P17-TheThreatOfSilence,Say'Ri,"Pray be silent, milady. The Voice is currently performing the rite. In doing so, she will draw the divine dragon's power from the land unto herself.",fear
FE13Paralogues,P17-TheThreatOfSilence,Lucina,"Forgive me, I didn't realize. I thought she was sleeping... She looks so peaceful. What do you think she sees? Does she perchance dream?",sadness
FE13Paralogues,P17-TheThreatOfSilence,Chrom,"I imagine she— ...Uh-oh. Is that what I think it is? Say'ri! Lucina! Enemies approach us from the south. We'd better get ready, or the Voice here is in for a rude awakening.",neutral
FE13Paralogues,P17-TheThreatOfSilence,Say'Ri,"The Voice is defenseless in this state. We must become her shield until the rite is complete. We await your strategy, Robin. Make us as a wall of steel!",neutral
FE13Paralogues,P17-TheThreatOfSilence,Tiki,......,neutral
FE13Paralogues,P17-TheThreatOfSilence,Say'Ri,"Are you unharmed, Lady Tiki?",surprise
FE13Paralogues,P17-TheThreatOfSilence,Tiki,"Yes, thanks to you. I apologize for the delay, but the rite has borne fruit.",sadness
FE13Paralogues,P17-TheThreatOfSilence,Say'Ri,You've taken in the power of the divine dragon?,neutral
FE13Paralogues,P17-TheThreatOfSilence,Tiki,"Some of it, yes. ...It's strange. This power had always isolated me. Many were the days I wept alone, cursing the charge placed before me...",sadness
FE13Paralogues,P17-TheThreatOfSilence,Lucina,Lady Tiki...,surprise
FE13Paralogues,P17-TheThreatOfSilence,Tiki,"But now my power has a purpose, and the world needs it to avoid a ruinous future. And so I shall offer it freely. Allow me to join you.",neutral
FE13Paralogues,P17-TheThreatOfSilence,Lucina,...Are you certain?,surprise
FE13Paralogues,P17-TheThreatOfSilence,Tiki,"I am. I've had quite enough of living in solitude, thank you. Besides, I've always longed to better know this world. Now I can help you save it.",joy
FE13Paralogues,P17-TheThreatOfSilence,Say'Ri,"For all the talk of power, she was a gentle soul, and far too fragile...",neutral
FE13Paralogues,P17-TheThreatOfSilence,Chrom,"Indeed. But I fear there's no time to grieve, Say'ri. We must keep moving. We'll try to bring her peace by securing it for the world.",neutral
FE13Paralogues,P11-TwinWyverns,Morristan,"Send the new recruits along, then get to rounding up another half dozen or so.",neutral
FE13Paralogues,P11-TwinWyverns,Elder,"W-wait, what are you doing?!",surprise
FE13Paralogues,P11-TwinWyverns,Morristan,Just what it looks like. A wyvern rider without a wyvern to sit on is just a bloke in a lizard hat.,anger
FE13Paralogues,P11-TwinWyverns,Elder,"Wyverns are the sacred protectors of this land, not glorified horses to be muzzled!",anger
FE13Paralogues,P11-TwinWyverns,Morristan,"I'd muzzle you, had I the time. As it stands, I'll take a quicker path to quiet. G'night!",anger
FE13Paralogues,P11-TwinWyverns,Elder,Gwargh!,anger
FE13Paralogues,P11-TwinWyverns,Villager,N-no...! Run!,fear
FE13Paralogues,P11-TwinWyverns,Soldier,"Your orders, sir?",neutral
FE13Paralogues,P11-TwinWyverns,Morristan,"If word spreads, it'll only get more tedious. Sooo...yes. Better just kill everyone.",anger
FE13Paralogues,P11-TwinWyverns,Chrom,Where does this road lead?,surprise
FE13Paralogues,P11-TwinWyverns,Frederick,"To Wyvern Valley, milord. Home to Valm's greatest feral wyvern population.",fear
FE13Paralogues,P11-TwinWyverns,Chrom,That sounds...interesting. We'll have to be sure and keep our distance.,joy
FE13Paralogues,P11-TwinWyverns,Cherche,Shame. My Minerva's fit to burst. She's excited others of her kind are near.,fear
FE13Paralogues,P11-TwinWyverns,Chrom,Oh? She doesn't look that excited to me. Not that I can really tell the difference...,surprise
FE13Paralogues,P11-TwinWyverns,Cherche,"Oh, it's easy. She just looks even cuter than normal. Don't you, girl? Don't you look cuter? Who's a goooood wyvern?!",surprise
FE13Paralogues,P11-TwinWyverns,Chrom,"I'll, uh...leave you to her, then.",neutral
FE13Paralogues,P11-TwinWyverns,Villager,"Sir, over here! Please help! My friends will die if you don't!",fear
FE13Paralogues,P11-TwinWyverns,Gerome,...No.,neutral
FE13Paralogues,P11-TwinWyverns,Villager,"Wh-what?! But, sir, my friends!",surprise
FE13Paralogues,P11-TwinWyverns,Gerome,I'm not fit to fight for anyone.,neutral
FE13Paralogues,P11-TwinWyverns,Villager,Th-then...they're lost...,neutral
FE13Paralogues,P11-TwinWyverns,Chrom,You there! What's happened?,surprise
FE13Paralogues,P11-TwinWyverns,Villager,"My people are fleeing for their lives from a pack of armed brigands, sir! And now we've gotten separated... Oh, the horror of it all!",fear
FE13Paralogues,P11-TwinWyverns,Chrom,"Well, today's your lucky day. We'll aid you and your friends.",joy
FE13Paralogues,P11-TwinWyverns,Villager,"You will?! Oh, thank you! Please, sir! Give 'em what for!",joy
FE13Paralogues,P11-TwinWyverns,Cherche,Wait. You're not one of the villagers.,neutral
FE13Paralogues,P11-TwinWyverns,Gerome,No. ...I am Gerome. A traveler.,neutral
FE13Paralogues,P11-TwinWyverns,Cherche,"And a fellow wyvern rider, I see. This is a piece of good news! We fight to keep these villagers alive. Will you aid us?",joy
FE13Paralogues,P11-TwinWyverns,Gerome,Why? No man can stop fate.,surprise
FE13Paralogues,P11-TwinWyverns,Cherche,"These people will be killed by spears, traveler. Not fate.",neutral
FE13Paralogues,P11-TwinWyverns,Gerome,Heh. Spoken like one who has yet to witness fate's implacable cruelty.,anger
FE13Paralogues,P11-TwinWyverns,Cherche,"So you do nothing, then, save wandering the land in the fog of cowardice? And your wyvern? Has she seen enough? Does she also yearn to surrender?",anger
FE13Paralogues,P11-TwinWyverns,Gerome,...... You would know better than I.,neutral
FE13Paralogues,P11-TwinWyverns,Cherche,What does that mean?,surprise
FE13Paralogues,P11-TwinWyverns,Gerome,"Nothing. I'll fight if you wish it. Death will always have its due, but perhaps it will accept a few substitutions. Come, my dear Minerva. Join me on one final flight...",sadness
FE13Paralogues,P11-TwinWyverns,Chrom,Are you with the villagers? Who are you?,surprise
FE13Paralogues,P11-TwinWyverns,Gerome,...I am Gerome. A traveler.,neutral
FE13Paralogues,P11-TwinWyverns,Chrom,These people are in desperate straits. Will you help us?,surprise
FE13Paralogues,P11-TwinWyverns,Gerome,It is not for me to interfere in such matters. Death will always have its due.,neutral
FE13Paralogues,P11-TwinWyverns,Chrom,You would leave innocents to die and lay the blame on fate?,anger
FE13Paralogues,P11-TwinWyverns,Gerome,I've seen too much of fate's cruel work to doubt it.,anger
FE13Paralogues,P11-TwinWyverns,Chrom,"So you would surrender rather than struggle against such cruelty... I cannot understand such thinking. A bleak past doesn't justify condemning the future to bleakness as well. Nonetheless, I cannot force your hand. Join us if you will.",anger
FE13Paralogues,P11-TwinWyverns,Gerome,"What does he know of bleak futures? It is a fool who breaks himself against fate's tide. That said, I suppose I'm as big a fool as any... *sigh* Very well, then. Come, my dear Minerva. Join me on one final flight...",anger
FE13Paralogues,P11-TwinWyverns,Gerome,"Death...always has its...due... Go, Minerva... Be...free...",sadness
FE13Paralogues,P11-TwinWyverns,Morristan,Seems these newcomers have spine. Send word to the boys at the hold. Tell 'em we've got spines that need breaking.,neutral
FE13Paralogues,P11-TwinWyverns,Morristan,"Wyvern or man, everyone's all snarl and fire until they learn the feel of the lash!",anger
FE13Paralogues,P11-TwinWyverns,Villager,"Our saviors! And it's more than lives you rescued... You've saved my hope in humanity, too. I thank you for it. Here, sir. A token of my gratitude",joy
FE13Paralogues,P11-TwinWyverns,Chrom,"Thanks to you as well, friend.",neutral
FE13Paralogues,P11-TwinWyverns,Villager,"Take care, now. We'll pray for a safe journey for you and your troops.",neutral
FE13Paralogues,P11-TwinWyverns,Cherche,Do you have a moment?,neutral
FE13Paralogues,P11-TwinWyverns,Gerome,What is it?,surprise
FE13Paralogues,P11-TwinWyverns,Cherche,I was hoping you might introduce me to your wyvern.,neutral
FE13Paralogues,P11-TwinWyverns,Gerome,Why?,surprise
FE13Paralogues,P11-TwinWyverns,Cherche,"To see which of ours is cuter. Not very sporting of me when mine is the finest in the world, I know.",joy
FE13Paralogues,P11-TwinWyverns,Gerome,...Do as you please.,neutral
FE13Paralogues,P11-TwinWyverns,Cherche,"I will, then! Thank you. ...... ...Hee hee! Oh, but you ARE cute! She's nearly a match with Minerva! ...Nearly so in every way. Wait, what sorcery is this? They...they look IDENTICAL!",surprise
FE13Paralogues,P11-TwinWyverns,Gerome,That's because they are identical. They're one and the same.,neutral
FE13Paralogues,P11-TwinWyverns,Cherche,...M-Minerva? How is that possible?,surprise
FE13Paralogues,P11-TwinWyverns,Gerome,You could examine her from tip to tail looking for scars and marks if you like. ...Or you could just look at this ring.,neutral
FE13Paralogues,P11-TwinWyverns,Cherche,I...I know that ring. So then you're...,neutral
FE13Paralogues,P11-TwinWyverns,Gerome,"I am, though I had not intended that we meet.",neutral
FE13Paralogues,P11-TwinWyverns,Cherche,Why not?,surprise
FE13Paralogues,P11-TwinWyverns,Gerome,I came back in time so I might release Minerva. Not to seek out parents to whom I've already bidden farewell.,sadness
FE13Paralogues,P11-TwinWyverns,Cherche,You crossed the bounds of time just to set Minerva free? Whatever for?!,neutral
FE13Paralogues,P11-TwinWyverns,Gerome,"In the future I know, she is among the last of her kind. I...I could not leave her to that solitude.",sadness
FE13Paralogues,P11-TwinWyverns,Cherche,"She is lucky indeed to know someone of such kindness. ...As, I imagine, am I.",joy
FE13Paralogues,P11-TwinWyverns,Gerome,"Stay your words. I've no intention of getting close to you. Fate will not be mocked. This war may claim your life anew, and I'll not weep twice for losing the same mother. My burden is heavy enough.",anger
FE13Paralogues,P11-TwinWyverns,Cherche,But yet you carry it still.,neutral
FE13Paralogues,P11-TwinWyverns,Gerome,That's enough.,anger
FE13Paralogues,P11-TwinWyverns,Cherche,"Thank you, Gerome.",joy
FE13Paralogues,P08-ADuelDisgraced,Kjelle,"Dishonorable cur! You killed my master, and now you will face me!",anger
FE13Paralogues,P08-ADuelDisgraced,Cassius,"If that pile of pudding was your master, I'd advise you to just keep walking.",neutral
FE13Paralogues,P08-ADuelDisgraced,Kjelle,Craven dog... You claimed a hostage! He'd never have lost in a fair fight!,anger
FE13Paralogues,P08-ADuelDisgraced,Maiden,"Nor would he have wanted this, Kjelle. If I lose you as well, I...",sadness
FE13Paralogues,P08-ADuelDisgraced,Kjelle,You won't lose me. I swear it. And I swear your husband will be avenged!,anger
FE13Paralogues,P08-ADuelDisgraced,Cassius,"If you want to run headlong into the grave, girl, I won't stop you. We can duel in the ruins ahead.",anger
FE13Paralogues,P08-ADuelDisgraced,Robin,"What do you make of this, Chrom?",surprise
FE13Paralogues,P08-ADuelDisgraced,Chrom,I hope she knows what she's getting into.,neutral
FE13Paralogues,P08-ADuelDisgraced,Maiden,Sir! Please! You have to do something!,neutral
FE13Paralogues,P08-ADuelDisgraced,Chrom,What's the matter?,surprise
FE13Paralogues,P08-ADuelDisgraced,Maiden,"It's my friend, sir. I fear she's walking into a terrible trap! That scoundrel Cassius would never fight an honest duel. My husband took a similar stand against his tyranny not long ago. The brute took a girl hostage and then cut my husband down as he lowered his weapon! *Sniff* I can't let her suffer the same fate... I'd die, I would!",anger
FE13Paralogues,P08-ADuelDisgraced,Chrom,All right. We'll see what we can do.,neutral
FE13Paralogues,P08-ADuelDisgraced,Kjelle,"Coward! You promised me a duel, you soulless blackheart!",anger
FE13Paralogues,P08-ADuelDisgraced,Cassius,"Indeed I did. Consider all these men my seconds, heh. Still, I'm not a monster. I'll spare your life if you get on your knees and beg.",anger
FE13Paralogues,P08-ADuelDisgraced,Kjelle,I'd sooner die!,anger
FE13Paralogues,P08-ADuelDisgraced,Cassius,"Well, we can arrange that, too. Have at her, boys!",neutral
FE13Paralogues,P08-ADuelDisgraced,Sully,Hey. You got a second?,surprise
FE13Paralogues,P08-ADuelDisgraced,Kjelle,Ahh!,neutral
FE13Paralogues,P08-ADuelDisgraced,Sully,What? I got something on my face?,surprise
FE13Paralogues,P08-ADuelDisgraced,Kjelle,"N-no, you just...remind me of someone. Forgive me. I have no time to talk.",sadness
FE13Paralogues,P08-ADuelDisgraced,Sully,"Don't worry. It won't take long. So listen. These lowlifes have no honour. You know that, right? If you meet 'em head-on, you'll just end up with a sword in your back.",neutral
FE13Paralogues,P08-ADuelDisgraced,Kjelle,Head-on is how I live.,neutral
FE13Paralogues,P08-ADuelDisgraced,Sully,"...Ooh, I like you. And that's all the more reason I can't let you charge off on your own.",neutral
FE13Paralogues,P08-ADuelDisgraced,Kjelle,Don't try to stop me!,fear
FE13Paralogues,P08-ADuelDisgraced,Sully,"I'm not stopping you. I'm coming with you. You just focus on finishing your duel, and I'll kill any idiot who gets in the way.",anger
FE13Paralogues,P08-ADuelDisgraced,Kjelle,R-right!,neutral
FE13Paralogues,P08-ADuelDisgraced,Chrom,Excuse me—,neutral
FE13Paralogues,P08-ADuelDisgraced,Kjelle,"Wha—?! Die, fiend! Y-you parried my spear. ...How did you do that?",anger
FE13Paralogues,P08-ADuelDisgraced,Chrom,"I get a lot of practice. Now can you please stop trying to skewer me for a second? We're not your enemies. A friend sent us to help you. There are too many for you to fight alone, no matter your skill. We'll take care of the rabble while you fight your duel.",neutral
