game,chapter,speaker,text,tag
FE13Paralogues,P07-NobleLineage,Elder,"Hold, defiler! This is sacred ground! Your wickedness will be punished!",anger
FE13Paralogues,P07-NobleLineage,Xalbador,"By who? The same gods that abandoned me when I was starving as a boy? When you see the gods, tell 'em I said they can rot in hell!",anger
FE13Paralogues,P07-NobleLineage,Elder,Hnngh! Gah...,fear
FE13Paralogues,P07-NobleLineage,Brady,Dastard! I'll gut ya for that!,anger
FE13Paralogues,P07-NobleLineage,Villager,"Brady, no! There's nothing you can do! Who would tend to the injured if we lost you?",neutral
FE13Paralogues,P07-NobleLineage,Brady,But...,neutral
FE13Paralogues,P07-NobleLineage,Villager,We'll fight as best we're able! You help from the rear lines.,neutral
FE13Paralogues,P07-NobleLineage,Brady,"Ugh! Good people are dying, and I can't help! If only I could fight...",anger
FE13Paralogues,P07-NobleLineage,Maribelle,Chrom! We have to hurry!,fear
FE13Paralogues,P07-NobleLineage,Chrom,"What's wrong, Maribelle?",surprise
FE13Paralogues,P07-NobleLineage,Maribelle,There're people fighting just over that ridge! LOTS of people!,anger
FE13Paralogues,P07-NobleLineage,Chrom,"They look like they need help. Let's go, Shepherds!",neutral
FE13Paralogues,P07-NobleLineage,Villager,H-help us! Please! The temple's beset by marauding bandits!,fear
FE13Paralogues,P07-NobleLineage,Maribelle,"Don't you worry! We're happy to help! If there's one thing this world needs less of, it's wretched bandits…",anger
FE13Paralogues,P07-NobleLineage,Brady,Wait. I know that voice. Is that...Ma?,surprise
FE13Paralogues,P07-NobleLineage,Brady,"Haw haw haw! Oh, that's her. That's gotta be her.",joy
FE13Paralogues,P07-NobleLineage,Maribelle,"Pardon me, you mannerless cur! I will not stand to be laughed at by a base scoundrel of your like!",anger
FE13Paralogues,P07-NobleLineage,Brady,...Yep. That clinches it. You must be Maribelle.,neutral
FE13Paralogues,P07-NobleLineage,Maribelle,And just how do you know that?! Do you leer at me from behind the shades of whatever den of iniquity you frequent?! Hmph! I bid you good day!,anger
FE13Paralogues,P07-NobleLineage,Brady,"I guess you've always been like this. Still...it's good to see you again. And now that I've found ya, I'm afraid you're stuck with me.",joy
FE13Paralogues,P07-NobleLineage,Brady,"An enemy?! Damn! Guess that's it for me... Sorry, Ma. Looks like I won't be home for supper after all. Do your worst, tyrant! I can't fight back anyway!",anger
FE13Paralogues,P07-NobleLineage,Chrom,You seem to be doing just fine to me.,neutral
FE13Paralogues,P07-NobleLineage,Brady,"I'm unarmed, genius! Sheesh, anyone with eyes can see that!",anger
FE13Paralogues,P07-NobleLineage,Chrom,And anyone with eyes knows there's more to combat than swinging a blade around. You fight in your own way. Am I wrong?,neutral
FE13Paralogues,P07-NobleLineage,Brady,"Pah! Don't patronize me! I'd love to fight more'n anything, but I can't seem to make it work.",anger
FE13Paralogues,P07-NobleLineage,Chrom,I'm sure something will come to you.,neutral
FE13Paralogues,P07-NobleLineage,Brady,"...Just who are you, anyway?",surprise
FE13Paralogues,P07-NobleLineage,Chrom,My name is Chrom.,neutral
FE13Paralogues,P07-NobleLineage,Brady,What? Y-you're Chrom?!,surprise
FE13Paralogues,P07-NobleLineage,Chrom,You know me?,neutral
FE13Paralogues,P07-NobleLineage,Brady,Ma wouldn't shut up about you!,anger
FE13Paralogues,P07-NobleLineage,Chrom,"Er, do I know your mother?",neutral
FE13Paralogues,P07-NobleLineage,Brady,Her name's Maribelle.,neutral
FE13Paralogues,P07-NobleLineage,Chrom,What?! So you're another traveler from the futu-,surprise
FE13Paralogues,P07-NobleLineage,Brady,So you've already heard? Perfect. Now take me with ya already!,joy
FE13Paralogues,P07-NobleLineage,Chrom,"Er, well, I suppose we can find a place for you somewhere...",neutral
FE13Paralogues,P07-NobleLineage,Brady,"Ha! I hear you there, chump! You can come kill me now. You're just lucky I don't have my old man's skill with a blade.",anger
FE13Paralogues,P07-NobleLineage,Chrom,Your father is a swordsman?,surprise
FE13Paralogues,P07-NobleLineage,Brady,"None of your damn business, dog!",anger
FE13Paralogues,P07-NobleLineage,Chrom,Do you always speak this way to Ylissean royalty?,surprise
FE13Paralogues,P07-NobleLineage,Brady,I am Ylissean royalty!,neutral
FE13Paralogues,P07-NobleLineage,Chrom,... What?,surprise
FE13Paralogues,P07-NobleLineage,Brady,... Huh?,surprise
FE13Paralogues,P07-NobleLineage,Chrom,Humor me here for a moment. What's your mother's name?,anger
FE13Paralogues,P07-NobleLineage,Brady,Maribelle.,neutral
FE13Paralogues,P07-NobleLineage,Chrom,Maribelle is my wife... Which would make you my son. Seems Lucina failed to mention this little detail.,neutral
FE13Paralogues,P07-NobleLineage,Brady,"Huh. Yeah, I guess we look alike. I mean, if ya squint real hard... Sorry I called you a dog, Pop... Oh, and I'm Brady. Sooo... Must be disappointin' that your son can't fight, huh?",sadness
FE13Paralogues,P07-NobleLineage,Chrom,"You seem to be doing just fine to me. And anyone with eyes knows there's more to combat than swinging a blade around. And besides, you've chosen to heal instead of harm. I couldn't be prouder of that.",neutral
FE13Paralogues,P07-NobleLineage,Brady,"...Really? Aw, thanks. That means a lot, Pop.",joy
FE13Paralogues,P07-NobleLineage,Xalbador,You people can keep your gods. I'll put my faith in gold and steel!,anger
FE13Paralogues,P07-NobleLineage,Elder,"Thank you! Oh, thank you... You've kept this sacred place safe and spared the lives of those within.",joy
FE13Paralogues,P07-NobleLineage,Chrom,We just did what was right.,neutral
FE13Paralogues,P07-NobleLineage,Elder,"Would that everyone were so brave! Please, allow me to give you this.",neutral
FE13Paralogues,P07-NobleLineage,Brady,"Hey, Ma.",neutral
FE13Paralogues,P07-NobleLineage,Maribelle,What did you call me?,surprise
FE13Paralogues,P07-NobleLineage,Brady,The name's Brady. I'm--,neutral
FE13Paralogues,P07-NobleLineage,Maribelle,"I'm sorry, but I only heal physical ailments. Broken bones and the like. You're clearly a deeply troubled individual whose diseased mind is beyond my healing.",sadness
FE13Paralogues,P07-NobleLineage,Brady,Stop talking for a minute and look at this!,anger
FE13Paralogues,P07-NobleLineage,Maribelle,"That's... my ring! Then, that makes you...",surprise
FE13Paralogues,P07-NobleLineage,Brady,"Right. Like I was trying to say, I'm--",neutral
FE13Paralogues,P07-NobleLineage,Maribelle,A thief! A rapscallion! A common lowborne cutpurse! How dare you sneak in here and steal my prized possessions!,anger
FE13Paralogues,P07-NobleLineage,Brady,"Gawds! Stop interruptin' me for one blessed second, and check yer ring!",anger
FE13Paralogues,P07-NobleLineage,Maribelle,...Oh. It's still here.,neutral
FE13Paralogues,P07-NobleLineage,Brady,"That clear things up any, Ma?""",neutral
FE13Paralogues,P07-NobleLineage,Maribelle,Everything save how I gave birth to a common thug!,anger
FE13Paralogues,P07-NobleLineage,Brady,"Aw, come on, Ma! That's harsh! Sure, I'm not the prettiest guy around, but I'm no thug, and I AM your son! ...And it's good to see you.",anger
FE13Paralogues,P07-NobleLineage,Maribelle,"...How did I ever permit my child to grow up referring to me as ""Ma""?",neutral
FE13Paralogues,P07-NobleLineage,Brady,You gave up tryin' after a decade or so.,neutral
FE13Paralogues,P07-NobleLineage,Maribelle,"Well, can you at least ride? Have you read the classics? Do you play violin? Chess?!",neutral
FE13Paralogues,P07-NobleLineage,Brady,"Yeah, all of the above. You beat all'a that junk into me.",anger
FE13Paralogues,P07-NobleLineage,Maribelle,Glory be! My son is salvageable after all!,joy
FE13Paralogues,P07-NobleLineage,Brady,Uh... thanks?,surprise
FE13Paralogues,P07-NobleLineage,Maribelle,"Don't look so forlorn, dear. You've come a long way, but Mother's here now. I'll take care of things from now on.",sadness
FE13Paralogues,P07-NobleLineage,Brady,"*Sniff* I missed you so much, Ma...",sadness
FE13Paralogues,P07-NobleLineage,Maribelle,"Do not even THINK of crying! It does not befit one of your station! *Sniff* Plus, you'll set me off as well...",sadness
FE13Paralogues,P07-NobleLineage,Brady,"S-sorry, I just... I... Oh, Ma!",sadness
FE13Paralogues,P07-NobleLineage,Maribelle,"Oh, Brady!",neutral
FE13Paralogues,P07-NobleLineage,Chrom,"Oh, brother.",neutral
FE13Paralogues,P05-ScionOfLegend,Lissa,"Say, Lucina? I'm still around in your future, right?",neutral
FE13Paralogues,P05-ScionOfLegend,Lucina,"Well... You're warm and kind, for starters. Even amid the darkness and desolation. Your smile serves as a beacon of hope for all those around you.",neutral
FE13Paralogues,P05-ScionOfLegend,Lissa,Oh geez! I'd better get cracking if I want to live up to that. Oh! I know! Do I have any children?,anger
FE13Paralogues,P05-ScionOfLegend,Lucina,You have a son named Owain.,neutral
FE13Paralogues,P05-ScionOfLegend,Lissa,Aw cute! What's he like?,surprise
FE13Paralogues,P05-ScionOfLegend,Lucina,"He's... Well, he's quite colorful.",joy
FE13Paralogues,P05-ScionOfLegend,Lissa,Hmm... I'm not sure I want to know what that means. Oh wait! One more thing! Does he have...,surprise
FE13Paralogues,P05-ScionOfLegend,Lucina,Yes?,neutral
FE13Paralogues,P05-ScionOfLegend,Lissa,No... Never mind.,neutral
FE13Paralogues,P05-ScionOfLegend,Lucina,Are you sure?,surprise
FE13Paralogues,P05-ScionOfLegend,Lissa,"Sorry, I just remembered I promised to help Chrom with something. ...Bye!",sadness
FE13Paralogues,P05-ScionOfLegend,Lucina,Lissa?,neutral
FE13Paralogues,P05-ScionOfLegend,Ruffian,This is it boss! That treasure's here; I'm sure of it!,joy
FE13Paralogues,P05-ScionOfLegend,Gecko,"All right, woman. Speak! Where'd you put it?",neutral
FE13Paralogues,P05-ScionOfLegend,Maiden,I've never heard of no treasure here! Honest I haven't!,joy
FE13Paralogues,P05-ScionOfLegend,Gecko,"Oh? Then I guess we're done here. She's useless, boys. Kill her.",anger
FE13Paralogues,P05-ScionOfLegend,Ruffian,"Aye, boss!",neutral
FE13Paralogues,P05-ScionOfLegend,???,"Halt, fiends!",anger
FE13Paralogues,P05-ScionOfLegend,Ruffian,The devil are you?!,surprise
FE13Paralogues,P05-ScionOfLegend,???,"One chosen by forces beyond mortal comprehension! See how my sword hand twitches! It hungers... for justice! Leave now if you value life and limb, for I cannot stay the hungry hand!",anger
FE13Paralogues,P05-ScionOfLegend,Ruffian,This guy's got rocks in his head... All right then boy. Guess you're the first to—— Gragh!,anger
FE13Paralogues,P05-ScionOfLegend,???,"I tried to warn you, foul villain. The hand cannot be denied!",anger
FE13Paralogues,P05-ScionOfLegend,Maiden,Oh thank the stars! You saved my life!,joy
FE13Paralogues,P05-ScionOfLegend,Chrom,Wait. That stance...,neutral
FE13Paralogues,P05-ScionOfLegend,Gecko,Rgh... Who ARE you?!,surprise
FE13Paralogues,P05-ScionOfLegend,???,I am the wolf who howls for justice! The eagle who cries for love!,anger
FE13Paralogues,P05-ScionOfLegend,Owain,"A chosen warrior come from the future to bring hope for a dying world... I am Owain! Now, atone for your deeds in the eternal hellfire of perdition! RADIANT...DAAAAAAWN! ..... Blast you, sword hand! Now's no time for games! You've escaped fate this time, rogue, but remember——justice always prevails!",anger
FE13Paralogues,P05-ScionOfLegend,Gecko,.....,neutral
FE13Paralogues,P05-ScionOfLegend,Chrom,.....,neutral
FE13Paralogues,P05-ScionOfLegend,Lissa,"Wow, that guy's really weird. ...Wait a second.",surprise
FE13Paralogues,P05-ScionOfLegend,Gecko,"Gahar har har! I KNEW there were rocks in your head! Look lively, boys! Ignore the dolt and find us that treasure! Pinch everything that shines, and make for the hills!",anger
FE13Paralogues,P05-ScionOfLegend,Owain,"Not today, ne'er-do-wells! The legendary blade Mystletainn is fated for my twitching hand alone!",anger
FE13Paralogues,P05-ScionOfLegend,Chrom,"...I am so lost right now. What is he even talking about? ...Never mind. Let's just kill the bandits, and I'm sure everything will sort itself out.",anger
FE13Paralogues,P05-ScionOfLegend,Owain,"Nrgh! Sword hand, no! Control yourself! P-power... too great... C-can't contain it...",anger
FE13Paralogues,P05-ScionOfLegend,Chrom,"Um, sorry to interrupt your... conversation? But I have a question about your stance. You've crafted your own style around it, but it's clearly from the royal house of Ylisse.",sadness
FE13Paralogues,P05-ScionOfLegend,Owain,"By the gods old and new! Another future traveler?! And yet, impossible, for I saw none like him in the light... Who are you, villain?! Speak now!",surprise
FE13Paralogues,P05-ScionOfLegend,Chrom,"Um, I'm Chrom. ...Of Ylisse? I have no quarrel with you, but if we must fight, then-",neutral
FE13Paralogues,P05-ScionOfLegend,Owain,UNCLE CHROM?!,surprise
FE13Paralogues,P05-ScionOfLegend,Chrom,...Uncle?,sadness
FE13Paralogues,P05-ScionOfLegend,Owain,"Wait! Hold on! Let me start over. O fellow scion of the great hero, I greet you as kin and kind! From across the misty shores of time I strive, bearing forth tidings of-",joy
FE13Paralogues,P05-ScionOfLegend,Chrom,"Keep it brief, would you?",neutral
FE13Paralogues,P05-ScionOfLegend,Owain,...I'm Lissa's kid from the future!,neutral
FE13Paralogues,P05-ScionOfLegend,Chrom,That is... not what I was expecting to hear. Did you come with Lucina?,surprise
FE13Paralogues,P05-ScionOfLegend,Owain,"Yes. It seems the blood we share has drawn us like moths to the flame! Like a great tidal wave of heroism, we crash upon the shores of evil and-",fear
FE13Paralogues,P05-ScionOfLegend,Chrom,Can you fight? Or do you just talk a lot?,neutral
FE13Paralogues,P05-ScionOfLegend,Owain,"My mettle in combat is the stuff of legend! Bards sing tales of my- H-hey! Wait! Uncle Chrooom! I have but one request. If you find the sword Mystletainn, please permit me to wield it!",neutral
FE13Paralogues,P05-ScionOfLegend,Chrom,I heard you wailing about that before. What kind of blade are we talking here?,surprise
FE13Paralogues,P05-ScionOfLegend,Owain,"A legendary one, Uncle! Imbued with the very power of the gods, if the tales are to be believed. I would use its might to defend my sacred queen and mother!",neutral
FE13Paralogues,P05-ScionOfLegend,Chrom,...You mean Lissa? *Sigh* I suppose I should just be happy she has such a... devoted son.,sadness
FE13Paralogues,P05-ScionOfLegend,Lissa,"Oh, hey! It's you. Thanks for helping-",joy
FE13Paralogues,P05-ScionOfLegend,Owain,MOM?!,surprise
FE13Paralogues,P05-ScionOfLegend,Lissa,Hu-what?,surprise
FE13Paralogues,P05-ScionOfLegend,Owain,"Blessed Mother! I have crossed oceans of time to find- Oh, forget it. I'm your kid from the future! Look at the signet ring upon my finger. Behold, a perfect match to yours! Unique in all the world, and yet here lie two. Proof positive my claims are true!",joy
FE13Paralogues,P05-ScionOfLegend,Lissa,... Who did what now? Hold on. Slow down. Back up. Start again.,surprise
FE13Paralogues,P05-ScionOfLegend,Owain,"Um... Sorry about that. Look, the important thing here is that I'm-",sadness
FE13Paralogues,P05-ScionOfLegend,Lissa,"...Oh, gods. Owain.",fear
FE13Paralogues,P05-ScionOfLegend,Owain,Huh?,neutral
FE13Paralogues,P05-ScionOfLegend,Lissa,That's your name. Isn't it?,surprise
FE13Paralogues,P05-ScionOfLegend,Owain,"Indeed it is! And none have ever been prouder to bear it! For it is the name you gave me, Mother! I've come to part the dark clouds that hang forebodingly over this era!",anger
FE13Paralogues,P05-ScionOfLegend,Villager,"Hail, traveler. Thank you for coming to our aid. Please use this to treat your injured. It's an old recipe, but well effective.",neutral
FE13Paralogues,P05-ScionOfLegend,Villager,You're a welcome sight indeed. I'd near given up hope! This is one of our village treasures. May it help you in keeping us safe.,neutral
FE13Paralogues,P05-ScionOfLegend,Villager,"You have our thanks for your bravery. I'm afraid this medicine is all I can offer in return, but I pray it keeps you safe.",joy
FE13Paralogues,P05-ScionOfLegend,Villager,"You're a kind soul to fight for strangers so. Here, you must take this.",neutral
FE13Paralogues,P05-ScionOfLegend,Owain,"By the ghost of Ike! I've found it at last! The fated mate of my sword hand! ...The divine blade, Mystletainn!",anger
FE13Paralogues,P05-ScionOfLegend,Villager,"Er, I'm afraid this is a blade of extremely common make, sir. I was using it to dig a well, but I figured you might--",neutral
FE13Paralogues,P05-ScionOfLegend,Owain,"Come, Mystletainn! Destiny beckons!",anger
FE13Paralogues,P05-ScionOfLegend,Villager,"I also used it to cut small vegetables before it got dull. ...Er, hello?",neutral
FE13Paralogues,P05-ScionOfLegend,Owain,"The blade of legend and song... I feel its power coursing through me! At last, my sword hand lays calm. Come, Mystletainn. Destiny beckons! The rest of these rogues are ours alone!",neutral
FE13Paralogues,P05-ScionOfLegend,Gecko,"This treasure's mine! Cross me, and I'll decorate this place with your bones!",anger
FE13Paralogues,P05-ScionOfLegend,Villager,"We owe you a great debt for protecting our village. Truly, from all of us, thank you.",joy
FE13Paralogues,P05-ScionOfLegend,Lissa,"Where did he get off to? Lucina said she saw him go this way. ..... Ugh, maybe I should just forget it. If he doesn't have one, either.....  Aaah!",sadness
FE13Paralogues,P05-ScionOfLegend,Ruffian,Keh heh! Let's have all your coin girly! Unless you wanna lose that pretty head.,anger
FE13Paralogues,P05-ScionOfLegend,Lissa,Stay back!,anger
FE13Paralogues,P05-ScionOfLegend,Owain,No one hurts the mother of Owain! SACRED...STOOOOOONES!,fear
FE13Paralogues,P05-ScionOfLegend,Ruffian,Guhaaargh!,anger
FE13Paralogues,P05-ScionOfLegend,Owain,"Mother, are you all right?!",surprise
FE13Paralogues,P05-ScionOfLegend,Lissa,"Yeah, I'm fine. I'm... Holy crow! Your arm!",joy
FE13Paralogues,P05-ScionOfLegend,Owain,This? Hah! It's nothing but a torn sleeve.,surprise
FE13Paralogues,P05-ScionOfLegend,Lissa,"...No, I mean, HOLY CROW! LOOK AT THAT THING ON YOUR ARM!",anger
FE13Paralogues,P05-ScionOfLegend,Owain,"Oh right! Sorry. Guess I should have shown you before. It's my Brand. The one carried by House Ylisse. So no more need to worry, eh?",sadness
FE13Paralogues,P05-ScionOfLegend,Lissa,Th-then you know? That I don't...,surprise
FE13Paralogues,P05-ScionOfLegend,Owain,"That your Brand never surfaced? Yes, you told me as much. You said it always weighed on you... You should have seen how happy you were the day mine appeared! You were sobbing and laughing for an hour without pause!",joy
FE13Paralogues,P05-ScionOfLegend,Lissa,I was kind of hoping to grow out of the crying thing...,sadness
FE13Paralogues,P05-ScionOfLegend,Owain,"Yes, well. No more worrying. It was by chance alone that your Brand never surfaced. We're all family, linked by blood. You really are Chrom's sister. My Brand proves our lineage.",neutral
FE13Paralogues,P05-ScionOfLegend,Lissa,"Thank you. Just... *sniff* Thank you, Owain.",sadness
FE13Paralogues,P05-ScionOfLegend,Owain,You're welcome!,joy
FE13Paralogues,P05-ScionOfLegend,Lissa,Heh... *sniff*,sadness
FE13Paralogues,P05-ScionOfLegend,Owain,"And as scions of the hero, it falls on us to ensure my dark future doesn't come true. Come, Mother! We shall fight together! Uh-oh... Argh... Too much...passion! Sword hand...getting hungry...again!",anger
FE13Paralogues,P05-ScionOfLegend,Lissa,"You know, maybe you should have that looked at.",neutral
FE13Paralogues,P06-AManForFlowers,Robin,"*Huff, huff* Why do mountains... have to... be so steep?",surprise
FE13Paralogues,P06-AManForFlowers,Olivia,Here. Have some water.,neutral
FE13Paralogues,P06-AManForFlowers,Robin,"Thank you, Olivia. You're a lifesaver.",joy
FE13Paralogues,P06-AManForFlowers,Olivia,"Oh, hardly. I just flail around and pretend to dance, mostly. Anyway, I've started looking for new ways to be useful.",neutral
FE13Paralogues,P06-AManForFlowers,Robin,Your dancing is spectacular! It never fails to pick me up.,joy
FE13Paralogues,P06-AManForFlowers,Olivia,Ha! I dance like a ham someone rolled down the stairs. Just thinking of people watching me makes me cringe...,anger
FE13Paralogues,P06-AManForFlowers,Chrom,"We're near the bandit's camp, Robin. They've ravaged surrounding towns with impunity for too long. It ends today.",neutral
FE13Paralogues,P06-AManForFlowers,Robin,Right.,neutral
FE13Paralogues,P06-AManForFlowers,Inigo,"Not today, rogue!",neutral
FE13Paralogues,P06-AManForFlowers,Brigand,Nraugh!,anger
FE13Paralogues,P06-AManForFlowers,Inigo,"All safe now, buttercup.",neutral
FE13Paralogues,P06-AManForFlowers,Maiden,I-Inigo?!,neutral
FE13Paralogues,P06-AManForFlowers,Inigo,"The crying part is over, love. Now give us a smile. And perhaps a wink if a fellow can be greedy?",anger
FE13Paralogues,P06-AManForFlowers,Maiden,"Inigo, you stupid fool! That bandit you slew has---",anger
FE13Paralogues,P06-AManForFlowers,Inigo,Dozens of friends who will be terribly cross with me? Aye. Worry not! I'll mop up the lot of them and be back in time for tea.,anger
FE13Paralogues,P06-AManForFlowers,Maiden,You mustn't! They'll kill you!,anger
FE13Paralogues,P06-AManForFlowers,Inigo,"Ho ho! Don't be silly. I'd never let anyone ruin this perfect face. Surely you want them gone as well, yes? So that you may rebuild in peace?",anger
FE13Paralogues,P06-AManForFlowers,Maiden,"Of course, but...",neutral
FE13Paralogues,P06-AManForFlowers,Inigo,Then let us have no more frowns! A smile like yours is not a treasure to be locked in the king's dungeons! I'll meet you in town once I've sorted those pesky bandits. Perhaps then we can discuss my... reward. Ho ho!,neutral
FE13Paralogues,P06-AManForFlowers,Chrom,"Their hold is just ahead. It should be... Wait, what's that? Gods, that man is fighting them alone. Come, let's lend him a hand!",surprise
FE13Paralogues,P06-AManForFlowers,Olivia,Are... Are you all right?,surprise
FE13Paralogues,P06-AManForFlowers,Inigo,...GYAAARRGH!,anger
FE13Paralogues,P06-AManForFlowers,Olivia,EEEEEEEEEEEEEEEK! Wh-what's wrong?!,fear
FE13Paralogues,P06-AManForFlowers,Inigo,S-sorry! ...Sorry. You just surprised me.,sadness
FE13Paralogues,P06-AManForFlowers,Olivia,I'd say we're even on that count!,neutral
FE13Paralogues,P06-AManForFlowers,Inigo,"I shouldn't have shouted, but... Er, yes. Can we please start over? ...Ahem! It was your ravishing beauty that caught me so off guard, milady!",fear
FE13Paralogues,P06-AManForFlowers,Olivia,I don't quite know how to reply to that!,neutral
FE13Paralogues,P06-AManForFlowers,Inigo,"Er, please don't look at me so...intently. It makes me terribly bashful.",sadness
FE13Paralogues,P06-AManForFlowers,Olivia,"What?! W-wait! Don't go! Drat he's gone. He totally stole my line, too. Still it's weird, I didn't have a problem talking to him. Maybe his shyness countered my own?",surprise
FE13Paralogues,P06-AManForFlowers,Inigo,"Well, then. I should think five kills would be enough to impress a simple village girl. Though six might earn me a sweet kiss... Hmmm... That IS tempting.",neutral
FE13Paralogues,P06-AManForFlowers,Chrom,You all right?,neutral
FE13Paralogues,P06-AManForFlowers,Inigo,"Me? Hah! It takes more than that to wound a rogue this charming! Now then, who are you? Not an enemy, it seems?",anger
FE13Paralogues,P06-AManForFlowers,Chrom,"I'm Chrom, leader of the Shepherds. We came to deal with bandits, so it appears our purpose is shared.",neutral
FE13Paralogues,P06-AManForFlowers,Inigo,Chrom?! Then you're Lucina's...,surprise
FE13Paralogues,P06-AManForFlowers,Chrom,What's that?,surprise
FE13Paralogues,P06-AManForFlowers,Inigo,......,neutral
FE13Paralogues,P06-AManForFlowers,Chrom,What?,surprise
FE13Paralogues,P06-AManForFlowers,Inigo,P-please don't stare at me like that. I get so...terribly shy.,sadness
FE13Paralogues,P06-AManForFlowers,Chrom,Aren't you the one who's been staring at me? And why did that line seem so familiar?,surprise
FE13Paralogues,P06-AManForFlowers,Inigo,"Er, but yes! We share a common foe, and I'm grateful for the help. Can I trust you to defend this place?",joy
FE13Paralogues,P06-AManForFlowers,Chrom,I don't know. What are you planning?,surprise
FE13Paralogues,P06-AManForFlowers,Inigo,"I aim to crush the rascals who make trouble for the village, naturally! And once the lot of them are sorted, it's off to tea with a beauty of the fields. Heh heh heh... Right then! If that's decided, I'll be on my way. Put the kettle on, snookums! I won't be long now!",anger
FE13Paralogues,P06-AManForFlowers,Chrom,He's nothing if not eager...,neutral
FE13Paralogues,P06-AManForFlowers,Inigo,"Well, then. I should think five kills would be enough to impress a simple village girl. Though six might earn me a sweet kiss... Hmmm... That IS tempting.",neutral
FE13Paralogues,P06-AManForFlowers,Chrom,You all right?,neutral
FE13Paralogues,P06-AManForFlowers,Inigo,"Me? Hah! It takes more then that to wound a rogue this charming! Now then, who are you? Not an enemy, it seems.",anger
FE13Paralogues,P06-AManForFlowers,Chrom,"I'm Chrom, leader of the Shepherds. We came to deal with the bandits, so it appears our purpose is shared.",neutral
FE13Paralogues,P06-AManForFlowers,Inigo,Chrom?! Then you...You're my father.,surprise
FE13Paralogues,P06-AManForFlowers,Chrom,"What? You, too?!",surprise
FE13Paralogues,P06-AManForFlowers,Inigo,Then you've already met Lucina?!,neutral
FE13Paralogues,P06-AManForFlowers,Chrom,"Yes, she's with us now.",neutral
FE13Paralogues,P06-AManForFlowers,Inigo,"Oh, good. She was so terribly eager to see you! Ah, but forgive me. I still haven't introduced myself. I am Inigo, Lucina's younger brother and a crown prince of Ylisse myself. If you need further proof, I bear a Brand in the opposite eye as Lucina.",sadness
FE13Paralogues,P06-AManForFlowers,Chrom,Hmm...Yep. That's a Brand all right.,neutral
FE13Paralogues,P06-AManForFlowers,Inigo,"Um, could I ask you to stop staring now? I get a bit...bashful.",surprise
