id|game|chapter|speaker|text|tag
14804|FE7|31-Light|Merlinus|...Sniff sniff... I thought as much. You're not taking me with you...... ...Sniff ooh...|
14805|FE7|31-Light|Hector|That's disgusting. Cry if you must, but do something about that runny nose. What are we supposed to do? You can't fight, so we can't afford to take you with us.|
14806|FE7|31-Light|Eliwood|Take this and return to Fargus's ship.|
14807|FE7|31-Light|Merlinus|...Wh-What is this, may I ask?|
14808|FE7|31-Light|Hector|A letter of introduction. Take this to Ostia, and you'll be able to do good business there. Of course, if we fail in our mission, it's just a worthless slip of paper.|
14809|FE7|31-Light|Merlinus|But... ...I must protest!! For the rest of my days, I've vowed in my heart to continue serving you both! Please, oh please! Do not abandon me.|
14810|FE7|31-Light|Eliwood|Merlinus... ......|
14811|FE7|31-Light|Hector|Then go get on the boat and pray for our safe return!|
14812|FE7|31-Light|Eliwood|...Please. Have faith in us. Wait for us.|
14813|FE7|31-Light|Merlinus|...Sniff sniff... ...I... I under...stand. Until the end of time, my lord. I will wait for you until the end of time. Please...come back... safely... Please!|
14814|FE7|31-Light|Hector|Yeah, OK. We're going. Bye.|
14815|FE7|31-Light|Eliwood|We'll be back.|
14816|FE7|31-Light|Merlinus|......Oh, Lord Eliwood... Oh my...|
14817|FE7|31-Light|Eliwood|Nergal!|
14818|FE7|31-Light|Nergal|Pah...you're here. But you're too late. The gate is already opened. I will claim the mighty quintessence of dragons. I will become stronger and move ever closer to perfection.|
14819|FE7|31-Light|Eliwood|How many lives must you steal before you're satisfied!? And it's not only those who die. What about the ones left behind in pain and sorrow? What about them?|
14820|FE7|31-Light|Nergal|I am who I am. The pain of others, I do not feel. The sorrow of others does not touch me. Death feeds me. Death pleases me. I am the essence I consume. You fools will become corpses here, because I wish it to be. Rise and come forth, my servants!|
14821|FE7|31-Light|Eliwood|This...|
14822|FE7|31-Light|Nergal|You seem impressed with my work. Or perhaps it's just that you've seen a familiar face?|
14823|FE7|31-Light|Eliwood|That's... Marquess Laus! And... Those are Black Fang members. What have you done, Nergal?!|
14824|FE7|31-Light|Nergal|These morphs you see before you, I've given them the abilities and appearances of the people whose essences I used to craft them. Well, that's not entirely true. I've made them far more powerful. This is the ideal plan for hypocrites like you. Especially you, Eliwood. You continue to regret causing harm to anyone, even enemies. However, no matter the reason, once the deed is done, it's done. Whether you enjoy it or not is irrelevant--the result is the same.|
14825|FE7|31-Light|Eliwood|It is not the same! If you feel no horror for taking someone's life... then you...you yourself are not alive!|
14826|FE7|31-Light|Nergal|Heh heh heh... Your weakness runs deep in you. You can never understand. The concepts of good and evil are devoid of any meaning, any value. These ideas prevent humans from liberating their own strengths. Such foolishness... The ultimate foolishness of the human race!!|
14827|FE7|31-Light|Athos|Nergal, after all these years... You have not stopped to reconsider your ideas at all.|
14828|FE7|31-Light|Nergal|The same is true of you, Athos. You must see the truth of it! All living creatures take energy from somewhere. We all use it to create, to change it into something better. The knowledge of Arcadia has shown us the road to the ultimate transformation. And yet you will not take that road! Why do you reject the obvious?|
14829|FE7|31-Light|Athos|I am not opposed to the quest for power, for greater knowledge. However, that quest must be driven from within. To fuel your quest with the stolen lives of others, this brings not wisdom but abomination.|
14830|FE7|31-Light|Nergal|Heh heh heh... I remember. I still remember! Those words are unchanged from when you first said them ages back. When you and the dragons conspired to bury me!|
14831|FE7|31-Light|Nergal|Look at this wound! The wound I took from your magic!! It was a mistake. The only person who understood... The man I thought my truest friend... It was a mistake to try and destroy me. Heh heh heh heh... It confirmed some things for me. That trust brings betrayal. That friends bring weakness!|
14832|FE7|31-Light|Eliwood|If that is what you learned from your encounter, then you are a fool. Do you believe for a moment that, when wise Athos struck down his dearest friend, he felt nothing!? His heart was torn in two, and yet you refuse to understand that!|
14833|FE7|31-Light|Athos|Eliwood...|
14834|FE7|31-Light|Eliwood|Nergal! I will defeat you! Here! Today!! But...even now, there is no hatred in my heart. You who were born human, you who lost the heart that defines your humanity... For you, I have nothing but pity.|
14835|FE7|31-Light|Nergal|...Pity? Heh heh heh... Amusing. A weak fool like you has "pity" for me? Interesting... Now, if you hope to defeat me, you may have your chance. Of course, you will have to best my morphs first!|
14836|FE7|31-Light|Eliwood|Listen to me! This is my fight now! Mine alone! Everyone, stay back!|
14837|FE7|31-Light|Hector|Hey! What are you talking about? We've come this far together, haven't we?|
14838|FE7|31-Light|Lyn|That's right! I've said it before. We all feel the same way.|
14839|FE7|31-Light|Eliwood|Hector... Lyndis...|
14840|FE7|31-Light|Nils|Don't forget me, Lord Eliwood! And...Ninian. I'm sure she's here as well.|
14841|FE7|31-Light|Eliwood|Nils... Ah! Tactician, you, too?|
14842|FE7|31-Light|Marcus|I’ll show you the strength of a knight of Pherae.|
14843|FE7|31-Light|Lowen|Knights should fight, not speak! …Was that right?|
14844|FE7|31-Light|Rebecca|I'll do whatever I can to help!|
14845|FE7|31-Light|Dorcas|…Winning this battle means protecting my family.|
14846|FE7|31-Light|Bartre|Whooooooooooa! I’m burning up!|
14847|FE7|31-Light|Oswin|For the honor of the knights of Ostia.|
14848|FE7|31-Light|Matthew|Let me handle this! There’s much I can do.|
14849|FE7|31-Light|Serra|Blessed Saint Elimine, grant us strength to win this with ease.|
14850|FE7|31-Light|Guy|Let me show you how much my blade has matured!|
14851|FE7|31-Light|Priscilla|I don’t want to lose anyone, so I will fight my strongest.|
14852|FE7|31-Light|Erk|For years, I’ve studied. Now, let those studies show their worth!|
14853|FE7|31-Light|Florina|I... I...I'll do my best!|
14854|FE7|31-Light|Kent|I will gladly volunteer to protect Lycia with my life.|
14855|FE7|31-Light|Sain|I won’t hold back! This is for all the lovely ladies I’ve yet to meet!!|
14856|FE7|31-Light|Wil|We’ve made it this far. Let’s get out there and win!|
14857|FE7|31-Light|Raven|If I die here… so be it.|
14858|FE7|31-Light|Lucius|Blessed Saint Elimine, please grant us a miracle...|
14859|FE7|31-Light|Canas|Let this battle be forgotten by history... That is all I ask.|
14860|FE7|31-Light|Dart|I’m Dart, brave crewman of Fargus’s pirates, and I fear nothing!|
14861|FE7|31-Light|Fiora|For the honor of the Pegasus knights of Ilia, I will annihilate the foe!|
14862|FE7|31-Light|Legault|My oh my… Fools aplenty. That includes me, too.|
14863|FE7|31-Light|Heath|For Bern, land of my birth… May I return to it soon!|
14864|FE7|31-Light|Rath|For those whose reasoning is bent. I will straighten it with my bow.|
14865|FE7|31-Light|Isadora|My pride shall not be broken! My strength holds true!|
14866|FE7|31-Light|Hawkeye|…I, too, will join you in this final glory.|
14867|FE7|31-Light|Farina|Hey! There’s no doubt we’ll win! Just don’t forget my bonus!|
14868|FE7|31-Light|Pent|If he has power to rival Athos, then I must test that power myself.|
14869|FE7|31-Light|Louise|No matter what happens, I’ll be at Lord Pent’s side.|
14870|FE7|31-Light|Harken|Lord Elbert… I will protect your son.|
14871|FE7|31-Light|Karel|As long as there’s someone to cut, you will have my aid.|
14872|FE7|31-Light|Wallace|I’m trembling with anticipation!|
14873|FE7|31-Light|Geitz|This looks like fun! This is what I’ve been waiting for!!|
14874|FE7|31-Light|Nino|...Father... Brothers...... For all that I've lost... I won't let him get away!|
14875|FE7|31-Light|Jaffar|……|
14876|FE7|31-Light|Karla|I’ve lived long enough. I’ve no regrets…|
14877|FE7|31-Light|Vaida|What are you worried about? With me here, we can’t lose!|
14878|FE7|31-Light|Renault|It is for this moment that I have lived…|
14879|FE7|31-Light|Eliwood|Everyone... Let's go! We've got to stop Nergal!|
14880|FE7|31-Light|Hector|Everyone… Here we go! Give it your all, and beat this knave!|
14881|FE7|31-Light|Lyn|Eliwood! Wait!|
14882|FE7|31-Light|Eliwood|What is it, Lyndis?|
14883|FE7|31-Light|Lyn|Is it true what Nergal said?|
14884|FE7|31-Light|Eliwood|You mean about Lord Uther?|
14885|FE7|31-Light|Lyn|He said he’s dead... When– Did you know, Eliwood?!|
14886|FE7|31-Light|Eliwood|...Hector has been acting a little strange... So I forced Oswin to tell me. It was the same illness that took his father. The sickness came on suddenly. It took less than a year for the disease to spread.|
14887|FE7|31-Light|Lyn|So when we met him in Castle Ostia, he was...|
14888|FE7|31-Light|Eliwood|He was dying. ...Yet...he... He didn’t want Hector or us to know... He pushed himself too far. I’m sure he was told he shouldn’t be moving about...|
14889|FE7|31-Light|Lyn|Hector...when... when did he...|
14890|FE7|31-Light|Eliwood|Only recently... He figured it out when he saw Lord Uther wasn’t at the castle. He pressed Oswin to tell him. ......After that, so as not to distract us, Hector pretended that nothing was amiss...|
14891|FE7|31-Light|Lyn|...... ...That’s...no– ...That’s...|
14892|FE7|31-Light|Eliwood|Lyndis...|
14893|FE7|31-Light|Eliwood|Hector... Do you have a minute?|
14894|FE7|31-Light|Hector|It’s about my brother, isn’t it? Sorry I didn’t tell you.|
14895|FE7|31-Light|Eliwood|It’s all right. I understand you better than anyone. More importantly, have you settled things with Oswin?|
14896|FE7|31-Light|Hector|...Don’t talk to me about him.|
14897|FE7|31-Light|Eliwood|Hector... You’re not angry with Oswin. When Lord Uther was in trouble, you weren’t at his side. You’re angry with yourself. It’s true, isn’t it? I was the same way. I couldn’t save my father... I couldn’t save Ninian... Over and over, I blamed myself...|
14898|FE7|31-Light|Hector|Eliwood...|
14899|FE7|31-Light|Eliwood|But, you know, that’s just a way of running from the sadness of loss. I think you’ve realized that already. Lord Uther...and Oswin... They were thinking of you above all else. You must see that, but if you continue to pretend you do not, you will lost sight of something terribly valuable. That’s all I have to say.|
14900|FE7|31-Light|Hector|......|
14901|FE7|31-Light|Hector|Oswin!|
14902|FE7|31-Light|Oswin|Lord Hector. What is it?|
14903|FE7|31-Light|Hector|...It’s OK. I, uhm... I don’t have any more doubts! Nergal’s time is up!|
14904|FE7|31-Light|Oswin|Yes, sir! And I, Oswin, will be at your side no matter what!!!|
14905|FE7|31-Light|Hector|...What is it?|
14906|FE7|31-Light|Lyn|Hector... I’m certain...that... you did not...cry... So, I will... This...is your share...of tears... Don’t say...anything. Just, for a little while, let me lean on you. For a little while...|
14907|FE7|31-Light|Hector|......|
14908|FE7|31-Light|Lyn|... ... ... ... ... ... ...Don’t...|
14909|FE7|31-Light|Hector|Hm?|
14910|FE7|31-Light|Lyn|...Don’t die... Please, you–|
14911|FE7|31-Light|Hector|...I know.|
14912|FE7|31-Light|Lloyd|……………|
14913|FE7|31-Light|Legault|…Huh, even as a monster, you are a handsome one, Lloyd. But you know something? I can’t let this continue!!|
14914|FE7|31-Light|Lloyd|……………|
14915|FE7|31-Light|Nino|Ah…Lloyd… …Sniff…oh…… Why does this have to happen again?|
14916|FE7|31-Light|Linus|……………|
14917|FE7|31-Light|Legault|Oh… We meet again. …Linus… This stinks!!|
14918|FE7|31-Light|Linus|……………|
14919|FE7|31-Light|Nino|Linus… I’ll…see you again… I’m sure you’re angry, but… Please be my friend…again…|
14920|FE7|31-Light|Uhai|……………|
14921|FE7|31-Light|Legault|…Uhai…why did this blasphemy occur? …I’ll put an end to it right away!|
14922|FE7|31-Light|Brendan|……………|
14923|FE7|31-Light|Legault|…Commander… I really didn’t want to see you like this. …All I can give you is one last act of rebellion.|
14924|FE7|31-Light|Brendan|……………|
14925|FE7|31-Light|Nino|Father… Fa-Father… I… I’ll…end this……I’m sorry…|
14926|FE7|31-Light|Nergal|Be prepared. You are to be witness to a power that overwhelms all!|
14927|FE7|31-Light|Eliwood|Nergal!|
14928|FE7|31-Light|Nergal|So you're here, Eliwood. I thought losing Ninian might distract you. Have you forgotten her so quickly? How heartless.|
14929|FE7|31-Light|Eliwood|I haven't forgotten. I'll never forget. It was my mistake that killed Ninian. Because of that... I will fight. I will not run away and hide in sorrow... I'm going to put an end to all this!|
14930|FE7|31-Light|Nergal|Did you know, Eliwood? What happened to your friend Hector? What he was thinking as he fought by your side?|
14931|FE7|31-Light|Eliwood|......|
14932|FE7|31-Light|Nergal|Heh heh... It's a pity. If only he had been free to return to Ostia.|
14933|FE7|31-Light|Eliwood|I know that I've caused much pain for my friends. But that is why... I will not lose here today!!|
14934|FE7|31-Light|Nergal|Little girl from Sacae... You'd do well to vanish. One such as you is no match for me.|
14935|FE7|31-Light|Lyn|The nomads of the plains do not abandon their fellow tribespeople. Eliwood and Hector are my dear friends... Their sorrow is my sorrow. Their anger is my anger.|
14936|FE7|31-Light|Nergal|Pah...|
14937|FE7|31-Light|Lyn|Nergal! In my friends' names, I will cut you down!|
14938|FE7|31-Light|Nino|......|
14939|FE7|31-Light|Nergal|Uhn? Who do you think you are?|
14940|FE7|31-Light|Nino|You will pay! You stole my family from me, and you will pay, Nergal!!! I will avenge them all!|
14941|FE7|31-Light|Nergal|Now, I see... You're Sonia's...|
14942|FE7|31-Light|Jaffar|......|
14943|FE7|31-Light|Nergal|Hmph... It's you, Jaffar? Turning your sword against me, your master? Do you forget who raised you? You are worthless.|
14944|FE7|31-Light|Jaffar|...Wrong. I am a man.|
14945|FE7|31-Light|Nergal|Oh, really? If so, then I will give you a man's death!|
14946|FE7|31-Light|Renault|...Nergal, do you remember me?|
14947|FE7|31-Light|Nergal|Hah. You are... Renault. So you're still seeking out a wretched existence?|
14948|FE7|31-Light|Renault|I went astray. I listened to your honeyed words... I dreamt of the impossible... the return of a lost soul. But...what you gave me was... a puppet... It was soulless...nothing more than an empty vessel!!|
14949|FE7|31-Light|Nergal|Just an empty vessel... Isn't that what you wanted? You desired to bring back your dead friend. You were my experiment, and I completed my morph. I'm grateful, Renault. Thanks to you, I gained power.|
14950|FE7|31-Light|Renault|You villain... You cursed him! Your crime can never be forgiven! I will end you with my hands. In the name of my lost friend!|
14951|FE7|31-Light|Hector|Nergal!|
14952|FE7|31-Light|Nergal|So you've come, Hector of Ostia. Your existence itself was my greatest miscalculation. If it had only been Eliwood, this could have been over. So, my little miscalculation, I will erase you. And leave no trace remaining.|
14953|FE7|31-Light|Hector|Do your worst!!|
14954|FE7|31-Light|Hector|Nergal!|
14955|FE7|31-Light|Nergal|I cannot understand you, Hector of Ostia. Why would you do all this for Eliwood? Is this miserable thing called friendship worth dying for?|
14956|FE7|31-Light|Hector|I don't expect you to understand. You've forgotten what it means to be human! Nergal! My connection to you… it's over! I'm finishing everything up right here!!|
14957|FE7|31-Light|Athos|Nergal...|
14958|FE7|31-Light|Nergal|Heh heh... Athos... Take a good look at me! At my tremendous power!|
14959|FE7|31-Light|Athos|Already...words are useless. As an old friend... I will fulfill my duty.|
14960|FE7|31-Light|Nergal|Why? Why must I lose? More power… I must be… stronger… I… Why? Why did I… want power? ……Quintessence? …Don’t…under…stand… but… Gaa… Not like this… I will not die…like this. With my last breath… tremble…and…despair. Hwah ha ha… Ha…ha ha ha…|
14961|FE7|31-Light|Lyn|...Nils? What is it?|
14962|FE7|31-Light|Nils|...I...don’t know... Why...am I.........crying...?|
14963|FE7|31-Light|Hector|Don’t worry. You’ve been through a lot.|
14964|FE7|31-Light|Eliwood|It’s just relief. You’ve done well, haven’t you?|
14965|FE7|31-Light|Lyn|Everything’s OK. The world’s been saved. And I know that Ninian is happy, too.|
14966|FE7|31-Light|Hector|It’s…finished.|
14967|FE7|31-Light|Lyn|Yes… At long last…|
14968|FE7|31-Light|Eliwood|…Father…|
14969|FE7|31-Light|Hector|What was that!?|
14970|FE7|31-Light|Lyn|What on earth… What happened?|
14971|FE7|31-Light|Eliwood|It can’t be…|
14972|FE7|31-Light|Hector|Ah!|
14973|FE7|31-Light|Lyn|Th… Are those… Dragons?|
14974|FE7|31-Light|Eliwood|Nergal’s final warning… This is what he meant!|
14975|FE7|31-Light|Athos|What a calamity! If dragons return to this world… The continent will be ash in less than a month!!|
14976|FE7|31-Light|Eliwood|This must end at any cost! I will stop it!!|
14977|FE7|31-Light|Eliwood|So these are dragons.|
14978|FE7|31-Light|Hector|Look at the size of them. I’ve got a bad feeling about this. My… My legs are trembling just standing here.|
14979|FE7|31-Light|Lyn|There are three of them… I don’t know if we can do this. I… We need some kind of help.|
14980|FE7|31-Light|Athos|I’ll do what I can. I’ll halt the dragons. Strike there!!|
14981|FE7|31-Light|Athos|Ahh… So powerful. Can they be stopped?|
14982|FE7|31-Light|Eliwood|Lord Athos! Flee! The dragons are getting closer!!|
14983|FE7|31-Light|Athos|…If we can’t stop them here, we are…lost.|
14984|FE7|31-Light|Athos|Bramimond!|
14985|FE7|31-Light|Bramimond|… Preparations…took time… …OK. I require everyone’s strength. Gather here the legendary power!|
14986|FE7|31-Light|Eliwood|Ah!! This light…|
14987|FE7|31-Light|Hector|Uwaa! What… What is it!?|
14988|FE7|31-Light|Lyn|Look! There…!|
14989|FE7|31-Light|Bramimond|Bring her back… Let the dragon girl’s soul be restored.|
14990|FE7|31-Light|Eliwood|Ninian!!|
14991|FE7|31-Light|Nils|…Ah! Ninian…|
14992|FE7|31-Light|Ninian|Where… Where am I?|
14993|FE7|31-Light|Bramimond|Girl with the exalted blood of dragons. Use that power to appease them.|
14994|FE7|31-Light|Ninian|…Ah…it’s not …possible. Use my power… in this world……|
14995|FE7|31-Light|Bramimond|Do you not feel it? Your power returning?|
14996|FE7|31-Light|Ninian|…What? ……Ah…… …Yes… … … … …I will try.|
14997|FE7|31-Light|Ninian|That’s enough. I’m sorry… This is not your fault… …I’m sorry.|
14998|FE7|31-Light|Ninian|No… no more……|
14999|FE7|31-Light|Eliwood|Ninian!!|
15000|FE7|31-Light|Nils|It’s OK. She only fainted. Thank goodness… Ninian……|
15001|FE7|31-Light|Bramimond|One dragon still remains. Leave the girl to me. I shall tend to her.|
15002|FE7|31-Light|Athos|Chosen ones! You must stop the final dragon! You must save us all!!|
15003|FE7|31-Light|Hector|Eliwood! Are you all right?|
15004|FE7|31-Light|Eliwood|Yes. Thanks to you, Hector. If it weren’t for you, I wouldn’t be here. I truly thank you.|
15005|FE7|31-Light|Hector|Ninny, I don’t need your thanks. Friends help friends.|
15006|FE7|31-Light|Athos|Well done, brave successors to Roland. It’s finally over. Finally, everything is...|
15007|FE7|31-Light|Hector|Graybeard!?|
15008|FE7|31-Light|Hector|Eliwood!!|
15009|FE7|31-Light|Lyn|Eliwood!|
15010|FE7|31-Light|Nils|Lord Eliwood!|
15011|FE7|31-Light|Eliwood|I’m here! I’m right here!|
15012|FE7|31-Light|Athos|Well done, brave successor to Roland. It’s finally over. Finally, everything is…|
15013|FE7|31-Light|Eliwood|Lord Athos!?|
15014|FE7|31-Light|Athos|Ha… Looks like I’ve exhausted my strength. I… I’ll die before you, friend.|
15015|FE7|31-Light|Bramimond|…I may well follow you soon. For now…I will sleep again.|
15016|FE7|31-Light|Athos|Eliwood…Hector, Lyn…I’ve lived a long, long time, but now…I’m done. Do not grieve. Soon, I will be with long-absent friends. … I have no regrets.|
15017|FE7|31-Light|Eliwood|Lord Athos!!|
15018|FE7|31-Light|Athos|Now…my friends, my family. Let me give you a parting gift… As I lay dying… I see many things. I see the future… Oh… Why? Why… is this not now? Neither Bramimond nor I… will be…here… to help a land…in need…|
15019|FE7|31-Light|Lyn|What…do you see?|
15020|FE7|31-Light|Athos|An evil star…rises in Bern…All of Elibe will be once again awash in blood… But do not fear. Once again, Lycia brings hope. Children of fire… …Everything… …|
15021|FE7|31-Light|Eliwood|Lord Athos… Even at the end…he thought of us…|
15022|FE7|31-Light|Hector|…Graybeard…|
15023|FE7|31-Light|Lyn|…Look, both of you. Lord Athos… It’s almost as though he’s smiling.|
15024|FE7|31-Light|Ninian|…This world will once again be enveloped by darkness…But… at the end… a saving light shall rise.|
15025|FE7|31-Light|Eliwood|Ninian!|
15026|FE7|31-Light|Ninian|Lord Eliwood…|
15027|FE7|31-Light|Eliwood|I’m so happy…I can’t believe you’re back. I feel like this is all a dream. Once I lost you… I knew for sure. I need you. I want you by my side forever.|
15028|FE7|31-Light|Ninian|Lord Eliwood…I… …I must go home…|
15029|FE7|31-Light|Eliwood|What do you mean?!|
15030|FE7|31-Light|Ninian|I’m…the cause of all of this. It was my weakness that invited this tragedy…|
15031|FE7|31-Light|Eliwood|Ninian?|
15032|FE7|31-Light|Ninian|Here on Elibe… …we were nurtured for ages in the land of our birth. Even after humans invaded and drove us out….. Not a day passed that I did not think of it…..I yearned to see it once again… Our homeland… Those children… the fire dragons…They were like me…..|
15033|FE7|31-Light|Nils|…..|
15034|FE7|31-Light|Ninian|We knew that it was forbidden. And yet we answered Nergal’s call and opened the gate… We didn’t intend to stay long… Just to see home one last time. But Nergal captured us and… it led to this.|
15035|FE7|31-Light|Eliwood|We humans, we took control of the continent like it was our right. We never considered who or what we drove away… …Ninian, Nils, the blame for this was never yours alone. While we can claim ignorance, we still bear some responsibility.|
15036|FE7|31-Light|Nils|…Lord Eliwood, do you truly believe that?|
15037|FE7|31-Light|Eliwood|I do. If my father were here, he would say the same thing. Let’s work together and think about the future. If the entire continent were made a place where dragons and humans could live together like the hidden city Lord Athos spoke of, Arcadia…|
15038|FE7|31-Light|Ninian|What a wonderful world that would be…But that’s certainly something that won’t happen for a long, long time. So we… we can’t stay here. The gate is still open. If it remains so, other dragons will certainly pass through. Before that happens, we must return to our world. We must regain our power and seal the gate…from that side.|
15039|FE7|31-Light|Eliwood|Are you saying I’ll never see you again? That can’t be!|
15040|FE7|31-Light|Ninian|Lord Eliwood…I am truly blessed that I have had the chance to meet you. Please… Please… Don’t forget me!|
15041|FE7|31-Light|Eliwood|Ninian!!|
15042|FE7|31-Light|Ninian|….. Come, Nils. Let us go. We must return to our world…|
15043|FE7|31-Light|Nils|Ninian… The air of this world, it’s changed so much from what we knew. No matter how much time passes, our strength will never return. If we stay here, we will not survive long.|
15044|FE7|31-Light|Ninian|Nils? Why do you…|
15045|FE7|31-Light|Nils|But even knowing that your life will be short…Ninian…You truly wish to remain here, don’t you? I understand… Stay here. Stay with Lord Eliwood.|
15046|FE7|31-Light|Ninian|Nils?|
15047|FE7|31-Light|Nils|Lord Eliwood… Ninian… No…My sister… Please cherish her.|
15048|FE7|31-Light|Eliwood|I will. I will make her happy. …I swear it.|
15049|FE7|31-Light|Ninian|Nils! You… Are you…|
15050|FE7|31-Light|Nils|Mm. I’m going alone. I want to live a long time. I don’t have your curiosity.|
15051|FE7|31-Light|Ninian|…Nils…..|
15052|FE7|31-Light|Nils|…Ok then, I’m going.|
15053|FE7|31-Light|Hector|Be well, Nils!|
15054|FE7|31-Light|Lyn|I’ll miss you…|
15055|FE7|31-Light|Eliwood|I’ll never forget you.|
15056|FE7|31-Light|Ninian|… …..Nils…|
15057|FE7|31-Light|Nils|Don’t cry, Ninian… Even if we’re apart, if we never see each other again, our bond will never, ever be cut… More importantly, Sister…Live as long… and be as happy as you can, for as long as you can.|
15058|FE7|31-Light|Ninian|Nils!!|
15059|FE7|31-Light|Eliwood|Thank you, Nils.|
15060|FE7|31-Light|Hector|Oh, daybreak!|
15061|FE7|31-Light|Lyn|Beautiful, isn’t it. The start of another day.|
15062|FE7|31-Light|Eliwood|Ninian… You’ll come with me, won’t you?|
