id|game|chapter|speaker|text|tag
13373|FE7|29-SandsOfTime|Eliwood|......|
13374|FE7|29-SandsOfTime|Hector|Mark! We need you! We need a plan!! If we can hold them back for a while, reinforcements will come!|
13375|FE7|29-SandsOfTime|Denning|This is a message from Lord Nergal. “I await you on the Dread Isle.”|
13376|FE7|29-SandsOfTime|Hector|Tell all the soldiers!! Take your posts, and don’t move. Hold your positions! All we can do is hold on until reinforcements arrive!!|
13377|FE7|29-SandsOfTime|Lyn|Eliwood!|
13378|FE7|29-SandsOfTime|Eliwood|What?|
13379|FE7|29-SandsOfTime|Lyn|Don’t overexert yourself.|
13380|FE7|29-SandsOfTime|Eliwood|I’m fine... I’m not that weak.|
13381|FE7|29-SandsOfTime|Lyn|......|
13382|FE7|29-SandsOfTime|Nils|...... ...Ninian...|
13383|FE7|29-SandsOfTime|Soldier|You! You’re one of Lord Hector’s guests, aren’t you? You shouldn’t be out here, it’s too dangerous! Go and hide in that room! Do you understand?|
13384|FE7|29-SandsOfTime|Nils|.........|
13385|FE7|29-SandsOfTime|Soldier|Lord Hector! Are you unharmed!? Protect Lord Hector! Knights of Ostia! Attack!!|
13386|FE7|29-SandsOfTime|Hector|Hey Graybeard! Are these guys...|
13387|FE7|29-SandsOfTime|Athos|Yes, I’m sure of it. They are his morphs...|
13388|FE7|29-SandsOfTime|Lyn|It’s true... They’re all eerily similar. That reminds me... That man on Valor, Ephidel... Black Fang’s Sonia, too... Are you saying that he made them all?|
13389|FE7|29-SandsOfTime|Athos|It is an abomination. A crime against all that is natural. When Nergal began using morphs to carry out his plans, his power had grown beyond our ability to contain him. After humans, his next target became the essence of dragons. His next target had to be Arcadia. I concealed our paradise behind a curtain of sandstorms. I then hid in the underground ruins and waited for him. I did not hope to defeat him. Just to exchange blows... and then draw him into the desert, which would be his end.|
13390|FE7|29-SandsOfTime|Eliwood|But Nergal never showed up, did he?|
13391|FE7|29-SandsOfTime|Athos|Correct. I’ve no idea how he managed it but... He called those siblings through the Dragon’s Gate. And now... he plans to call a horde of dragons to this land.|
13392|FE7|29-SandsOfTime|Hector|What do we have to do to stop him?|
13393|FE7|29-SandsOfTime|Athos|Our last hope is the power of the legendary items. It would take too long for us to gather all of them. I will go to the Shrine of Seals and tell Bramimond everything. We must have his power, no matter the cost.|
13394|FE7|29-SandsOfTime|Eliwood|Then we should go to the Dragon’s Gate ahead of you.|
13395|FE7|29-SandsOfTime|Athos|What!?|
13396|FE7|29-SandsOfTime|Hector|That’s a good idea. Even though you cannot harm Nergal himself, you can certainly do some damage to his troops.|
13397|FE7|29-SandsOfTime|Lyn|If we don’t answer Nergal’s invitation soon... He’ll continue to send out troops after us. If that’s going to happen, we might as well take the fight to him! I won’t have Lycia ravaged by any more of his acts!|
13398|FE7|29-SandsOfTime|Athos|...You... You truly are Roland’s children. I am old... I did not expect anything to surprise me again, and yet...|
13399|FE7|29-SandsOfTime|Eliwood|...Lord Athos.|
13400|FE7|29-SandsOfTime|Athos|It takes the strongest of bonds to alter the course of fate. Go... Go, my youthful friends. Set your sights on the Dragon’s Gate and keep moving. ...Eliwood, Hector, where are the legendary items?|
13401|FE7|29-SandsOfTime|Hector|They’re right here.|
13402|FE7|29-SandsOfTime|Eliwood|Mine, too. I’m sorry. ...I simply couldn’t bring myself to wield it.|
13403|FE7|29-SandsOfTime|Hector|Neither could I... Eliwood said it felt like Durandal moved by itself. A weapon with a will of its own? Can I really control a weapon like that? Frankly, I wasn’t sure.|
13404|FE7|29-SandsOfTime|Athos|Let me take them from you for a while. May I?|
13405|FE7|29-SandsOfTime|Eliwood|Yes.|
13406|FE7|29-SandsOfTime|Hector|It’s fine, but...|
13407|FE7|29-SandsOfTime|Athos|Eliwood, Hector, I understand how you both feel. But without these weapons, we won’t be able to stop Nergal. ...You know that, don’t you?|
13408|FE7|29-SandsOfTime|Eliwood|...Yes. When next I wield it, ...I won’t hesitate.|
13409|FE7|29-SandsOfTime|Hector|Confidence is just a matter of time. I’ll use it when I need to. You’ll see, Graybeard!|
13410|FE7|29-SandsOfTime|Athos|I know.|
13411|FE7|29-SandsOfTime|Hector|...Oswin.|
13412|FE7|29-SandsOfTime|Oswin|I’m here, Lord Hector. We won’t be able to contact Fargus about traveling to Valor ’til the day after tomorrow. The guards are rotating watches to protect the castle. Lord Hector. For this one night, please get some rest.|
13413|FE7|29-SandsOfTime|Hector|Who needs rest!? Do not talk to me of rest when Ostia needs me! There is...something that you need to tell me, isn’t there?|
13414|FE7|29-SandsOfTime|Oswin|I can think of nothing, my lord.|
13415|FE7|29-SandsOfTime|Hector|Stop this foolishness!! It’s plain that everyone is avoiding me! What you’re all hiding... I know what it is!|
13416|FE7|29-SandsOfTime|Oswin|Lord Hector, you must calm yourself.|
13417|FE7|29-SandsOfTime|Hector|Say it! I command you!! Tell me what has happened!!!|
13418|FE7|29-SandsOfTime|Oswin|......|
13419|FE7|29-SandsOfTime|Hector|...If you don’t answer right here, right now, I will cut you down, knave!|
13420|FE7|29-SandsOfTime|Oswin|...Do as you must.|
13421|FE7|29-SandsOfTime|Hector|!!|
13422|FE7|29-SandsOfTime|Oswin|......|
13423|FE7|29-SandsOfTime|Hector|......I...see. ...My brother... He’s...gone...isn’t he?|
13424|FE7|29-SandsOfTime|Oswin|Lord Hector!!|
13425|FE7|29-SandsOfTime|Hector|I was sure... He was recuperating... That he’d gone somewhere to recover his strength. I thought that was what you were hiding... But......you won’t confess even now. ......That means......|
13426|FE7|29-SandsOfTime|Oswin|Lord Hector! Wait!! Please......!!!|
13427|FE7|29-SandsOfTime|Limstella|Welcome home, Master.|
13428|FE7|29-SandsOfTime|Nergal|Limstella, look at this.|
13429|FE7|29-SandsOfTime|Limstella|The children’s dragon stone. What will you do with it?|
13430|FE7|29-SandsOfTime|Nergal|I will infuse it with quintessence.|
13431|FE7|29-SandsOfTime|Limstella|This is...|
13432|FE7|29-SandsOfTime|Nergal|The dragon girl... Ninian’s essence. Beautiful... Absolutely beautiful...... With this, I will be able to call dragons whenever I please.|
13433|FE7|29-SandsOfTime|Limstella|Shall we begin the process right away?|
13434|FE7|29-SandsOfTime|Nergal|No, I lost some quintessence from the injuries I took from Athos. To summon the numbers I need, I must have more essence. One must be fully prepared when dealing with dragons. If they wrested free from my control and killed me, all would be for naught.|
13435|FE7|29-SandsOfTime|Limstella|I fear to report... that the quintessence from the Black Fang has all been used. Where shall the next harvest come from?|
13436|FE7|29-SandsOfTime|Nergal|Heh heh heh... All the materials we need are heading this way even now.|
13437|FE7|29-SandsOfTime|Limstella|...I see. Eliwood and friends.|
13438|FE7|29-SandsOfTime|Nergal|That’s right. I will crush them, steal their essences, and call forth my dragons!! Heh heh heh... Haaa haa haha haha hah!!!|
13439|FE7|16x-ThePortOfBadon|Hector|Listen! We need a boat to Valor!|
13440|FE7|16x-ThePortOfBadon|Villager|You want a boat to the Dread Isle? You're mad! No way! Never! There's no one in this village who'll sail there!|
13441|FE7|16x-ThePortOfBadon|Lyn|Please, we're in a hurry. Can you give us passage?|
13442|FE7|16x-ThePortOfBadon|Eliwood|If you won't help us, can you take us to someone who will? Please.|
13443|FE7|16x-ThePortOfBadon|Villager|You must be on urgent business, that's certain. ......There may be one way...|
13444|FE7|16x-ThePortOfBadon|Eliwood|What is it? Tell us, please!|
13445|FE7|16x-ThePortOfBadon|Villager|Pirates.|
13446|FE7|16x-ThePortOfBadon|Lyn|Eh? Pirates?|
13447|FE7|16x-ThePortOfBadon|Villager|Uh-huh. They're fearless, or as close as makes no difference, and they'll go anywhere for a fee. Who knows? They might decide to accept your mad offer.|
13448|FE7|16x-ThePortOfBadon|Hector|Pirates... Looks like we've no choice.|
13449|FE7|16x-ThePortOfBadon|Lyn|Are you serious, Hector? Working with pirates? That's unbelievable! You're considering it, aren't you, Eliwood?|
13450|FE7|16x-ThePortOfBadon|Eliwood|If there's no other way, what else can we do?|
13451|FE7|16x-ThePortOfBadon|Lyn|You, too, Eliwood? I've misjudged you... It's foolishness to trust the goodwill of pirates! I'm finding another way! (Lyn leaves)|
13452|FE7|16x-ThePortOfBadon|Hector|Why is she so angry?|
13453|FE7|16x-ThePortOfBadon|Eliwood|I heard that Lyndis's parents were slain by bandits. Bandits at land, pirates at sea... They're all the same to Lyndis. Lawbreakers and murderers.|
13454|FE7|16x-ThePortOfBadon|Hector|I see... My parents died of illness... But I can appreciate her feelings. Shall we abandon the pirate plan?|
13455|FE7|16x-ThePortOfBadon|Eliwood|But...|
13456|FE7|16x-ThePortOfBadon|Villager|Too bad about the girl, but there's no other way.|
13457|FE7|16x-ThePortOfBadon|Eliwood|Let's meet the pirates. We can't decide until then.|
13458|FE7|16x-ThePortOfBadon|Hector|That's true.|
13459|FE7|16x-ThePortOfBadon|Villager|That inn over there is a known favorite of the local freebooters. They're reckless and unpredictable. Best be prepared.|
13460|FE7|16x-ThePortOfBadon|Fargus|What do you want, whelps? You're here to see me, aren't you?|
13461|FE7|16x-ThePortOfBadon|Eliwood|You're commander of the pirate armada, aren't you?|
13462|FE7|16x-ThePortOfBadon|Fargus|Gwah hah hah! "Commander of the pirate armada!" I like the sound of that! Are you lads that naive? Or are you just dumb? Which is it?|
13463|FE7|16x-ThePortOfBadon|Hector|You insolent...|
13464|FE7|16x-ThePortOfBadon|Eliwood|Peace, Hector!|
13465|FE7|16x-ThePortOfBadon|Eliwood|If I've insulted you, I apologize. How should I address you?|
13466|FE7|16x-ThePortOfBadon|Fargus|Hmph... You don't frighten easily, do you? Well, at least it seems you're not stupid. "Captain" will do, whelp. I'm Fargus, captain of the Davros.|
13467|FE7|16x-ThePortOfBadon|Eliwood|Fargus... Master Fargus? Or should I call you Captain?|
13468|FE7|16x-ThePortOfBadon|Fargus|You're not one of my mates. Call me Fargus. Now, what do you want?|
13469|FE7|16x-ThePortOfBadon|Eliwood|We want to book passage to Valor.|
13470|FE7|16x-ThePortOfBadon|Fargus|How much will you pay?|
13471|FE7|16x-ThePortOfBadon|Eliwood|We don't know the current rates. Tell us how much you want.|
13472|FE7|16x-ThePortOfBadon|Fargus|100,000 gold.|
13473|FE7|16x-ThePortOfBadon|Hector|Wait, 100,000 gold?|
13474|FE7|16x-ThePortOfBadon|Fargus|Well? Will you pay?|
13475|FE7|16x-ThePortOfBadon|Eliwood|We've no choice, but we need a little time. We'll get the gold and return as quickly as possible. Come, Hector.|
13476|FE7|16x-ThePortOfBadon|Hector|Wa-Wait a moment! Eliwood!|
13477|FE7|16x-ThePortOfBadon|Hector|Eliwood! Hold on! Where do you think you're going to get 100,000 gold?|
13478|FE7|16x-ThePortOfBadon|Eliwood|I'm sure there's an arena here. We can raise gold somehow...|
13479|FE7|16x-ThePortOfBadon|Hector|What? You're not serious!?|
13480|FE7|16x-ThePortOfBadon|Eliwood|We've no other way, do we?|
13481|FE7|16x-ThePortOfBadon|Hector|Well, no. (Steps back) Sometimes you surprise me, Eliwood.|
13482|FE7|16x-ThePortOfBadon|Eliwood|Did you say something, Hector?|
13483|FE7|16x-ThePortOfBadon|Hector|No, nothing. Let's go earn some gold!|
13484|FE7|16x-ThePortOfBadon|Dart|(Appears) Ahoy! Hold your ground, boys!|
13485|FE7|16x-ThePortOfBadon|Hector|What now? We don't have the money yet.|
13486|FE7|16x-ThePortOfBadon|Dart|Fool! Of course you don't! I know that. The captain's got a message for you.|
13487|FE7|16x-ThePortOfBadon|Eliwood|A message?|
13488|FE7|16x-ThePortOfBadon|Dart|All of my mates in this village are going to attack you. If you can beat us all and get to the ship unharmed, he'll give you passage.|
13489|FE7|16x-ThePortOfBadon|Eliwood|For free? No gold?|
13490|FE7|16x-ThePortOfBadon|Dart|The captain's a tad off-kilter. He'd rather have a bit o' fun with you than take your gold. Smooth sailing to you.|
13491|FE7|16x-ThePortOfBadon|Dart|Hey! Landlubbers! Over here! I'm over here!|
13492|FE7|16x-ThePortOfBadon|Hector|Oh, for... This is a joke, isn't it?|
13493|FE7|16x-ThePortOfBadon|Eliwood|Looks serious enough. Here we go!|
13494|FE7|16x-ThePortOfBadon|Dart|Listen! The captain's waiting at the docks. Talk to him and you're the winner! Trust me, though.... Don't make the mistake of attacking him! You anger the captain, and there's no turning back! Don't forget!!|
13495|FE7|16x-ThePortOfBadon|Lyn|(Comes out of a nearby house) I couldn't find a ship after all. But we have to get to that island... Looks like I'll have to endure pirates. Hm? What was that? Commotion in the village?|
13496|FE7|16x-ThePortOfBadon|Hector|Oh! Lyn! Nice timing. We need your help!|
13497|FE7|16x-ThePortOfBadon|Lyn|You're battling the pirates?|
13498|FE7|16x-ThePortOfBadon|Eliwood|Fighting and... Look, we have to reach the docks and speak to the captain! This is a test to see whether or not he'll give us passage.|
13499|FE7|16x-ThePortOfBadon|Lyn|I don't understand, but.... I'm here, so let me help!|
13500|FE7|16x-ThePortOfBadon|Lucius|Good to see you again, Mark. Our reunion is surely the work of blessed Elimine. I’m most pleased to travel with you once more. Your commands, please.|
13501|FE7|16x-ThePortOfBadon|Raven|So you’re the tactician, huh? I’m Raven. I’m just a mercenary. I work for these guys now, so it looks like I’ll take your orders. What are you waiting for? What do you need me to do?|
13502|FE7|16x-ThePortOfBadon|Fargus|What mooncalves! I would've just let them sit there if they hadn't come any closer! Rush 'em, boys!|
13503|FE7|16x-ThePortOfBadon|Canas|Pardon me! I was speaking with an old sailor a few moments ago. He told me that you’re planning to travel to Valor. Is that so? Really? And that’s why you’re playing tag with these pirates? ......I see. In that case, would you mind if I joined you? My name is Canas. I’m a scholar of sorts... I’ve been seeking passage to Valor, but none will take me. My proposal probably sounds somewhat selfish, no? You should know, I can help in combat. I’ve some skill with a form of elder magic... Some call it dark magic, a rather biased term, if I must be blunt. But at the very least, I can take care of myself, and perhaps others.|
13504|FE7|16x-ThePortOfBadon|Anna|I heard about your contest with the pirate captain, Fargus. You’ve got nerve, I’ll give you that! Let me give you some advice. Don’t try to overpower the pirates. Take the narrow path next to us, and follow the wall toward the sea. Pass in front of the last house, and stay close to the sea wall. You should be able to get to Fargus and win your game! Why do I know all this? Well, my sweetie’s a pirate. His name’s Jake, and he’s the best. If you see him, tell him Anna’s worried about him!|
13505|FE7|16x-ThePortOfBadon|Damian|What an interesting diversion. Maybe we should join in. Lord Eliwood of Pherae... You don’t yet know to fear the Black Fang. Start grieving...for I will teach you that fear.|
13506|FE7|16x-ThePortOfBadon|Damian|You’re about to die. Scream if you must.|
13507|FE7|16x-ThePortOfBadon|Damian|Gaa...ha... Crow in...triumph... you’ve–|
13508|FE7|16x-ThePortOfBadon|Fargus|Hey, there! What are you on about? Do you think to test me? Gwa ha ha ha ha ha! You’re a daft lot. I respect your courage, but you’ve chosen the wrong foe. If you can’t judge your enemy’s skill, you’ll wind up fish food. You’ll do well to remember that if you’re lucky enough to live.|
13509|FE7|16x-ThePortOfBadon|Fargus|Uugwoh... Can’t believe... you...beat... me... You’ve...lost... your way... to...the Dread...Isle... for good...|
13510|FE7|16x-ThePortOfBadon|Fargus|What’s this? Are you spent already? Hm? Attacking someone you’re asking a favor of? Insolent louts! I thought you smarter than that. You disappointed me. Go on! Away with you!! There’s no ship that’ll carry such conceited half-wits as you!! Never show your faces here again!|
13511|FE7|16x-ThePortOfBadon|Fargus|What mooncalves! I would’ve let ’em sit there if they hadn’t come any closer. Up and at ’em, mates! Attack!|
13512|FE7|16x-ThePortOfBadon|Man|Are you interested in this sword here? It’s called a lancereaver. It’s an incredible sword to take against lances. Still, it is a little weak against axes. Go ahead, take it. You’re going to the Dread Isle, right? If you want to avoid the pirates, go behind the shop. From there, just head straight down the alley. Good luck to you.|
13513|FE7|16x-ThePortOfBadon|Man|You’re a brave soul to come to such a perilous place. Here. You should have this staff. You can use it to make those whose magical resistances are weaker than your own fall asleep for a while. Whether it works or not depends on the skill of the wielder. Ho, yes. Looks like those pirates are bearing down on you. Maybe this staff will help you get away.|
13514|FE7|16x-ThePortOfBadon|Man|This road leads to danger. The pirates are waiting for you. Do you not think it would be better to find another route? You’ve risked much to come here. I can’t let you leave empty-handed. Take this axe. What do you think? Nice, isn’t it? However...it’s cursed. It’s a mighty weapon, but if one with bad luck wields it... Ooooh! Terrible, terrible, I tell you. Don’t use it unless you have to.|
13515|FE7|16x-ThePortOfBadon|Woman|You’re being tested by pirates, with passage to the Dread Isle hanging in the balance? Here, use this bow. It’s a rare beauty, eh? A Sacaen friend gave it to me, but I can’t use it. Don’t get yourself killed out there, OK?|
13516|FE7|16x-ThePortOfBadon|Man|Have you been to the arena yet? It’s filled with toughs and bravados. You can get rich there... All you have to do is wager and win. If you’re beaten, however, you lose both money and life. If you think you’re going to lose, press the B Button to give up. Remember, you can’t give up if you’re dead, so don’t wait too long.|
13517|FE7|16x-ThePortOfBadon|Fargus|Aha! You made it, whelps!|
13518|FE7|16x-ThePortOfBadon|Hector|That was... hard...|
13519|FE7|16x-ThePortOfBadon|Eliwood|Haa...haa...You'll give us passage now, won't you?|
13520|FE7|16x-ThePortOfBadon|Fargus|I'm a man of the sea. I always keep my word.Are my old eyes lyin' to me? Is this beauty really with you? Gwaa ha ha ha!! My lucky day!|
13521|FE7|16x-ThePortOfBadon|Lyn|.....|
13522|FE7|16x-ThePortOfBadon|Hector|Listen, I know how you feel, but you have to accept it. We've no other choice!|
13523|FE7|16x-ThePortOfBadon|Lyn|I know that! I haven't said a word, have I?|
13524|FE7|16x-ThePortOfBadon|Eliwood|We can go to the Dread Isle now. Please, Father... be well.|
13525|FE7|16-WhereaboutsUnknown|Hector|Looks like there are still a lot of Laus soldiers in the castle.|
13526|FE7|16-WhereaboutsUnknown|Eliwood|Lyndis, where are the Caelin guards?|
13527|FE7|16-WhereaboutsUnknown|Lyn|I think about half of them were killed in the surprise attack. The survivors must be here somewhere…|
13528|FE7|16-WhereaboutsUnknown|Hector|They’re probably locked away as prisoners. Right. Well, let’s find and rescue them too!|
13529|FE7|16-WhereaboutsUnknown|Eliwood|I wish we had more power to make up for our poor numbers.|
13530|FE7|16-WhereaboutsUnknown|Lyn|Hold on, Grandfather… We’ll be there shortly.|
13531|FE7|16-WhereaboutsUnknown|Hector|Time to get inside! Let’s reclaim the castle! The key to victory is seizing the throne! That’s where we’ll find their commander I’m sure.|
13532|FE7|16-WhereaboutsUnknown|Merlinus|Um, hellooooo!|
13533|FE7|16-WhereaboutsUnknown|Eliwood|Hm?|
13534|FE7|16-WhereaboutsUnknown|Merlinus|Are you from Castle Caelin?|
13535|FE7|16-WhereaboutsUnknown|Lyn|I am. May I ask your business in the castle?|
13536|FE7|16-WhereaboutsUnknown|Merlinus|I am Merlinus. I am a traveling merchant with goods beyond compare. If you would be so kind to hire me, I…|
13537|FE7|16-WhereaboutsUnknown|Lyn|My apologies. Now is not the time.|
13538|FE7|16-WhereaboutsUnknown|Merlinus|Please, my lady… I’ve dreamt of working for a noble house for so long. By all means, please call on my services!|
13539|FE7|16-WhereaboutsUnknown|Hector|Old man! Are you truly a merchant?|
13540|FE7|16-WhereaboutsUnknown|Merlinus|Old… Old man?|
13541|FE7|16-WhereaboutsUnknown|Eliwood|You’re being rude, Hector!|
13542|FE7|16-WhereaboutsUnknown|Hector|Right, right. Old…gentleman. Is it true you aspire to work for a noble house?|
13543|FE7|16-WhereaboutsUnknown|Merlinus|Yes, my boy. Yes, I do.|
13544|FE7|16-WhereaboutsUnknown|Hector|In that case, we’d like to hire you.|
13545|FE7|16-WhereaboutsUnknown|Merlinus|Really?|
13546|FE7|16-WhereaboutsUnknown|Eliwood|Hector?|
13547|FE7|16-WhereaboutsUnknown|Hector|This journey could last a while, and we’ve acquired many items. It would be quite convenient if we had someone to manage our things.|
13548|FE7|16-WhereaboutsUnknown|Merlinus|Leave it to me! Managing…things is my specialty!|
13549|FE7|16-WhereaboutsUnknown|Eliwood|Our journey is dangerous, and has no end in sight. Is that acceptable?|
13550|FE7|16-WhereaboutsUnknown|Merlinus|Did you say da-dangerous?|
13551|FE7|16-WhereaboutsUnknown|Hector|I’m brother to Marquess Ostia. He’s Marquess Pherae’s son. You can come with us if you so desire.|
13552|FE7|16-WhereaboutsUnknown|Merlinus|Oh? Ostia and Pherae? Nobility beyond compare! I’m coming! Most definitely!|
13553|FE7|16-WhereaboutsUnknown|Eliwood|Mark. The captured Caelin soldiers are most likely exhausted. I'd like to protect them and keep them from having to fight. I realize that makes it difficult for you to plan a strategy, but... I will do my best to take up their share of the fighting. Now, please tell us what we should do, Mark.|
13554|FE7|16-WhereaboutsUnknown|Hector|Mark. We can't count on the captured Caelin soldiers to be able to fight. We'll have to protect them as much as possible. What!? That chill feeling... Someone's watching... and wants me dead! No sense in worrying, though. I'll deal with it when it happens. Let's go, Mark!|
13555|FE7|16-WhereaboutsUnknown|Raven|Hey, you. Let me out of here.|
13556|FE7|16-WhereaboutsUnknown|Laus Soldier|What?|
13557|FE7|16-WhereaboutsUnknown|Raven|Marquess Ostia’s brother is among your enemy, right? Let me out, and I’ll help you. But I must have the brother. I’ve a score to settle with House Ostia.|
13558|FE7|16-WhereaboutsUnknown|Laus Soldier|Do you think me a fool? You work for house Caelin! I cannot trust your word!|
13559|FE7|16-WhereaboutsUnknown|Raven|Then I’ll have to break down this door and go through you. You were using Lucius as a hostage, but now he’s here with me…|
13560|FE7|16-WhereaboutsUnknown|Laus Soldier|Uh…|
13561|FE7|16-WhereaboutsUnknown|Lucius|No, Lord Raven! You mustn’t! You cannot betray your debt to Marquess Caelin.|
13562|FE7|16-WhereaboutsUnknown|Raven|Shut up, Lucius. You think me foolish, but you don’t understand… How about it?|
13563|FE7|16-WhereaboutsUnknown|Laus Soldier|Very well. You! Get out! Remember, if you betray us, your companion dies.|
13564|FE7|16-WhereaboutsUnknown|Raven|I see. Just remember, if that happens, you die next.|
13565|FE7|16-WhereaboutsUnknown|Laus Soldier|Urr…|
13566|FE7|16-WhereaboutsUnknown|Lucius|Wait! You can’t go alone! It’s too dangerous!|
13567|FE7|16-WhereaboutsUnknown|Raven|Lucius, stay here and be quiet. I’ll be back for you.|
13568|FE7|16-WhereaboutsUnknown|Lucius|Lord Raven!|
13569|FE7|16-WhereaboutsUnknown|Caelin Soldier|What in blazes!? It’s getting even noisier than before.|
13570|FE7|16-WhereaboutsUnknown|Lucius|Isn’t that the sound of combat?|
13571|FE7|16-WhereaboutsUnknown|Caelin Soldier|It must be Lady Lyndis! She’s found reinforcements! It’s time…|
13572|FE7|16-WhereaboutsUnknown|Lucius|Hm? What… What are you doing?|
13573|FE7|16-WhereaboutsUnknown|Caelin Soldier|I thought aid might come, so I hid keys and weapons here.|
13574|FE7|16-WhereaboutsUnknown|Lucius|Oh, I see.|
13575|FE7|16-WhereaboutsUnknown|Caelin Soldier|What are you going to do?|
13576|FE7|16-WhereaboutsUnknown|Lucius|Uh…|
13577|FE7|16-WhereaboutsUnknown|Caelin Soldier|Your master… He’s betrayed us. Lucius, I must ask. What will you do?|
13578|FE7|16-WhereaboutsUnknown|Lucius|I… I want to stop Lord Raven. However… In his current state, I…doubt he will lend me his ear. And so…I will…wait. I will wait for Lord Raven here. I’m sorry… I cannot fight. …Please understand.|
13579|FE7|16-WhereaboutsUnknown|Caelin Soldier|I do. Here, these are for you.|
13580|FE7|16-WhereaboutsUnknown|Lucius|For me? Vulnerary and a book of light magic?|
13581|FE7|16-WhereaboutsUnknown|Caelin Soldier|You don’t have to fight, just protect yourself. I’ve known you only a short time, but you’re a friend. I don’t want to see you die.|
13582|FE7|16-WhereaboutsUnknown|Lucius|Thank you… Thank you.|
13583|FE7|16-WhereaboutsUnknown|Caelin Soldier|All right, lads! Open that door!! On our honor as Caelin knights, we will save the marquess!|
13584|FE7|16-WhereaboutsUnknown|Raven|You…|
13585|FE7|16-WhereaboutsUnknown|Priscilla|Hm?|
13586|FE7|16-WhereaboutsUnknown|Raven|Can it be?|
13587|FE7|16-WhereaboutsUnknown|Priscilla|I…|
