id|game|chapter|speaker|text|tag
16493|FE7|06-BloodOfPride|Kent|This must be the last trigger. That should do it.|
16494|FE7|06-BloodOfPride|Florina|Hey... This just might be the last trigger. So, I only need to...|
16495|FE7|06-BloodOfPride|Wil|Aha! Found it! The last trigger... Well, here goes...|
16496|FE7|06-BloodOfPride|Dorcas|The final trigger. If I just press this...|
16497|FE7|06-BloodOfPride|Serra|Eww. Is this the last trigger? Guess I’ll try moving it around.|
16498|FE7|06-BloodOfPride|Erk|This must be the last trigger. That should do it, then.|
16499|FE7|06-BloodOfPride|Rath|This is it. The last trigger. If I press this...|
16500|FE7|06-BloodOfPride|Matthew|OK. This is the last one. This should do the trick.|
16501|FE7|06-BloodOfPride|Lyn|Here it is, Mark! The hidden passageway! Good work! We’ll let Rath take over from here.|
16502|FE7|06-BloodOfPride|Marquess Araphen|Ah, it’s Rath! You’ve done well. What a performance!|
16503|FE7|06-BloodOfPride|Rath|Sir... If you have praise, it should be given to this group.|
16504|FE7|06-BloodOfPride|Marquess Araphen|Hm? Who are you?|
16505|FE7|06-BloodOfPride|Lyn|My name is Lyndis. I’m pleased you’re well.|
16506|FE7|06-BloodOfPride|Marquess Araphen|Oh... It’s you. You’re Marquess Caelin’s– Leave us, Rath. I would speak with this girl.|
16507|FE7|06-BloodOfPride|Rath|......|
16508|FE7|06-BloodOfPride|Marquess Araphen|Now... Lady Lyndis. Do you know the identity of those responsible for this uproar?|
16509|FE7|06-BloodOfPride|Lyn|I believe it to be the work of my granduncle, Lundgren.|
16510|FE7|06-BloodOfPride|Marquess Araphen|That’s exactly right. Which means my castle has been damaged in your family’s petty inheritance dispute.|
16511|FE7|06-BloodOfPride|Lyn|My-My apologies...|
16512|FE7|06-BloodOfPride|Marquess Araphen|When I heard that Lady Madelyn’s daughter was in trouble, I thought to lend my assistance... I find I’ve changed my mind. I withdraw my offer.|
16513|FE7|06-BloodOfPride|Kent|Marquess Araphen! You gave me your word, my lord!|
16514|FE7|06-BloodOfPride|Marquess Araphen|... Your name is Kent, is it not? You failed to inform me of one most vital detail!|
16515|FE7|06-BloodOfPride|Kent|What... What do you mean?|
16516|FE7|06-BloodOfPride|Marquess Araphen|This girl does resemble Lady Madelyn, but... I didn’t expect to see her so tainted with the blood of Sacae.|
16517|FE7|06-BloodOfPride|Lyn|What?!?|
16518|FE7|06-BloodOfPride|Marquess Araphen|Don’t you feel the marquess of Caelin would be troubled to meet this... nomadic mongrel?|
16519|FE7|06-BloodOfPride|Sain|You–!|
16520|FE7|06-BloodOfPride|Kent|Sain! Hold! My apologies, my lord Marquess.|
16521|FE7|06-BloodOfPride|Marquess Araphen|Hm... Your man is poorly disciplined.|
16522|FE7|06-BloodOfPride|Kent|Marquess Araphen! Please... If you would grace us with your aid...|
16523|FE7|06-BloodOfPride|Marquess Araphen|...... I hear Marquess Caelin is ill and abed. I question whether he will survive to meet this girl. In which case, his brother, Lundgren, will claim his title. And I certainly wish to avoid trouble with the coming marquess.|
16524|FE7|06-BloodOfPride|Sain|You scheming...|
16525|FE7|06-BloodOfPride|Kent|Sain!|
16526|FE7|06-BloodOfPride|Lyn|I understand. Kent, Sain, we take our leave at once.|
16527|FE7|06-BloodOfPride|Kent|Milady Lyndis! We–|
16528|FE7|06-BloodOfPride|Lyn|I am proud of the Sacae blood that runs through my veins. I will NOT accept aid from one who disparages my heritage.|
16529|FE7|06-BloodOfPride|Sain|That was well done, milady! The marquess is a lout! Don’t worry about anything. We’re all here for you! Isn’t that so, Kent?|
16530|FE7|06-BloodOfPride|Sain|I beg your forgiveness.|
16531|FE7|06-BloodOfPride|Lyn|Why are you apologizing, Kent?|
16532|FE7|06-BloodOfPride|Kent|I’ve been so concerned with seeing you to Caelin. I failed to take your feelings into account.|
16533|FE7|06-BloodOfPride|Lyn|Is that it? Trouble yourself no more. You have put my safety above all else. I have seen that. Hold your head up and be proud.|
16534|FE7|06-BloodOfPride|Kent|Milady Lyndis...|
16535|FE7|06-BloodOfPride|Marquess Araphen|Bah! Arrogant child! If she had but shed a single tear, I would have granted her request. We Lycian nobles will never understand those prideful savages.|
16536|FE7|06-BloodOfPride|Rath|...... Are those your true feelings toward the nomads of Sacae, milord?|
16537|FE7|06-BloodOfPride|Marquess Araphen|What? Oh, Rath! I didn’t see you there. My comments do not reflect on you. You are my captain. I’m proud of your service.|
16538|FE7|06-BloodOfPride|Rath|Of course. As long as we bend our knee to you, you care not where we’re from. But when an equal comes from my lands? What conceit.|
16539|FE7|06-BloodOfPride|Marquess Araphen|Rath! How can you speak to me like that? I have treated you well, have I not? I have paid you well. I have treated you better than your kind deserves.|
16540|FE7|06-BloodOfPride|Rath|You will never understand. My service ends here.|
16541|FE7|06-BloodOfPride|Lyn|The marquess of Araphen... He said my grandfather was ill. We must hurry to Caelin...|
16542|FE7|06-BloodOfPride|Kent|As we approach Caelin, Lundgren’s obstacles will be more difficult to overcome. However, I’ve vowed to see you through to the end, milady!|
16543|FE7|06-BloodOfPride|Lyn|I’m counting on you, Kent.|
16544|FE7|06-BloodOfPride|Sain|I’m with you, too!|
16545|FE7|06-BloodOfPride|Lyn|Thank you, Sain.|
16546|FE7|06-BloodOfPride|Lyn|Mark... Thank you for always standing at my side. It’s because of all of you that I... I will persevere! They will never break my spirit!|
16547|FE7|06-BloodOfPride|Rath|......|
16548|FE7|06-BloodOfPride|Lyn|Rath! What is it? What are you–|
16549|FE7|06-BloodOfPride|Rath|I overheard the marquess talking to himself. Lyn of the Lorca... Proud daughter of the Sacae... I would join you. I would add my strength to yours.|
16550|FE7|06-BloodOfPride|Lyn|Really?|
16551|FE7|06-BloodOfPride|Rath|And this... I want you to take it.|
16552|FE7|06-BloodOfPride|Lyn|This is... Gold!? It’s too much. I can’t accept it.|
16553|FE7|06-BloodOfPride|Rath|I have no need for it. And if it will help you...|
16554|FE7|06-BloodOfPride|Lyn|But...|
16555|FE7|06-BloodOfPride|Rath|I cannot take back something once offered.|
16556|FE7|06-BloodOfPride|Lyn|Rath... I thank you.|
16557|FE7|10-TheDistantPlains|Kent|Lady Lyndis, you should be able to see Castle Caelin once we pass these mountains.|
16558|FE7|10-TheDistantPlains|Lyn|Grandfather… I’ll be with you soon.|
16559|FE7|10-TheDistantPlains|Kent|Everything rests on this next battle.|
16560|FE7|10-TheDistantPlains|Sain|Lundgren will not be receiving the reinforcements he expected. He’ll move against us with everything he has soon.|
16561|FE7|10-TheDistantPlains|Lyn|Let him come! Let them all come! I will not be turned away! I will see my grandfather… I’ve come too far to let anyone stand in my way. This is it, Mark. This is our final test. My friends, for one last time, lend me your strength!|
16562|FE7|10-TheDistantPlains|Lyn|Those clouds look bad. It’s going to rain soon. Let’s go, Mark. We should press on while we’re still able.|
16563|FE7|10-TheDistantPlains|Lyn|Look! The clouds are breaking. This rain should stop soon…|
16564|FE7|10-TheDistantPlains|Lyn|It’s begun to rain, but… the sky looks mostly clear. The rain won’t last long.|
16565|FE7|10-TheDistantPlains|Young Lady|Oh, no! If I don’t bring in the laundry now… Oh, hello. Are you a soldier? Sounds like a hard life… Especially when it rains. Rain must make it difficult for you to move around. I used to ride horses when I was little. Oh, I remember how those horses disliked the rain. It’s better to be on foot when it’s wet. Nomadic horses are trained on the plains, so they’re better with rain, but… Well, rain just seems to make it hard for everyone to get around. The weather around here can change in no time at all. I recommend just staying in one place until the rain clears up.|
16566|FE7|10-TheDistantPlains|Young Man|You’re here to fight Lundgren, aren’t you? Do you have enough weapons? Lundgren’s no ordinary knight: he’s a general. Iron weapons lack the edge to penetrate his armor. If you need something, visit my father’s armory. You should go to the shop next door to his, too. They’ve many powerful weapons and items you can use against Lundgren. Head south and cross the river. You’ll see them. Lundgren’s a tricky one. He’s destroyed the bridge. There’s an old snag next to the river, though… If you knocked it over, you should be able to cross. Travel well. You fight for us all.|
16567|FE7|10-TheDistantPlains|Man|You know, you really should visit the armory next door. They’ve got all you need if you’re fighting knights and generals. You need something to defeat Lundgren, right? Once he’s been beaten, maybe peace will return to Caelin. Good luck to you!|
16568|FE7|10-TheDistantPlains|Old Lady|You’ve finally made it here, have you? Such a long way… We’re all behind Lady Lyndis. All of us. Here, take this. Use it in your battle against Lundgren, please. It’s an energy ring. It’ll increase your strength and magic power a bit. There are lots of items that augment your abilities. These are hard to come by, so think carefully before you use them. Of course, not using them at all would be a terrible waste as well, right? Items like this might vanish once you’ve used them. Bear that in mind, and use them wisely.|
16569|FE7|10-TheDistantPlains|Lundgren|This is my realm, and you’ve entered without my permission. You will not leave these lands alive!|
16570|FE7|10-TheDistantPlains|Lundgren|That annoying little girl… Nothing but a savage from Sacae… The Caelin throne…should be…mine…|
16571|FE7|10-TheDistantPlains|Lundgren|So you’re the girl claiming kinship with my brother!|
16572|FE7|10-TheDistantPlains|Lyn|You’ll play this farce to the end, won’t you Lundgren?|
16573|FE7|10-TheDistantPlains|Lundgren|The royal house of Caelin has no need of a Sacaen mongrel! I’ll put an end to this foolishness here and now!|
16574|FE7|10-TheDistantPlains|Lyn|To further your own black ambitions, you’ve harmed my grandfather and the very land you ought to serve. I have neither pity nor mercy for you. Lundgren! Prepare yourself!|
16575|FE7|10-TheDistantPlains|Lundgren|Whelp!|
16576|FE7|10-TheDistantPlains|Lundgren|Ah. One of the traitors. You must be…Kent, yes?|
16577|FE7|10-TheDistantPlains|Kent|Lundgren, your treachery precedes you. I will not listen to any of your poisoned words!|
16578|FE7|10-TheDistantPlains|Lundgren|You’re a fool! You’ll wish you’d never turned your coat!|
16579|FE7|10-TheDistantPlains|Lundgren|Ah, Sain… You’re not like that stubborn fool, Kent. You’re reasonable. Leave this child, Lyndis, and stand at my side. You will go far in my service.|
16580|FE7|10-TheDistantPlains|Sain|That is a gracious offer, my lord…|
16581|FE7|10-TheDistantPlains|Lundgren|Quite…|
16582|FE7|10-TheDistantPlains|Sain|However, I am rather fond of my friend the stubborn fool. And if I am to pledge my service to any liege, I would choose lovely Lady Lyndis over Foul Lundgren, regardless of the risk!|
16583|FE7|10-TheDistantPlains|Lundgren|Fool! I will make you regret your decision!|
16584|FE7|10-TheDistantPlains|Lyn|We’ve won… At last, I can see my grandfather.|
16585|FE7|10-TheDistantPlains|Reissmann|You are Lady Lyndis, are you not?|
16586|FE7|10-TheDistantPlains|Lyn|Who are you?|
16587|FE7|10-TheDistantPlains|Reissmann|I am Reissmann, the chancellor of the Caelin royal family. I had receive word from Kent and Sain when you first met, but then Lundgren discovered the message and imprisoned me. It is my great pleasure to welcome you to your true home.|
16588|FE7|10-TheDistantPlains|Lyn|Thank you. May I see my grandfather now?|
16589|FE7|10-TheDistantPlains|Reissmann|Yes, of course. Do not be shocked by what you see. Lundgren has been poisoning the marquess’s meals for some time. His body has been ravaged… He’s been bedridden for months.|
16590|FE7|10-TheDistantPlains|Lord Hausen|Who is there? I said no visitors. I will see no one.|
16591|FE7|10-TheDistantPlains|Lyn|……|
16592|FE7|10-TheDistantPlains|Lord Hausen|What are you doing? Leave me…to die…|
16593|FE7|10-TheDistantPlains|Lyn|Um… Pardon me… My name is… I’m Lyndis.|
16594|FE7|10-TheDistantPlains|Lord Hausen|Eh? Did you say Lyndis? Is that…|
16595|FE7|10-TheDistantPlains|Lyn|My father’s name was Hassar, chieftain of the Lorca. My mother was…Madelyn. I was raised on the plains.|
16596|FE7|10-TheDistantPlains|Lord Hausen|… Could it be? Come, come here. Let me see your face.|
16597|FE7|10-TheDistantPlains|Lord Hausen|Oh… Yes… There is no doubt… You are Madelyn’s trueborn child… Uhhh…ahhhh…|
16598|FE7|10-TheDistantPlains|Lyn|Grandfather!|
16599|FE7|10-TheDistantPlains|Lord Hausen|Lundgren told me that my daughter had died. My heir…and you, too. He told me you were dead. Thank you… Thank you for living. Ahhhh… I am blessed…|
16600|FE7|10-TheDistantPlains|Lyn|Mother and Father were slain last year by brigands. I… I was the only survivor. I lived on, but…|
16601|FE7|10-TheDistantPlains|Lord Hausen|Lyndis, please forgive a prideful old man. If I had but accepted your parents’ love… There would have been no bandits. We would have lived here together in perfect peace.|
16602|FE7|10-TheDistantPlains|Lyn|Grandfather. My parents… My tribe… Our life was one of love and peace. The end was tragic, but… up until the attack, we were truly happy.|
16603|FE7|10-TheDistantPlains|Lord Hausen|Truly? Madelyn had a life of happiness? Knowing that gives me so much joy. Thank you, Lyndis. I can die in peace now…|
16604|FE7|10-TheDistantPlains|Lyn|No! Grandfather! You mustn’t say that!|
16605|FE7|10-TheDistantPlains|Lord Hausen|There’s no avoiding it, Lyndis. I’ve taken too much poison for far too long. It’s too late…|
16606|FE7|10-TheDistantPlains|Lyn|Be brave, Grandfather! You will recover! Believe me! On the plains, we say that illness fails in the face of a strong heart! I am with you now! You mustn’t give up!|
16607|FE7|10-TheDistantPlains|Lord Hausen|You’re…with me…|
16608|FE7|10-TheDistantPlains|Lyn|Yes. We have so much to talk about. Walks to take, music to listen to. There’s so much I want to do with you, so much lost time we can recover!|
16609|FE7|10-TheDistantPlains|Lord Hausen|That does sound… nice.|
16610|FE7|10-TheDistantPlains|Lyn|Doesn’t it? And once you’re well, I’ll take you to the plains. I’ll show you the endless sky, the oceans of grass… I want you to know the lands my mother loved so much!|
16611|FE7|10-TheDistantPlains|Lord Hausen|The lands Madelyn loved… You’re right. I still have… quite a bit of living to do.|
16612|FE7|10-TheDistantPlains|Lyn|You can do it, Grandfather!|
16613|FE7|10-TheDistantPlains|Lord Hausen|Lyndis…|
16614|FE7|10-TheDistantPlains|Sain|Lady Lyndis! Do you honestly plan on remaining here? Tell me truly!|
16615|FE7|10-TheDistantPlains|Lyn|Yes, until my grandfather is well. I can’t leave him now. I won’t.|
16616|FE7|10-TheDistantPlains|Kent|The physician says that Lord Hausen looks like a new man. It’s like he was never ill. And it’s all thanks to you, milady.|
16617|FE7|10-TheDistantPlains|Lyn|He’s the only family I have left. I want him to have a long life.|
16618|FE7|10-TheDistantPlains|Florina|Lady Lyndis!|
16619|FE7|10-TheDistantPlains|Lyn|What is it, Florina?|
16620|FE7|10-TheDistantPlains|Florina|I’ve been taken into service by House Caelin! From here on, Lyn… I mean, Lady Lyndis… We’ll be together always!|
16621|FE7|10-TheDistantPlains|Lyn|Really? Oh, that pleases me so…but… Please don’t call me Lady Lyndis. For you, I’m still just Lyn.|
16622|FE7|10-TheDistantPlains|Florina|My pegasus and I fly for your house now. I am your servant. There are rules to follow.|
16623|FE7|10-TheDistantPlains|Lyn|Florina!|
16624|FE7|10-TheDistantPlains|Florina|I’m happiest when I’m with you. That’s more important than how I address you… Please…|
16625|FE7|10-TheDistantPlains|Lyn|I suppose I’ll just have to get used to it, right? Very well. I understand.|
16626|FE7|10-TheDistantPlains|Florina|Oh, thank you! I do love you, Lyn!|
16627|FE7|10-TheDistantPlains|Florina|Oops! I mean… Lady Lyndis!|
16628|FE7|10-TheDistantPlains|Lyn|Ha ha ha… Oh, Florina!|
16629|FE7|10-TheDistantPlains|Wil|Lady Lyndis! I’ve decided to stay, too!|
16630|FE7|10-TheDistantPlains|Lyn|Wil? Weren’t you planning on returning home?|
16631|FE7|10-TheDistantPlains|Wil|Well, I was but… I’ve grown quite fond of Lyndis’s Legions, you know… I couldn’t possibly leave everyone behind. I’ll send word to my family regarding my decision.|
16632|FE7|10-TheDistantPlains|Lyn|I’m pleased to have you, Wil. Thank you.|
16633|FE7|10-TheDistantPlains|Wil|Thank you, milady.|
16634|FE7|10-TheDistantPlains|Lyn|Mark… you’re leaving, aren’t you? No, I’m not asking you to stay. It’s just… I’ll miss you. When I found you unconscious on the plains… I had no idea we would be together for so long. You’ve helped us so much, and I’m sure you’ve learned all you can from us. You’ll do just fine on your own. I have the utmost faith that you’ll be a master tactician, Mark. That’s from someone who’s seen you at work!|
16635|FE7|10-TheDistantPlains|Lyn|Well then, take care… I… I hope I see you again. I’m sure that I will someday…|
16636|FE7|10-TheDistantPlains|Tutorial|As of Chapter 11, Eliwood becomes the story’s main character. Mark’s role will be to act as tactician, aiding his group. Help Eliwood to fulfill the chapter goals and fight his way to the end of the game. You’ll start your first campaign with Eliwood, then meet his friend, Hector, in chapter 12. And who knows? You might even meet Lyn again. If any of these three is defeated, your game will be over. The game will continue if any other allied units are defeated. However, a defeated unit can never take part in combat again, so be careful!|
16637|FE7|03-BandOfMercenaries|Lyn|This place... It's...|
16638|FE7|03-BandOfMercenaries|Sain|The entire area is in ruins. Why doesn't their marquess do anything to help?|
16639|FE7|03-BandOfMercenaries|Lyn|Taliver Mountain is home to a gang of vicious, ruthless bandits. No marquess holds power here. My village was near here, on the other side of the mountain. My people were... The Taliver bandits came at night. It took only one night. The survivors numbered less than ten, including me. They're soulless beasts. I will never forgive them. Never.|
16640|FE7|03-BandOfMercenaries|Sain|Lyndis...|
16641|FE7|03-BandOfMercenaries|Kent|...|
16642|FE7|03-BandOfMercenaries|Lyn|I am not running away. I will be back...someday. I'll be stronger... I will break their swords beneath me like twigs beneath a stallion's hooves. I will avenge my people. I'll do everything in my power.|
16643|FE7|03-BandOfMercenaries|Sain|When the time comes, bring me with you.|
16644|FE7|03-BandOfMercenaries|Lyn|Sain.|
16645|FE7|03-BandOfMercenaries|Kent|Don't forget me, either.|
16646|FE7|03-BandOfMercenaries|Lyn|Kent...Oh! You, too, Tactician? I... You're... Thank you.|
16647|FE7|03-BandOfMercenaries|Migal|Wait right there, little lady! What are you going to do to apologize? Huh?|
16648|FE7|03-BandOfMercenaries|Florina|Uh...I...That is, I...|
16649|FE7|03-BandOfMercenaries|Brigand|Hey, she's quite a catch, eh, buddy? I bet the boss'd give us a pretty penny for her.|
16650|FE7|03-BandOfMercenaries|Migal|Yeah. She roughed me up a bit, so I figure fair's fair. It's no more'n she deserves.|
16651|FE7|03-BandOfMercenaries|Florina|I... I...|
16652|FE7|03-BandOfMercenaries|Brigand|What are we gonna do with her flying mule?|
16653|FE7|03-BandOfMercenaries|Florina|Don't you dare touch her!|
16654|FE7|03-BandOfMercenaries|Brigand|What? You just watch your mouth, girlie!|
16655|FE7|03-BandOfMercenaries|Florina|Do what you will with me, just... Let her go. Please, I beg of you.|
16656|FE7|03-BandOfMercenaries|Migal|Ha ha ha! Silly twit! Pegasi can only be found in Ilia. They're rare beasts, worth far more than you by far! We can sell it for a mountain of gold. Let it go? HA!|
16657|FE7|03-BandOfMercenaries|Florina|No, you can't...|
16658|FE7|03-BandOfMercenaries|Migal|C'mon! Let's move!|
16659|FE7|03-BandOfMercenaries|Kent|What's this? Be on your guard, Lyndis. There seems to be some sort of commotion over there.|
16660|FE7|03-BandOfMercenaries|Lyn|That's... That's a pegasus. Could it be?|
16661|FE7|03-BandOfMercenaries|Lyn (Far Off)|Florina?|
16662|FE7|03-BandOfMercenaries|Lyn|Is that you, Florina?|
16663|FE7|03-BandOfMercenaries|Florina|Ah! Lyn?|
16664|FE7|03-BandOfMercenaries|Lyn|Florina! What are you doing in a place such as this?|
16665|FE7|03-BandOfMercenaries|Florina|Lyn! Is it really you? I... I...|
16666|FE7|03-BandOfMercenaries|Lyn|Come now, no crying!|
16667|FE7|03-BandOfMercenaries|Florina|I'm sorry.|
16668|FE7|03-BandOfMercenaries|Kent|You are acquaintances?|
16669|FE7|03-BandOfMercenaries|Lyn|She's my friend. This is Florina, a pegasus knight in training from Ilia. She's a little uncomfortable around men. Tell me, Florina, what happened here?|
16670|FE7|03-BandOfMercenaries|Florina|Well...um... When I heard that you had left... I decided to follow you. Then I saw this village. I flew down to ask if they had news of you. I didn't see those two, and...well...|
16671|FE7|03-BandOfMercenaries|Lyn|Did your pegasus land on them?|
16672|FE7|03-BandOfMercenaries|Florina|Well, I... A little...|
16673|FE7|03-BandOfMercenaries|Brigand|Aha! You heard her! She admits her fault! She stepped on my friend, and now she's got to pay!|
16674|FE7|03-BandOfMercenaries|Lyn|Did you apologize, Florina?|
16675|FE7|03-BandOfMercenaries|Florina|Yes. I told them I was sorry many times over. They just wouldn't listen. ...|
16676|FE7|03-BandOfMercenaries|Lyn|Don't cry, it's alright.|
16677|FE7|03-BandOfMercenaries|Florina|Lyn...|
16678|FE7|03-BandOfMercenaries|Lyn|Listen, she's obviously sorry. Can't we just let this pass? You don't appear to be injured or anything.|
16679|FE7|03-BandOfMercenaries|Migal|No chance. The girl goes with us—by force if need be!|
16680|FE7|03-BandOfMercenaries|Migal|Hey! C'mon out now, boys! The men are fair game, but don't put a scratch on the girls!|
16681|FE7|03-BandOfMercenaries|Lyn|Tactician! We've got to fight back!|
16682|FE7|03-BandOfMercenaries|Florina|Lyn... I...|
16683|FE7|03-BandOfMercenaries|Lyn|You're a pegasus knight, aren't you? You can fight, can't you?|
16684|FE7|03-BandOfMercenaries|Florina|...Yes!|
16685|FE7|03-BandOfMercenaries|Lyn|Listen carefully, Tactician. We're facing bandits. They're underlings, but we can't take them too lightly. Let's clear them out of here. Are you ready?|
16686|FE7|03-BandOfMercenaries|Lyn|The layout around here might make it difficult to fight. The same holds true for our foe, too. If we use these walls just so, they may ensure our victory.|
16687|FE7|03-BandOfMercenaries|Florina|Lyn... Who's that?|
16688|FE7|03-BandOfMercenaries|Lyn|This is Tactician. He/She's still an apprentice, but he/she's my tactician.|
16689|FE7|03-BandOfMercenaries|Florina|Oh, I see... Uh, Tactician? I'm pleased to meet you.|
16690|FE7|03-BandOfMercenaries|Florina|Oh, I see... Well, Tactician... I'm pleased to meet you.|
16691|FE7|03-BandOfMercenaries|Tutorial|The red-roofed buildings are villages. Villages are in danger of being attacked. If an enemy unit reaches a village before one of our units does, the village will be destroyed. As quickly as possible, visit the residents and give them warning. Only good can come of it. So, let's visit them. Please select Lyn.|
16692|FE7|03-BandOfMercenaries|Lyn|You want me to visit a village? Just give me the order.|
16693|FE7|03-BandOfMercenaries|Lyn|I'm to visit a village, right? Then issue the command.|
16694|FE7|03-BandOfMercenaries|Lyn|You'd like me to visit a village, right? Just give the order!|
16695|FE7|03-BandOfMercenaries|Lyn|Is anyone there?|
16696|FE7|03-BandOfMercenaries|Villager|Leave us alone, you thugs!|
16697|FE7|03-BandOfMercenaries|Other Villager|Go away! Go away! We've no more gold for you!|
16698|FE7|03-BandOfMercenaries|Lyn|No, wait! Please! We're not bandits! We want to help the village. Please listen!|
16699|FE7|03-BandOfMercenaries|??|Remain inside, everyone. I'll go see what's happening.|
16700|FE7|03-BandOfMercenaries|Wil|Not bandits, huh? So, who are you?|
16701|FE7|03-BandOfMercenaries|Lyn|My name is Lyn. My colleagues and I are just traveling through here. We saw some bandits about. We're going to deal with them, but... We need you to go and warn the villagers.|
16702|FE7|03-BandOfMercenaries|Wil|Hey! Wait! The name's Wil. I'm a traveler of sorts, too. Listen, these villagers have been kind to me. Mind if I fight with you?|
16703|FE7|03-BandOfMercenaries|Lyn|Not at all. We need all the help we can get! Welcome aboard, Wil!|
16704|FE7|03-BandOfMercenaries|Tutorial|By visiting a village, we gained a new companion. Wil is an archer. He uses a bow to fight. Bows can be fired at foes more than 1 space away. Obstacles won't affect your line of fire. Attacking enemies without moving next to them is called indirect combat. If the enemy has no weapons capable of indirect combat, there's no fear of counterattack, and that's to our benefit. However, you cannot fire on adjacent spaces. If someone moves next to you and attacks, that's it. Units with bows are best suited to lend assistance from the rear. Let's try some indirect combat, shall we? Select Wil.|
